{
  "metadata": {
    "search_type": "competitor_search",
    "original_query": "Adidas Stan Smith vs Nike Air Force 1 vs Converse Chuck Taylor vs Puma classic white sneakers comparison",
    "timestamp": "2025-08-29T07:35:52.754730",
    "pwd": "/Users/orchidee/Documents/AI-market-agent/src",
    "saved_to": "/Users/orchidee/Documents/AI-market-agent/data/competitor_search_20250829_073552.json"
  },
  "search_results": {
    "queries": [
      {
        "search_query": "Adidas Stan Smith vs Nike Air Force 1 vs Converse Chuck Taylor vs Puma classic white sneakers comparison vs competitors comparison",
        "results_count": 10,
        "results": [
          {
            "title": "Sneaker and Activewear | adidas US",
            "content": "Find sport-specific sneakers to support your passion, and shop versatile activewear and accessories that support everyday comfort. adidas has you covered with world-class …",
            "url": "https://www.adidas.com/us"
          },
          {
            "title": "adidas Online Shop | adidas US",
            "content": "SHOP BY COLLECTION adicolor Premium Collaborations adidas by Stella McCartney Gazelle Originals Samba",
            "url": "https://www.adidas.com/us/welcome"
          },
          {
            "title": "adidas Shoes, Sneakers & Slides | adidas US",
            "content": "Shop adidas shoes for training, sport, and casual lifestyle at the official adidas online store. Browse all the hottest styles like UltraBoost, NMD, and more.",
            "url": "https://www.adidas.com/us/shoes"
          },
          {
            "title": "New Shoes | adidas US",
            "content": "Discover new shoes at adidas. Explore the latest drops combining sleek designs and ultimate comfort for everyday wear and standout style.",
            "url": "https://www.adidas.com/us/new_arrivals"
          },
          {
            "title": "Men's Shoes - adidas US",
            "content": "Shop men's shoes at adidas. Explore performance sneakers and versatile everyday pairs that blend performance-driven comfort and lifestyle appeal.",
            "url": "https://www.adidas.com/us/men-shoes"
          },
          {
            "title": "Men's Sneakers and Workout Clothes | adidas US",
            "content": "Workout with cutting-edge cushioning, or set the casual standard off the field with heritage sports style. adidas is here, and has always been, with men's workout clothes and sneakers for …",
            "url": "https://www.adidas.com/us/men"
          },
          {
            "title": "Men's Clothes & Shoes on Sale | adidas US",
            "content": "Shop men's clothes & shoes on sale at adidas. Discover stylish, comfortable essentials perfect for sports-inspired looks and everyday athleisure vibes.",
            "url": "https://www.adidas.com/us/men-sale"
          },
          {
            "title": "Women's Sneakers and Activewear | adidas US",
            "content": "Experience adidas technologies that support cool, dry comfort through intense workouts. Put your fitness first with adidas women's workout shoes and running clothes that breathe, manage …",
            "url": "https://www.adidas.com/us/women"
          },
          {
            "title": "Shop New Clothes & Shoes For Men | adidas US",
            "content": "Browse new clothes and shoes for men at adidas. Check out the latest arrivals in apparel and footwear for any sport or season.",
            "url": "https://www.adidas.com/us/men-new_arrivals"
          },
          {
            "title": "Men's Sneakers - adidas US",
            "content": "Shop the latest men's athletic shoes and sneakers from adidas. Grab a pair of slip on sneakers, classic sneakers or retro sneaker styles for men today.",
            "url": "https://www.adidas.com/us/men-athletic_sneakers"
          }
        ]
      },
      {
        "search_query": "Adidas Stan Smith vs Nike Air Force 1 vs Converse Chuck Taylor vs Puma classic white sneakers comparison market share analysis 2025",
        "results_count": 10,
        "results": [
          {
            "title": "CONVERSE CHUCK TAYLOR 70 VS ALL STARS ! - YouTube",
            "content": "The Converse Chuck Taylor All Star is one of the most recognizable sneaker silhouettes in history. This classic sneaker has spanned generations and solidifie...",
            "url": "https://www.youtube.com/watch?v=dUAN99HEbwE"
          },
          {
            "title": "Стоит ли ходить с подворотами в 2025 году?",
            "content": "Nike Air Force 1 – универсальный силуэт, который идеально сочетается с подворотами.New Balance 550 – ретро-модель, которая органично смотрится в casual и streetwear образах. Puma Suede – классика, которая отлично дополняет подвёрнутые джинсы.",
            "url": "https://xn--80awro.xn--p1ai/news/stoit-li-khodit-s-podvorotami-v-2025-godu"
          },
          {
            "title": "15 Best White Sneakers for Men 2025 , According to GQ Editors | GQ",
            "content": "The Best White Sneaker for Adidas Stans : Adidas Samba LT Shoes, $120.Far, far gone from its tennis originas, the Stan Smiths are the shoe for lowkey creatives. Bleach- white , with a rounded toe, they were the sneakers that begat minimalist sneakers .",
            "url": "https://www.gq.com/story/best-white-sneakers"
          },
          {
            "title": "ТОП-10 Кроссовок на осень 2025",
            "content": "Adidas Samba. Nike Air Force 1 . Кто еще не теряет популярности? Nike Air Jordan 1. Vans Old Skool. Converse Chuck Taylor . Asics Gel-Kayano 14. New Balance 9060.",
            "url": "https://outmaxshop.ru/article/2499-top-10-krossovok-na-osen-2025"
          },
          {
            "title": "Как отличить оригинальные кроссовки nike от подделки?",
            "content": "В этой статье, мы расскажем Вам, как же всё-таки отличить оригинальные кроссовки Nike от подделки.",
            "url": "https://insneaker.ru/blogs/blog/fourth"
          },
          {
            "title": "Топ-13 лучших кроссовок adidas : рейтинг 2025",
            "content": "Кроссовки adidas Stan Originals Stan Smith .Самые удобные кроссовки на каждый день: Puma , New Balance, adidas .",
            "url": "https://dolyame.ru/media/adidas-best-sneakers/"
          },
          {
            "title": "Nike Release Dates 2025 - Updated in Real Time",
            "content": "The iconic Nike Air Force 1 followed in 1982 and also introduced the first six basketball-sponsored athletes wearing the sneaker on-court in the NBA.",
            "url": "https://www.soleretriever.com/sneaker-release-dates/nike"
          },
          {
            "title": "Adidas Samba Real vs . Fake Guide 2025 : How Can I Tell If... - Extrabux",
            "content": "Adidas Samba vs . Spezial vs . Stan Smith vs . Grand Court: Differences and Reivews 2025 .Recommendation. Apple Watch Ultra 2 Real vs . Fake Guide 2025 : How To Tell Original From Fake? Microsoft 365 A 1 vs . A3 vs . A5: Full Comparison & Verdict 2025 .",
            "url": "https://www.extrabux.com/en/guide/8295001"
          },
          {
            "title": "Stan smith vs af 1 2025",
            "content": "Comparativa Adidas Stan Smith vs Nike Air Force 1 Runnea Very well made. C.",
            "url": "https://ohranatruda.of.by/?o=491503714"
          },
          {
            "title": "ТОП-30 классических кроссовок — SHOPOZZ",
            "content": "Такие бренды, как Nike Air Max 1 , Adidas Samba, Converse Chuck Taylor All-Star, Reebok Classic Leather, Vans Old Skool, знакомы каждому. Они пережили не один модный виток, но сохранили свою популярность.кроссовки Adidas Originals Stan Smith .",
            "url": "https://shopozz.ru/article/view/top-30-klassicheskih-krossovok"
          }
        ]
      },
      {
        "search_query": "Adidas Stan Smith vs Nike Air Force 1 vs Converse Chuck Taylor vs Puma classic white sneakers comparison competitive landscape sneaker market",
        "results_count": 10,
        "results": [
          {
            "title": "Wikipedia Converse (brand) - Wikipedia",
            "content": "2 weeks ago - He was replaced by Aaron Cain, ... of Nike Global Men's business. Converse sparked renewed popularity among teens in 2025, driven in part by a limited-edition collaboration with pop star Charli XCX. Starting in July 2008, Converse sent around 180 cease-and-desist letters to over 30 companies that they claimed were violating the Chuck Taylor All-Stars trademark and selling so-called look-alike sneakers ...",
            "url": "https://en.wikipedia.org/wiki/Converse_(brand)"
          },
          {
            "title": "NYTimes Stylish (and Comfy) White Sneakers We’ll Be Wearing All Year",
            "content": "June 5, 2025 - A great pair of white sneakers should look as good as it feels. These eight stylish pairs — in women’s, men’s, and unisex sizes — are our favorites.",
            "url": "https://www.nytimes.com/wirecutter/reviews/best-white-sneakers/"
          },
          {
            "title": "Solereview The best white sneakers for men",
            "content": "November 17, 2021 - The Stan Smith is excellent value for its $80 MSRP . A waterproof Gore-Tex version is also occasionally found for a $20 price premium. ... The adidas Superstar is a case study in original influencer marketing – long before the era of Instagram.",
            "url": "https://www.solereview.com/best-white-sneakers-for-men/"
          },
          {
            "title": "Sportskeeda Which are the best white sneakers?",
            "content": "November 4, 2022 - White sneakers have traditionally been the most desirable asset in sneakerheads' collections.",
            "url": "https://www.sportskeeda.com/pop-culture/which-best-white-sneakers"
          },
          {
            "title": "Footwear News 14 Best White Sneakers for Men 2024, - Tested by a ...",
            "content": "Footwear News is a leading shoe publisher reporting on the latest in shoe industry business, sneaker trends, fashion news and celebrity style.",
            "url": "https://footwearnews.com/gallery/all-white-mens-sneakers/"
          },
          {
            "title": "RunRepeat 6 Best Tennis Sneakers in 2025 | RunRepeat",
            "content": "July 20, 2025 - The 6 best tennis sneakers based on extensive wear and lab testing. We award the best overall, best minimalist, best lightweight, best classic , best platform and best vintage.",
            "url": "https://runrepeat.com/guides/best-tennis-sneakers"
          },
          {
            "title": "RealSport101 Air Force 1 vs Stan Smith: Which should you buy?",
            "content": "January 15, 2025 - On the other hand, Stan Smith sneakers have a lower-cut design and relatively thinner midsoles , which might not provide as much support as Air Force 1s do for everyday wear. It is worth noting though that recent Stan Smith releases have been made out of recycled content as part of adidas' ...",
            "url": "https://realsport101.com/article/air-force-1-vs-stan-smith-which-should-you-buy"
          },
          {
            "title": "Tatler Asia Shop: 7 Classic White Sneakers You Should Have In Your Wardrobe | Tatler Asia",
            "content": "October 6, 2021 - Adding to its sophisticated design ... are looking for the perfect white sneaker that can make your outfit look hip and funky, then Nike Air Force 1 is the one that you are looking for ....",
            "url": "https://www.tatlerasia.com/style/fashion/seven-classic-sneakers-every-sneakerhead-must-have"
          },
          {
            "title": "Hockerty The Best Sneakers for Men: 20 Iconic Brands You Need to Know - Hockerty",
            "content": "February 14, 2025 - The Nike Air Force 1, Air Max series, and Jordan line continue to be highly sought-after for their style, comfort, and cultural influence . Adidas also has some of the most popular sneakers, including the Samba and Stan Smith, which have become staples in both casual and semi-formal fashion.",
            "url": "https://www.hockerty.com/en-us/blog/best-sneakers-for-men"
          },
          {
            "title": "TheWearDuke Converse vs Adidas: What's the Difference? | TheWearDuke",
            "content": "February 12, 2024 - The silhouette of chuck Taylors has a massive influence on not only basketball but fashion as a whole is unmatched. The main difference between the Converse sneakers and Adidas Superstars is the material of the upper . Previously, Adidas Stansmith and Superstars were made of natural leather upper.",
            "url": "https://www.thewearduke.com/converse-vs-adidas/"
          }
        ]
      }
    ],
    "total_results": 30
  },
  "formatted_output": "COMPETITOR SEARCH: Adidas Stan Smith vs Nike Air Force 1 vs Converse Chuck Taylor vs Puma classic white sneakers comparison vs competitors comparison\nRESULT 1:\nTitle: Sneaker and Activewear | adidas US\nContent: Find sport-specific sneakers to support your passion, and shop versatile activewear and accessories that support everyday comfort. adidas has you covered with world-class …\nURL: https://www.adidas.com/us\n---\n\nCOMPETITOR SEARCH: Adidas Stan Smith vs Nike Air Force 1 vs Converse Chuck Taylor vs Puma classic white sneakers comparison vs competitors comparison\nRESULT 2:\nTitle: adidas Online Shop | adidas US\nContent: SHOP BY COLLECTION adicolor Premium Collaborations adidas by Stella McCartney Gazelle Originals Samba\nURL: https://www.adidas.com/us/welcome\n---\n\nCOMPETITOR SEARCH: Adidas Stan Smith vs Nike Air Force 1 vs Converse Chuck Taylor vs Puma classic white sneakers comparison vs competitors comparison\nRESULT 3:\nTitle: adidas Shoes, Sneakers & Slides | adidas US\nContent: Shop adidas shoes for training, sport, and casual lifestyle at the official adidas online store. Browse all the hottest styles like UltraBoost, NMD, and more.\nURL: https://www.adidas.com/us/shoes\n---\n\nCOMPETITOR SEARCH: Adidas Stan Smith vs Nike Air Force 1 vs Converse Chuck Taylor vs Puma classic white sneakers comparison vs competitors comparison\nRESULT 4:\nTitle: New Shoes | adidas US\nContent: Discover new shoes at adidas. Explore the latest drops combining sleek designs and ultimate comfort for everyday wear and standout style.\nURL: https://www.adidas.com/us/new_arrivals\n---\n\nCOMPETITOR SEARCH: Adidas Stan Smith vs Nike Air Force 1 vs Converse Chuck Taylor vs Puma classic white sneakers comparison vs competitors comparison\nRESULT 5:\nTitle: Men's Shoes - adidas US\nContent: Shop men's shoes at adidas. Explore performance sneakers and versatile everyday pairs that blend performance-driven comfort and lifestyle appeal.\nURL: https://www.adidas.com/us/men-shoes\n---\n\nCOMPETITOR SEARCH: Adidas Stan Smith vs Nike Air Force 1 vs Converse Chuck Taylor vs Puma classic white sneakers comparison vs competitors comparison\nRESULT 6:\nTitle: Men's Sneakers and Workout Clothes | adidas US\nContent: Workout with cutting-edge cushioning, or set the casual standard off the field with heritage sports style. adidas is here, and has always been, with men's workout clothes and sneakers for …\nURL: https://www.adidas.com/us/men\n---\n\nCOMPETITOR SEARCH: Adidas Stan Smith vs Nike Air Force 1 vs Converse Chuck Taylor vs Puma classic white sneakers comparison vs competitors comparison\nRESULT 7:\nTitle: Men's Clothes & Shoes on Sale | adidas US\nContent: Shop men's clothes & shoes on sale at adidas. Discover stylish, comfortable essentials perfect for sports-inspired looks and everyday athleisure vibes.\nURL: https://www.adidas.com/us/men-sale\n---\n\nCOMPETITOR SEARCH: Adidas Stan Smith vs Nike Air Force 1 vs Converse Chuck Taylor vs Puma classic white sneakers comparison vs competitors comparison\nRESULT 8:\nTitle: Women's Sneakers and Activewear | adidas US\nContent: Experience adidas technologies that support cool, dry comfort through intense workouts. Put your fitness first with adidas women's workout shoes and running clothes that breathe, manage …\nURL: https://www.adidas.com/us/women\n---\n\nCOMPETITOR SEARCH: Adidas Stan Smith vs Nike Air Force 1 vs Converse Chuck Taylor vs Puma classic white sneakers comparison vs competitors comparison\nRESULT 9:\nTitle: Shop New Clothes & Shoes For Men | adidas US\nContent: Browse new clothes and shoes for men at adidas. Check out the latest arrivals in apparel and footwear for any sport or season.\nURL: https://www.adidas.com/us/men-new_arrivals\n---\n\nCOMPETITOR SEARCH: Adidas Stan Smith vs Nike Air Force 1 vs Converse Chuck Taylor vs Puma classic white sneakers comparison vs competitors comparison\nRESULT 10:\nTitle: Men's Sneakers - adidas US\nContent: Shop the latest men's athletic shoes and sneakers from adidas. Grab a pair of slip on sneakers, classic sneakers or retro sneaker styles for men today.\nURL: https://www.adidas.com/us/men-athletic_sneakers\n---\n\nCOMPETITOR SEARCH: Adidas Stan Smith vs Nike Air Force 1 vs Converse Chuck Taylor vs Puma classic white sneakers comparison market share analysis 2025\nRESULT 1:\nTitle: CONVERSE CHUCK TAYLOR 70 VS ALL STARS ! - YouTube\nContent: The Converse Chuck Taylor All Star is one of the most recognizable sneaker silhouettes in history. This classic sneaker has spanned generations and solidifie...\nURL: https://www.youtube.com/watch?v=dUAN99HEbwE\n---\n\nCOMPETITOR SEARCH: Adidas Stan Smith vs Nike Air Force 1 vs Converse Chuck Taylor vs Puma classic white sneakers comparison market share analysis 2025\nRESULT 2:\nTitle: Стоит ли ходить с подворотами в 2025 году?\nContent: Nike Air Force 1 – универсальный силуэт, который идеально сочетается с подворотами.New Balance 550 – ретро-модель, которая органично смотрится в casual и streetwear образах. Puma Suede – классика, которая отлично дополняет подвёрнутые джинсы.\nURL: https://xn--80awro.xn--p1ai/news/stoit-li-khodit-s-podvorotami-v-2025-godu\n---\n\nCOMPETITOR SEARCH: Adidas Stan Smith vs Nike Air Force 1 vs Converse Chuck Taylor vs Puma classic white sneakers comparison market share analysis 2025\nRESULT 3:\nTitle: 15 Best White Sneakers for Men 2025 , According to GQ Editors | GQ\nContent: The Best White Sneaker for Adidas Stans : Adidas Samba LT Shoes, $120.Far, far gone from its tennis originas, the Stan Smiths are the shoe for lowkey creatives. Bleach- white , with a rounded toe, they were the sneakers that begat minimalist sneakers .\nURL: https://www.gq.com/story/best-white-sneakers\n---\n\nCOMPETITOR SEARCH: Adidas Stan Smith vs Nike Air Force 1 vs Converse Chuck Taylor vs Puma classic white sneakers comparison market share analysis 2025\nRESULT 4:\nTitle: ТОП-10 Кроссовок на осень 2025\nContent: Adidas Samba. Nike Air Force 1 . Кто еще не теряет популярности? Nike Air Jordan 1. Vans Old Skool. Converse Chuck Taylor . Asics Gel-Kayano 14. New Balance 9060.\nURL: https://outmaxshop.ru/article/2499-top-10-krossovok-na-osen-2025\n---\n\nCOMPETITOR SEARCH: Adidas Stan Smith vs Nike Air Force 1 vs Converse Chuck Taylor vs Puma classic white sneakers comparison market share analysis 2025\nRESULT 5:\nTitle: Как отличить оригинальные кроссовки nike от подделки?\nContent: В этой статье, мы расскажем Вам, как же всё-таки отличить оригинальные кроссовки Nike от подделки.\nURL: https://insneaker.ru/blogs/blog/fourth\n---\n\nCOMPETITOR SEARCH: Adidas Stan Smith vs Nike Air Force 1 vs Converse Chuck Taylor vs Puma classic white sneakers comparison market share analysis 2025\nRESULT 6:\nTitle: Топ-13 лучших кроссовок adidas : рейтинг 2025\nContent: Кроссовки adidas Stan Originals Stan Smith .Самые удобные кроссовки на каждый день: Puma , New Balance, adidas .\nURL: https://dolyame.ru/media/adidas-best-sneakers/\n---\n\nCOMPETITOR SEARCH: Adidas Stan Smith vs Nike Air Force 1 vs Converse Chuck Taylor vs Puma classic white sneakers comparison market share analysis 2025\nRESULT 7:\nTitle: Nike Release Dates 2025 - Updated in Real Time\nContent: The iconic Nike Air Force 1 followed in 1982 and also introduced the first six basketball-sponsored athletes wearing the sneaker on-court in the NBA.\nURL: https://www.soleretriever.com/sneaker-release-dates/nike\n---\n\nCOMPETITOR SEARCH: Adidas Stan Smith vs Nike Air Force 1 vs Converse Chuck Taylor vs Puma classic white sneakers comparison market share analysis 2025\nRESULT 8:\nTitle: Adidas Samba Real vs . Fake Guide 2025 : How Can I Tell If... - Extrabux\nContent: Adidas Samba vs . Spezial vs . Stan Smith vs . Grand Court: Differences and Reivews 2025 .Recommendation. Apple Watch Ultra 2 Real vs . Fake Guide 2025 : How To Tell Original From Fake? Microsoft 365 A 1 vs . A3 vs . A5: Full Comparison & Verdict 2025 .\nURL: https://www.extrabux.com/en/guide/8295001\n---\n\nCOMPETITOR SEARCH: Adidas Stan Smith vs Nike Air Force 1 vs Converse Chuck Taylor vs Puma classic white sneakers comparison market share analysis 2025\nRESULT 9:\nTitle: Stan smith vs af 1 2025\nContent: Comparativa Adidas Stan Smith vs Nike Air Force 1 Runnea Very well made. C.\nURL: https://ohranatruda.of.by/?o=491503714\n---\n\nCOMPETITOR SEARCH: Adidas Stan Smith vs Nike Air Force 1 vs Converse Chuck Taylor vs Puma classic white sneakers comparison market share analysis 2025\nRESULT 10:\nTitle: ТОП-30 классических кроссовок — SHOPOZZ\nContent: Такие бренды, как Nike Air Max 1 , Adidas Samba, Converse Chuck Taylor All-Star, Reebok Classic Leather, Vans Old Skool, знакомы каждому. Они пережили не один модный виток, но сохранили свою популярность.кроссовки Adidas Originals Stan Smith .\nURL: https://shopozz.ru/article/view/top-30-klassicheskih-krossovok\n---\n\nCOMPETITOR SEARCH: Adidas Stan Smith vs Nike Air Force 1 vs Converse Chuck Taylor vs Puma classic white sneakers comparison competitive landscape sneaker market\nRESULT 1:\nTitle: Wikipedia Converse (brand) - Wikipedia\nContent: 2 weeks ago - He was replaced by Aaron Cain, ... of Nike Global Men's business. Converse sparked renewed popularity among teens in 2025, driven in part by a limited-edition collaboration with pop star Charli XCX. Starting in July 2008, Converse sent around 180 cease-and-desist letters to over 30 companies that they claimed were violating the Chuck Taylor All-Stars trademark and selling so-called look-alike sneakers ...\nURL: https://en.wikipedia.org/wiki/Converse_(brand)\n---\n\nCOMPETITOR SEARCH: Adidas Stan Smith vs Nike Air Force 1 vs Converse Chuck Taylor vs Puma classic white sneakers comparison competitive landscape sneaker market\nRESULT 2:\nTitle: NYTimes Stylish (and Comfy) White Sneakers We’ll Be Wearing All Year\nContent: June 5, 2025 - A great pair of white sneakers should look as good as it feels. These eight stylish pairs — in women’s, men’s, and unisex sizes — are our favorites.\nURL: https://www.nytimes.com/wirecutter/reviews/best-white-sneakers/\n---\n\nCOMPETITOR SEARCH: Adidas Stan Smith vs Nike Air Force 1 vs Converse Chuck Taylor vs Puma classic white sneakers comparison competitive landscape sneaker market\nRESULT 3:\nTitle: Solereview The best white sneakers for men\nContent: November 17, 2021 - The Stan Smith is excellent value for its $80 MSRP . A waterproof Gore-Tex version is also occasionally found for a $20 price premium. ... The adidas Superstar is a case study in original influencer marketing – long before the era of Instagram.\nURL: https://www.solereview.com/best-white-sneakers-for-men/\n---\n\nCOMPETITOR SEARCH: Adidas Stan Smith vs Nike Air Force 1 vs Converse Chuck Taylor vs Puma classic white sneakers comparison competitive landscape sneaker market\nRESULT 4:\nTitle: Sportskeeda Which are the best white sneakers?\nContent: November 4, 2022 - White sneakers have traditionally been the most desirable asset in sneakerheads' collections.\nURL: https://www.sportskeeda.com/pop-culture/which-best-white-sneakers\n---\n\nCOMPETITOR SEARCH: Adidas Stan Smith vs Nike Air Force 1 vs Converse Chuck Taylor vs Puma classic white sneakers comparison competitive landscape sneaker market\nRESULT 5:\nTitle: Footwear News 14 Best White Sneakers for Men 2024, - Tested by a ...\nContent: Footwear News is a leading shoe publisher reporting on the latest in shoe industry business, sneaker trends, fashion news and celebrity style.\nURL: https://footwearnews.com/gallery/all-white-mens-sneakers/\n---\n\nCOMPETITOR SEARCH: Adidas Stan Smith vs Nike Air Force 1 vs Converse Chuck Taylor vs Puma classic white sneakers comparison competitive landscape sneaker market\nRESULT 6:\nTitle: RunRepeat 6 Best Tennis Sneakers in 2025 | RunRepeat\nContent: July 20, 2025 - The 6 best tennis sneakers based on extensive wear and lab testing. We award the best overall, best minimalist, best lightweight, best classic , best platform and best vintage.\nURL: https://runrepeat.com/guides/best-tennis-sneakers\n---\n\nCOMPETITOR SEARCH: Adidas Stan Smith vs Nike Air Force 1 vs Converse Chuck Taylor vs Puma classic white sneakers comparison competitive landscape sneaker market\nRESULT 7:\nTitle: RealSport101 Air Force 1 vs Stan Smith: Which should you buy?\nContent: January 15, 2025 - On the other hand, Stan Smith sneakers have a lower-cut design and relatively thinner midsoles , which might not provide as much support as Air Force 1s do for everyday wear. It is worth noting though that recent Stan Smith releases have been made out of recycled content as part of adidas' ...\nURL: https://realsport101.com/article/air-force-1-vs-stan-smith-which-should-you-buy\n---\n\nCOMPETITOR SEARCH: Adidas Stan Smith vs Nike Air Force 1 vs Converse Chuck Taylor vs Puma classic white sneakers comparison competitive landscape sneaker market\nRESULT 8:\nTitle: Tatler Asia Shop: 7 Classic White Sneakers You Should Have In Your Wardrobe | Tatler Asia\nContent: October 6, 2021 - Adding to its sophisticated design ... are looking for the perfect white sneaker that can make your outfit look hip and funky, then Nike Air Force 1 is the one that you are looking for ....\nURL: https://www.tatlerasia.com/style/fashion/seven-classic-sneakers-every-sneakerhead-must-have\n---\n\nCOMPETITOR SEARCH: Adidas Stan Smith vs Nike Air Force 1 vs Converse Chuck Taylor vs Puma classic white sneakers comparison competitive landscape sneaker market\nRESULT 9:\nTitle: Hockerty The Best Sneakers for Men: 20 Iconic Brands You Need to Know - Hockerty\nContent: February 14, 2025 - The Nike Air Force 1, Air Max series, and Jordan line continue to be highly sought-after for their style, comfort, and cultural influence . Adidas also has some of the most popular sneakers, including the Samba and Stan Smith, which have become staples in both casual and semi-formal fashion.\nURL: https://www.hockerty.com/en-us/blog/best-sneakers-for-men\n---\n\nCOMPETITOR SEARCH: Adidas Stan Smith vs Nike Air Force 1 vs Converse Chuck Taylor vs Puma classic white sneakers comparison competitive landscape sneaker market\nRESULT 10:\nTitle: TheWearDuke Converse vs Adidas: What's the Difference? | TheWearDuke\nContent: February 12, 2024 - The silhouette of chuck Taylors has a massive influence on not only basketball but fashion as a whole is unmatched. The main difference between the Converse sneakers and Adidas Superstars is the material of the upper . Previously, Adidas Stansmith and Superstars were made of natural leather upper.\nURL: https://www.thewearduke.com/converse-vs-adidas/\n---\n"
}