{
  "metadata": {
    "search_type": "competitor_search",
    "original_query": "Adidas Stan Smith market positioning classic white sneakers competitive advantages Nike Air Force 1 Converse",
    "timestamp": "2025-08-29T09:03:42.191042",
    "pwd": "/Users/orchidee/Documents/AI-market-agent/src",
    "saved_to": "/Users/orchidee/Documents/AI-market-agent/data/competitor_search_20250829_090342.json"
  },
  "search_results": {
    "queries": [
      {
        "search_query": "Adidas Stan Smith market positioning classic white sneakers competitive advantages Nike Air Force 1 Converse vs competitors comparison",
        "results_count": 10,
        "results": [
          {
            "title": "Stan Smith Shoes | adidas US",
            "content": "Shop Stan Smith shoes at adidas . Iconic style meets comfort in these classic sneakers , perfect for casual wear and your most fashion-forward outfits.",
            "url": "https://www.adidas.com/us/stan_smith"
          },
          {
            "title": "15 Best White Sneakers for Men 2025, According to GQ Editors | GQ",
            "content": "The Best White Sneaker for Adidas Stans : Adidas Samba LT Shoes, $120.Far, far gone from its tennis originas, the Stan Smiths are the shoe for lowkey creatives. Bleach- white , with a rounded toe, they were the sneakers that begat minimalist sneakers .",
            "url": "https://www.gq.com/story/best-white-sneakers"
          },
          {
            "title": "Как отличить оригинальные кроссовки nike от подделки?",
            "content": "Nike . Air Force 1 .Перед вами коробка от Кроссовок Nike Dunk Low Retro «Black/ White » DD1391-100. photo_2023-06-26_23-49-52.jpg. Есть 2 момента, на которые необходимо обратить внимание",
            "url": "https://insneaker.ru/blogs/blog/fourth"
          },
          {
            "title": "The Top 20 Nike Air Force 1 's of All Time",
            "content": "Buy Nike Air Force 1 Jewel. 12. Air Force 1 “Shady Records”.You can’t beat white on white AF 1 ’s – they’re everything a sneaker is supposed to be. They may not be covered in elaborate patterns, or be a head turning colourway but they do exactly what they’re meant to do and perfectly.",
            "url": "https://outsons.com/20-best-air-force-1s-of-all-time/"
          },
          {
            "title": "Nike Air Force : купить в Poizon кроссовки Найк Аир Форс...",
            "content": "Кроссовки Nike Air Force оригинальные с доставкой по Москве и всей России. Купите мужские кроссовки Nike Air Force оригинал в каталоге PoizonShop. Гарантия, возврат, низкие цены.",
            "url": "https://poizonshop.ru/sneakers/nike/airforce"
          },
          {
            "title": "nike air force 1 чб - Купить недорого одежду и обувь во всех...",
            "content": "Nike air force air max 1 90 270 97 shox travis clot gtx goretex dunk safari black white strangelove travis off white virgil чб черно белые mummy air max tn plus air jordan 1 high mid low OG zoom.",
            "url": "https://www.Avito.ru/all/odezhda_obuv_aksessuary?q=nike+air+force+1+чб"
          },
          {
            "title": "An Updated Nike Air Force 1 Arrives In... - SneakerNews.com",
            "content": "The “Obsidian/Photo Blue” Air Force 1 does just that, drawing within the lines in terms of its colorway while adding something extra in its construction. This pair doesn’t come with an updated model name, but bears a few features adopted from the Air Force 1 utility line from 2018.",
            "url": "https://sneakernews.com/2024/02/01/nike-air-force-1-low-white-obsidian-photo-blue-hf3836/"
          },
          {
            "title": "Air Force 1 Legit Check: Original Vs Fake AF 1 (2025)",
            "content": "Fake Vs Real Nike Air Force 1 – Rear Details. The back of the shoe reveals a lot. First, check the Swoosh. Comparison of an authentic and fake pair of Air Force 1 s from the side. Nike Air Force 1 Legit Check – Side Perforations.",
            "url": "https://legitcheck.app/guides/nike/air-force-1/how-to-spot-fake-nike-af1/"
          },
          {
            "title": "ТОП-10 Кроссовок на осень 2025",
            "content": "Adidas Samba. Nike Air Force 1 . Кто еще не теряет популярности? Конечно же, белые Найк Эйр Форс 1. Эту пару полюбили за универсальный и минималистичный дизайн. Nike Air Jordan 1. Vans Old Skool. Converse Chuck Taylor. Asics Gel-Kayano 14.",
            "url": "https://outmaxshop.ru/article/2499-top-10-krossovok-na-osen-2025"
          },
          {
            "title": "С какими кроссовками можно носить длинные носки?",
            "content": "Adidas Samba, Converse Chuck Taylor или Puma Suede отлично смотрятся с белыми носками.Часто задаваемые вопросы. Можно ли носить длинные носки с шортами? Да, особенно если сочетать их с классическими кроссовками, например, Nike Air Force 1 .",
            "url": "https://xn--80awro.xn--p1ai/news/s-kakimi-krossovkami-mozhno-nosit-dlinnye-noski"
          }
        ]
      },
      {
        "search_query": "Adidas Stan Smith market positioning classic white sneakers competitive advantages Nike Air Force 1 Converse market share analysis 2025",
        "results_count": 10,
        "results": [
          {
            "title": "Adidas Stan Smith - Wikipedia",
            "content": "Adidas Stan Smith is a tennis shoe made by Adidas , and first launched in 1965. Originally named \" Adidas Robert Haillet\" after the brand endorsed French prominent player Robert Haillet, in 1978 the sneakers were renamed after Stan Smith ...",
            "url": "https://en.wikipedia.org/wiki/Adidas_Stan_Smith"
          },
          {
            "title": "Stan Smith Shoes | adidas US",
            "content": "The iconic Stan Smith shoes from adidas first hit the scene as a performance tennis shoe. Nowadays, these sneakers from adidas Originals are a staple of streetwear fashion. From the perforated 3-Stripes to the branded heel patch and tongue label...",
            "url": "https://www.adidas.com/us/stan_smith"
          },
          {
            "title": "15 Best White Sneakers for Men 2025 , According to GQ Editors | GQ",
            "content": "The Best White Sneaker for Adidas Stans : Adidas Samba LT Shoes, $120.Far, far gone from its tennis originas, the Stan Smiths are the shoe for lowkey creatives. Bleach- white , with a rounded toe, they were the sneakers that begat minimalist sneakers .",
            "url": "https://www.gq.com/story/best-white-sneakers"
          },
          {
            "title": "Nike Air Force 1 Release Dates 2025 - Updated in Real Time",
            "content": "Upcoming Nike Air Force 1 sneaker releases and sneaker raffles.The Nike Air Force 1 is an iconic sneaker that was first released in 1982. Designed by Bruce Kilgore as a basketball sneaker , the AF 1 is known for its distinctive design and signature Air cushioning technology.",
            "url": "https://www.soleretriever.com/sneaker-release-dates/nike/nike-air-force-1"
          },
          {
            "title": "adidas Stan Smith Tre-Tongue Rose Tone H03924 | SneakerNews.com",
            "content": "Overall, the design reps a feminine Off- White and Rose Tone color scheme that is both versatile and subtle enough for the “Tre-Tongue” details to take center stage. Enjoy official images of the Stan Smith “Tre-Tongue” below, which is available now at adidas .com for $90.",
            "url": "https://sneakernews.com/2021/09/08/adidas-stan-smith-tre-tongue-off-white-rose-tone-off-white-h03924/?noamp=mobile"
          },
          {
            "title": "ТОП-40 лучших мужских кроссовок 2025 — SHOPOZZ",
            "content": "Nike Air Force 1 '07 White Low Sneakers Unise... 13 690 ₽ Mens Waterproof Safety Shoes Composite toe Work Boots Indestructible Sneakers .",
            "url": "https://shopozz.ru/article/view/top-50-luchshih-muzhskih-krossovok-2023"
          },
          {
            "title": "Кеды Nike Air Force 1 купить с доставкой, цена на кроссовки...",
            "content": "У нас широкий выбор классических и высоких кед и кроссовок Nike Air Force 1 для взрослых и детей. Спешите купить обувь по разумной цене в интернет-магазине Спортмастер. Модели подойдут для активного отдыха.",
            "url": "https://www.Sportmaster.ru/catalog/kedy_/?f-ware_line_ishop=ware_line_ishop_nike_air_force_1"
          },
          {
            "title": "За что любят классические кроссовки Adidas Superstar",
            "content": "В так называемом «капсульном списке обуви» модных стилистов Superstar стоят рядом с белыми Stan Smith , Converse Chuck Taylor и Nike Air Force 1 . Все они — базовые модели, но Superstar выделяются благодаря культовому носку-«ракушке»...",
            "url": "https://outmaxshop.ru/trend25/17-news/2497-za-chto-lyubyat-klassicheskie-krossovki-adidas-superstar"
          },
          {
            "title": "Nike Air Force 1 Low: Лучшие Аир Форсы от классики до...",
            "content": "Nike Air Force 1 Low « Classics ». Любителям ретро-дизайна и винила определенно придется по вкусу расцветка « Classics ». Модель посвящена 50-летию хип-хопа, записям песен и микстейпам и оформлена в нейтральных белом, “состаренном” бежевом и темно-сером оттенках.",
            "url": "https://sneakerfreak.ru/nike-air-force-1-top-sneakers/"
          },
          {
            "title": "LEGO Turned Nike ’s Techy Air Max Sneaker Into LEGO Bricks",
            "content": "LEGO & Nike 's Air Max Dn sneaker is almost everything LEGO fans could ever want. Adidas sort of got it right with its Ultra Boost DNA LEGO and the Stan Smith collab, which featured semi-attachable parts. Even modders have added LEGO plates to sneakers for years.",
            "url": "https://www.highsnobiety.com/p/lego-nike-air-max-dn-2025/"
          }
        ]
      },
      {
        "search_query": "Adidas Stan Smith market positioning classic white sneakers competitive advantages Nike Air Force 1 Converse competitive landscape sneaker market",
        "results_count": 10,
        "results": [
          {
            "title": "Sneaker and Activewear | adidas US",
            "content": "Gear up for your favorite sport with adidas sneakers and activewear for men and women. From running to soccer and the gym to the trail, performance workout clothes and shoes keep you …",
            "url": "https://www.adidas.com/us?msockid=234543c5aa9d68fb20535592ab566996"
          },
          {
            "title": "Men's Shoes - adidas US",
            "content": "Shop men's shoes at adidas. Explore performance sneakers and versatile everyday pairs that blend performance-driven comfort and lifestyle appeal.",
            "url": "https://www.adidas.com/us/men-shoes?msockid=234543c5aa9d68fb20535592ab566996"
          },
          {
            "title": "Men's Sneakers and Workout Clothes | adidas US",
            "content": "Workout with cutting-edge cushioning, or set the casual standard off the field with heritage sports style. adidas is here, and has always been, with men's workout clothes and sneakers for …",
            "url": "https://www.adidas.com/us/men?msockid=234543c5aa9d68fb20535592ab566996"
          },
          {
            "title": "Shop browse | adidas US",
            "content": "Find your adidas browse at adidas.com. All styles and colors available in the official adidas online store.",
            "url": "https://www.adidas.com/us/browse?msockid=234543c5aa9d68fb20535592ab566996"
          },
          {
            "title": "adidas Online Shop | adidas US",
            "content": "SHOP BY COLLECTION adicolor Premium Collaborations adidas by Stella McCartney Gazelle Originals Samba",
            "url": "https://www.adidas.com/us/welcome?msockid=234543c5aa9d68fb20535592ab566996"
          },
          {
            "title": "Women's Sneakers and Activewear | adidas US",
            "content": "Experience adidas technologies that support cool, dry comfort through intense workouts. Put your fitness first with adidas women's workout shoes and running clothes that breathe, manage …",
            "url": "https://www.adidas.com/us/women?msockid=234543c5aa9d68fb20535592ab566996"
          },
          {
            "title": "Clothes & Shoes on Sale | adidas US",
            "content": "Shop clothes & shoes on sale at adidas. Discover stylish and comfortable everyday essentials, from trendy sneakers to versatile athleisure apparel.",
            "url": "https://www.adidas.com/us/sale?msockid=234543c5aa9d68fb20535592ab566996"
          },
          {
            "title": "Kids' Sneakers and Activewear - adidas US",
            "content": "Support your young athlete’s performance with kid’s sneakers from adidas. Kids deserve the best in comfort and style.",
            "url": "https://www.adidas.com/us/kids?msockid=234543c5aa9d68fb20535592ab566996"
          },
          {
            "title": "Men's Clothes & Shoes on Sale | adidas US",
            "content": "Shop men's clothes & shoes on sale at adidas. Discover stylish, comfortable essentials perfect for sports-inspired looks and everyday athleisure vibes.",
            "url": "https://www.adidas.com/us/men-sale?msockid=234543c5aa9d68fb20535592ab566996"
          },
          {
            "title": "Top Deal - adidas US",
            "content": "Find your adidas Top Deal at adidas.com. All styles and colors available in the official adidas online store.",
            "url": "https://www.adidas.com/us/top_deal?msockid=234543c5aa9d68fb20535592ab566996"
          }
        ]
      }
    ],
    "total_results": 30
  },
  "formatted_output": "COMPETITOR SEARCH: Adidas Stan Smith market positioning classic white sneakers competitive advantages Nike Air Force 1 Converse vs competitors comparison\nRESULT 1:\nTitle: Stan Smith Shoes | adidas US\nContent: Shop Stan Smith shoes at adidas . Iconic style meets comfort in these classic sneakers , perfect for casual wear and your most fashion-forward outfits.\nURL: https://www.adidas.com/us/stan_smith\n---\n\nCOMPETITOR SEARCH: Adidas Stan Smith market positioning classic white sneakers competitive advantages Nike Air Force 1 Converse vs competitors comparison\nRESULT 2:\nTitle: 15 Best White Sneakers for Men 2025, According to GQ Editors | GQ\nContent: The Best White Sneaker for Adidas Stans : Adidas Samba LT Shoes, $120.Far, far gone from its tennis originas, the Stan Smiths are the shoe for lowkey creatives. Bleach- white , with a rounded toe, they were the sneakers that begat minimalist sneakers .\nURL: https://www.gq.com/story/best-white-sneakers\n---\n\nCOMPETITOR SEARCH: Adidas Stan Smith market positioning classic white sneakers competitive advantages Nike Air Force 1 Converse vs competitors comparison\nRESULT 3:\nTitle: Как отличить оригинальные кроссовки nike от подделки?\nContent: Nike . Air Force 1 .Перед вами коробка от Кроссовок Nike Dunk Low Retro «Black/ White » DD1391-100. photo_2023-06-26_23-49-52.jpg. Есть 2 момента, на которые необходимо обратить внимание\nURL: https://insneaker.ru/blogs/blog/fourth\n---\n\nCOMPETITOR SEARCH: Adidas Stan Smith market positioning classic white sneakers competitive advantages Nike Air Force 1 Converse vs competitors comparison\nRESULT 4:\nTitle: The Top 20 Nike Air Force 1 's of All Time\nContent: Buy Nike Air Force 1 Jewel. 12. Air Force 1 “Shady Records”.You can’t beat white on white AF 1 ’s – they’re everything a sneaker is supposed to be. They may not be covered in elaborate patterns, or be a head turning colourway but they do exactly what they’re meant to do and perfectly.\nURL: https://outsons.com/20-best-air-force-1s-of-all-time/\n---\n\nCOMPETITOR SEARCH: Adidas Stan Smith market positioning classic white sneakers competitive advantages Nike Air Force 1 Converse vs competitors comparison\nRESULT 5:\nTitle: Nike Air Force : купить в Poizon кроссовки Найк Аир Форс...\nContent: Кроссовки Nike Air Force оригинальные с доставкой по Москве и всей России. Купите мужские кроссовки Nike Air Force оригинал в каталоге PoizonShop. Гарантия, возврат, низкие цены.\nURL: https://poizonshop.ru/sneakers/nike/airforce\n---\n\nCOMPETITOR SEARCH: Adidas Stan Smith market positioning classic white sneakers competitive advantages Nike Air Force 1 Converse vs competitors comparison\nRESULT 6:\nTitle: nike air force 1 чб - Купить недорого одежду и обувь во всех...\nContent: Nike air force air max 1 90 270 97 shox travis clot gtx goretex dunk safari black white strangelove travis off white virgil чб черно белые mummy air max tn plus air jordan 1 high mid low OG zoom.\nURL: https://www.Avito.ru/all/odezhda_obuv_aksessuary?q=nike+air+force+1+чб\n---\n\nCOMPETITOR SEARCH: Adidas Stan Smith market positioning classic white sneakers competitive advantages Nike Air Force 1 Converse vs competitors comparison\nRESULT 7:\nTitle: An Updated Nike Air Force 1 Arrives In... - SneakerNews.com\nContent: The “Obsidian/Photo Blue” Air Force 1 does just that, drawing within the lines in terms of its colorway while adding something extra in its construction. This pair doesn’t come with an updated model name, but bears a few features adopted from the Air Force 1 utility line from 2018.\nURL: https://sneakernews.com/2024/02/01/nike-air-force-1-low-white-obsidian-photo-blue-hf3836/\n---\n\nCOMPETITOR SEARCH: Adidas Stan Smith market positioning classic white sneakers competitive advantages Nike Air Force 1 Converse vs competitors comparison\nRESULT 8:\nTitle: Air Force 1 Legit Check: Original Vs Fake AF 1 (2025)\nContent: Fake Vs Real Nike Air Force 1 – Rear Details. The back of the shoe reveals a lot. First, check the Swoosh. Comparison of an authentic and fake pair of Air Force 1 s from the side. Nike Air Force 1 Legit Check – Side Perforations.\nURL: https://legitcheck.app/guides/nike/air-force-1/how-to-spot-fake-nike-af1/\n---\n\nCOMPETITOR SEARCH: Adidas Stan Smith market positioning classic white sneakers competitive advantages Nike Air Force 1 Converse vs competitors comparison\nRESULT 9:\nTitle: ТОП-10 Кроссовок на осень 2025\nContent: Adidas Samba. Nike Air Force 1 . Кто еще не теряет популярности? Конечно же, белые Найк Эйр Форс 1. Эту пару полюбили за универсальный и минималистичный дизайн. Nike Air Jordan 1. Vans Old Skool. Converse Chuck Taylor. Asics Gel-Kayano 14.\nURL: https://outmaxshop.ru/article/2499-top-10-krossovok-na-osen-2025\n---\n\nCOMPETITOR SEARCH: Adidas Stan Smith market positioning classic white sneakers competitive advantages Nike Air Force 1 Converse vs competitors comparison\nRESULT 10:\nTitle: С какими кроссовками можно носить длинные носки?\nContent: Adidas Samba, Converse Chuck Taylor или Puma Suede отлично смотрятся с белыми носками.Часто задаваемые вопросы. Можно ли носить длинные носки с шортами? Да, особенно если сочетать их с классическими кроссовками, например, Nike Air Force 1 .\nURL: https://xn--80awro.xn--p1ai/news/s-kakimi-krossovkami-mozhno-nosit-dlinnye-noski\n---\n\nCOMPETITOR SEARCH: Adidas Stan Smith market positioning classic white sneakers competitive advantages Nike Air Force 1 Converse market share analysis 2025\nRESULT 1:\nTitle: Adidas Stan Smith - Wikipedia\nContent: Adidas Stan Smith is a tennis shoe made by Adidas , and first launched in 1965. Originally named \" Adidas Robert Haillet\" after the brand endorsed French prominent player Robert Haillet, in 1978 the sneakers were renamed after Stan Smith ...\nURL: https://en.wikipedia.org/wiki/Adidas_Stan_Smith\n---\n\nCOMPETITOR SEARCH: Adidas Stan Smith market positioning classic white sneakers competitive advantages Nike Air Force 1 Converse market share analysis 2025\nRESULT 2:\nTitle: Stan Smith Shoes | adidas US\nContent: The iconic Stan Smith shoes from adidas first hit the scene as a performance tennis shoe. Nowadays, these sneakers from adidas Originals are a staple of streetwear fashion. From the perforated 3-Stripes to the branded heel patch and tongue label...\nURL: https://www.adidas.com/us/stan_smith\n---\n\nCOMPETITOR SEARCH: Adidas Stan Smith market positioning classic white sneakers competitive advantages Nike Air Force 1 Converse market share analysis 2025\nRESULT 3:\nTitle: 15 Best White Sneakers for Men 2025 , According to GQ Editors | GQ\nContent: The Best White Sneaker for Adidas Stans : Adidas Samba LT Shoes, $120.Far, far gone from its tennis originas, the Stan Smiths are the shoe for lowkey creatives. Bleach- white , with a rounded toe, they were the sneakers that begat minimalist sneakers .\nURL: https://www.gq.com/story/best-white-sneakers\n---\n\nCOMPETITOR SEARCH: Adidas Stan Smith market positioning classic white sneakers competitive advantages Nike Air Force 1 Converse market share analysis 2025\nRESULT 4:\nTitle: Nike Air Force 1 Release Dates 2025 - Updated in Real Time\nContent: Upcoming Nike Air Force 1 sneaker releases and sneaker raffles.The Nike Air Force 1 is an iconic sneaker that was first released in 1982. Designed by Bruce Kilgore as a basketball sneaker , the AF 1 is known for its distinctive design and signature Air cushioning technology.\nURL: https://www.soleretriever.com/sneaker-release-dates/nike/nike-air-force-1\n---\n\nCOMPETITOR SEARCH: Adidas Stan Smith market positioning classic white sneakers competitive advantages Nike Air Force 1 Converse market share analysis 2025\nRESULT 5:\nTitle: adidas Stan Smith Tre-Tongue Rose Tone H03924 | SneakerNews.com\nContent: Overall, the design reps a feminine Off- White and Rose Tone color scheme that is both versatile and subtle enough for the “Tre-Tongue” details to take center stage. Enjoy official images of the Stan Smith “Tre-Tongue” below, which is available now at adidas .com for $90.\nURL: https://sneakernews.com/2021/09/08/adidas-stan-smith-tre-tongue-off-white-rose-tone-off-white-h03924/?noamp=mobile\n---\n\nCOMPETITOR SEARCH: Adidas Stan Smith market positioning classic white sneakers competitive advantages Nike Air Force 1 Converse market share analysis 2025\nRESULT 6:\nTitle: ТОП-40 лучших мужских кроссовок 2025 — SHOPOZZ\nContent: Nike Air Force 1 '07 White Low Sneakers Unise... 13 690 ₽ Mens Waterproof Safety Shoes Composite toe Work Boots Indestructible Sneakers .\nURL: https://shopozz.ru/article/view/top-50-luchshih-muzhskih-krossovok-2023\n---\n\nCOMPETITOR SEARCH: Adidas Stan Smith market positioning classic white sneakers competitive advantages Nike Air Force 1 Converse market share analysis 2025\nRESULT 7:\nTitle: Кеды Nike Air Force 1 купить с доставкой, цена на кроссовки...\nContent: У нас широкий выбор классических и высоких кед и кроссовок Nike Air Force 1 для взрослых и детей. Спешите купить обувь по разумной цене в интернет-магазине Спортмастер. Модели подойдут для активного отдыха.\nURL: https://www.Sportmaster.ru/catalog/kedy_/?f-ware_line_ishop=ware_line_ishop_nike_air_force_1\n---\n\nCOMPETITOR SEARCH: Adidas Stan Smith market positioning classic white sneakers competitive advantages Nike Air Force 1 Converse market share analysis 2025\nRESULT 8:\nTitle: За что любят классические кроссовки Adidas Superstar\nContent: В так называемом «капсульном списке обуви» модных стилистов Superstar стоят рядом с белыми Stan Smith , Converse Chuck Taylor и Nike Air Force 1 . Все они — базовые модели, но Superstar выделяются благодаря культовому носку-«ракушке»...\nURL: https://outmaxshop.ru/trend25/17-news/2497-za-chto-lyubyat-klassicheskie-krossovki-adidas-superstar\n---\n\nCOMPETITOR SEARCH: Adidas Stan Smith market positioning classic white sneakers competitive advantages Nike Air Force 1 Converse market share analysis 2025\nRESULT 9:\nTitle: Nike Air Force 1 Low: Лучшие Аир Форсы от классики до...\nContent: Nike Air Force 1 Low « Classics ». Любителям ретро-дизайна и винила определенно придется по вкусу расцветка « Classics ». Модель посвящена 50-летию хип-хопа, записям песен и микстейпам и оформлена в нейтральных белом, “состаренном” бежевом и темно-сером оттенках.\nURL: https://sneakerfreak.ru/nike-air-force-1-top-sneakers/\n---\n\nCOMPETITOR SEARCH: Adidas Stan Smith market positioning classic white sneakers competitive advantages Nike Air Force 1 Converse market share analysis 2025\nRESULT 10:\nTitle: LEGO Turned Nike ’s Techy Air Max Sneaker Into LEGO Bricks\nContent: LEGO & Nike 's Air Max Dn sneaker is almost everything LEGO fans could ever want. Adidas sort of got it right with its Ultra Boost DNA LEGO and the Stan Smith collab, which featured semi-attachable parts. Even modders have added LEGO plates to sneakers for years.\nURL: https://www.highsnobiety.com/p/lego-nike-air-max-dn-2025/\n---\n\nCOMPETITOR SEARCH: Adidas Stan Smith market positioning classic white sneakers competitive advantages Nike Air Force 1 Converse competitive landscape sneaker market\nRESULT 1:\nTitle: Sneaker and Activewear | adidas US\nContent: Gear up for your favorite sport with adidas sneakers and activewear for men and women. From running to soccer and the gym to the trail, performance workout clothes and shoes keep you …\nURL: https://www.adidas.com/us?msockid=234543c5aa9d68fb20535592ab566996\n---\n\nCOMPETITOR SEARCH: Adidas Stan Smith market positioning classic white sneakers competitive advantages Nike Air Force 1 Converse competitive landscape sneaker market\nRESULT 2:\nTitle: Men's Shoes - adidas US\nContent: Shop men's shoes at adidas. Explore performance sneakers and versatile everyday pairs that blend performance-driven comfort and lifestyle appeal.\nURL: https://www.adidas.com/us/men-shoes?msockid=234543c5aa9d68fb20535592ab566996\n---\n\nCOMPETITOR SEARCH: Adidas Stan Smith market positioning classic white sneakers competitive advantages Nike Air Force 1 Converse competitive landscape sneaker market\nRESULT 3:\nTitle: Men's Sneakers and Workout Clothes | adidas US\nContent: Workout with cutting-edge cushioning, or set the casual standard off the field with heritage sports style. adidas is here, and has always been, with men's workout clothes and sneakers for …\nURL: https://www.adidas.com/us/men?msockid=234543c5aa9d68fb20535592ab566996\n---\n\nCOMPETITOR SEARCH: Adidas Stan Smith market positioning classic white sneakers competitive advantages Nike Air Force 1 Converse competitive landscape sneaker market\nRESULT 4:\nTitle: Shop browse | adidas US\nContent: Find your adidas browse at adidas.com. All styles and colors available in the official adidas online store.\nURL: https://www.adidas.com/us/browse?msockid=234543c5aa9d68fb20535592ab566996\n---\n\nCOMPETITOR SEARCH: Adidas Stan Smith market positioning classic white sneakers competitive advantages Nike Air Force 1 Converse competitive landscape sneaker market\nRESULT 5:\nTitle: adidas Online Shop | adidas US\nContent: SHOP BY COLLECTION adicolor Premium Collaborations adidas by Stella McCartney Gazelle Originals Samba\nURL: https://www.adidas.com/us/welcome?msockid=234543c5aa9d68fb20535592ab566996\n---\n\nCOMPETITOR SEARCH: Adidas Stan Smith market positioning classic white sneakers competitive advantages Nike Air Force 1 Converse competitive landscape sneaker market\nRESULT 6:\nTitle: Women's Sneakers and Activewear | adidas US\nContent: Experience adidas technologies that support cool, dry comfort through intense workouts. Put your fitness first with adidas women's workout shoes and running clothes that breathe, manage …\nURL: https://www.adidas.com/us/women?msockid=234543c5aa9d68fb20535592ab566996\n---\n\nCOMPETITOR SEARCH: Adidas Stan Smith market positioning classic white sneakers competitive advantages Nike Air Force 1 Converse competitive landscape sneaker market\nRESULT 7:\nTitle: Clothes & Shoes on Sale | adidas US\nContent: Shop clothes & shoes on sale at adidas. Discover stylish and comfortable everyday essentials, from trendy sneakers to versatile athleisure apparel.\nURL: https://www.adidas.com/us/sale?msockid=234543c5aa9d68fb20535592ab566996\n---\n\nCOMPETITOR SEARCH: Adidas Stan Smith market positioning classic white sneakers competitive advantages Nike Air Force 1 Converse competitive landscape sneaker market\nRESULT 8:\nTitle: Kids' Sneakers and Activewear - adidas US\nContent: Support your young athlete’s performance with kid’s sneakers from adidas. Kids deserve the best in comfort and style.\nURL: https://www.adidas.com/us/kids?msockid=234543c5aa9d68fb20535592ab566996\n---\n\nCOMPETITOR SEARCH: Adidas Stan Smith market positioning classic white sneakers competitive advantages Nike Air Force 1 Converse competitive landscape sneaker market\nRESULT 9:\nTitle: Men's Clothes & Shoes on Sale | adidas US\nContent: Shop men's clothes & shoes on sale at adidas. Discover stylish, comfortable essentials perfect for sports-inspired looks and everyday athleisure vibes.\nURL: https://www.adidas.com/us/men-sale?msockid=234543c5aa9d68fb20535592ab566996\n---\n\nCOMPETITOR SEARCH: Adidas Stan Smith market positioning classic white sneakers competitive advantages Nike Air Force 1 Converse competitive landscape sneaker market\nRESULT 10:\nTitle: Top Deal - adidas US\nContent: Find your adidas Top Deal at adidas.com. All styles and colors available in the official adidas online store.\nURL: https://www.adidas.com/us/top_deal?msockid=234543c5aa9d68fb20535592ab566996\n---\n"
}