{
  "metadata": {
    "search_type": "competitor_search",
    "original_query": "Adidas Stan Smith competitors market positioning sneakers",
    "timestamp": "2025-08-29T07:35:03.764072",
    "pwd": "/Users/orchidee/Documents/AI-market-agent/src",
    "saved_to": "/Users/orchidee/Documents/AI-market-agent/data/competitor_search_20250829_073503.json"
  },
  "search_results": {
    "queries": [
      {
        "search_query": "Adidas Stan Smith competitors market positioning sneakers vs competitors comparison",
        "results_count": 10,
        "results": [
          {
            "title": "Sneaker and Activewear | adidas US",
            "content": "Find sport-specific sneakers to support your passion, and shop versatile activewear and accessories that support everyday comfort. adidas has you covered with world-class …",
            "url": "https://www.adidas.com/us?msockid=1c0bddcb12d86b9e2fcdcb9c13646a78"
          },
          {
            "title": "adidas Online Shop | adidas US",
            "content": "SHOP BY COLLECTION adicolor Premium Collaborations adidas by Stella McCartney Gazelle Originals Samba",
            "url": "https://www.adidas.com/us/welcome?msockid=1c0bddcb12d86b9e2fcdcb9c13646a78"
          },
          {
            "title": "adidas Shoes, Sneakers & Slides | adidas US",
            "content": "Shop adidas shoes for training, sport, and casual lifestyle at the official adidas online store. Browse all the hottest styles like UltraBoost, NMD, and more.",
            "url": "https://www.adidas.com/us/shoes?msockid=1c0bddcb12d86b9e2fcdcb9c13646a78"
          },
          {
            "title": "New Shoes | adidas US",
            "content": "Discover new shoes at adidas. Explore the latest drops combining sleek designs and ultimate comfort for everyday wear and standout style.",
            "url": "https://www.adidas.com/us/new_arrivals?msockid=1c0bddcb12d86b9e2fcdcb9c13646a78"
          },
          {
            "title": "Men's Shoes - adidas US",
            "content": "Shop men's shoes at adidas. Explore performance sneakers and versatile everyday pairs that blend performance-driven comfort and lifestyle appeal.",
            "url": "https://www.adidas.com/us/men-shoes?msockid=1c0bddcb12d86b9e2fcdcb9c13646a78"
          },
          {
            "title": "Men's Sneakers and Workout Clothes | adidas US",
            "content": "Workout with cutting-edge cushioning, or set the casual standard off the field with heritage sports style. adidas is here, and has always been, with men's workout clothes and sneakers for …",
            "url": "https://www.adidas.com/us/men?msockid=1c0bddcb12d86b9e2fcdcb9c13646a78"
          },
          {
            "title": "Men's Clothes & Shoes on Sale | adidas US",
            "content": "Shop men's clothes & shoes on sale at adidas. Discover stylish, comfortable essentials perfect for sports-inspired looks and everyday athleisure vibes.",
            "url": "https://www.adidas.com/us/men-sale?msockid=1c0bddcb12d86b9e2fcdcb9c13646a78"
          },
          {
            "title": "Women's Sneakers and Activewear | adidas US",
            "content": "Experience adidas technologies that support cool, dry comfort through intense workouts. Put your fitness first with adidas women's workout shoes and running clothes that breathe, manage …",
            "url": "https://www.adidas.com/us/women?msockid=1c0bddcb12d86b9e2fcdcb9c13646a78"
          },
          {
            "title": "Shop New Clothes & Shoes For Men | adidas US",
            "content": "Browse new clothes and shoes for men at adidas. Check out the latest arrivals in apparel and footwear for any sport or season.",
            "url": "https://www.adidas.com/us/men-new_arrivals?msockid=1c0bddcb12d86b9e2fcdcb9c13646a78"
          },
          {
            "title": "Men's Sneakers - adidas US",
            "content": "Shop the latest men's athletic shoes and sneakers from adidas. Grab a pair of slip on sneakers, classic sneakers or retro sneaker styles for men today.",
            "url": "https://www.adidas.com/us/men-athletic_sneakers?msockid=1c0bddcb12d86b9e2fcdcb9c13646a78"
          }
        ]
      },
      {
        "search_query": "Adidas Stan Smith competitors market positioning sneakers market share analysis 2025",
        "results_count": 10,
        "results": [
          {
            "title": "Sneaker and Activewear | adidas US",
            "content": "Find sport-specific sneakers to support your passion, and shop versatile activewear and accessories that support everyday comfort. adidas has you covered with world-class …",
            "url": "https://www.adidas.com/us?msockid=1c0bddcb12d86b9e2fcdcb9c13646a78"
          },
          {
            "title": "adidas Online Shop | adidas US",
            "content": "SHOP BY COLLECTION adicolor Premium Collaborations adidas by Stella McCartney Gazelle Originals Samba",
            "url": "https://www.adidas.com/us/welcome?msockid=1c0bddcb12d86b9e2fcdcb9c13646a78"
          },
          {
            "title": "adidas Shoes, Sneakers & Slides | adidas US",
            "content": "Shop adidas shoes for training, sport, and casual lifestyle at the official adidas online store. Browse all the hottest styles like UltraBoost, NMD, and more.",
            "url": "https://www.adidas.com/us/shoes?msockid=1c0bddcb12d86b9e2fcdcb9c13646a78"
          },
          {
            "title": "New Shoes | adidas US",
            "content": "Discover new shoes at adidas. Explore the latest drops combining sleek designs and ultimate comfort for everyday wear and standout style.",
            "url": "https://www.adidas.com/us/new_arrivals?msockid=1c0bddcb12d86b9e2fcdcb9c13646a78"
          },
          {
            "title": "Men's Shoes - adidas US",
            "content": "Shop men's shoes at adidas. Explore performance sneakers and versatile everyday pairs that blend performance-driven comfort and lifestyle appeal.",
            "url": "https://www.adidas.com/us/men-shoes?msockid=1c0bddcb12d86b9e2fcdcb9c13646a78"
          },
          {
            "title": "Men's Sneakers and Workout Clothes | adidas US",
            "content": "Workout with cutting-edge cushioning, or set the casual standard off the field with heritage sports style. adidas is here, and has always been, with men's workout clothes and sneakers for …",
            "url": "https://www.adidas.com/us/men?msockid=1c0bddcb12d86b9e2fcdcb9c13646a78"
          },
          {
            "title": "Men's Clothes & Shoes on Sale | adidas US",
            "content": "Shop men's clothes & shoes on sale at adidas. Discover stylish, comfortable essentials perfect for sports-inspired looks and everyday athleisure vibes.",
            "url": "https://www.adidas.com/us/men-sale?msockid=1c0bddcb12d86b9e2fcdcb9c13646a78"
          },
          {
            "title": "Women's Sneakers and Activewear | adidas US",
            "content": "Experience adidas technologies that support cool, dry comfort through intense workouts. Put your fitness first with adidas women's workout shoes and running clothes that breathe, manage …",
            "url": "https://www.adidas.com/us/women?msockid=1c0bddcb12d86b9e2fcdcb9c13646a78"
          },
          {
            "title": "Shop New Clothes & Shoes For Men | adidas US",
            "content": "Browse new clothes and shoes for men at adidas. Check out the latest arrivals in apparel and footwear for any sport or season.",
            "url": "https://www.adidas.com/us/men-new_arrivals?msockid=1c0bddcb12d86b9e2fcdcb9c13646a78"
          },
          {
            "title": "Men's Sneakers - adidas US",
            "content": "Shop the latest men's athletic shoes and sneakers from adidas. Grab a pair of slip on sneakers, classic sneakers or retro sneaker styles for men today.",
            "url": "https://www.adidas.com/us/men-athletic_sneakers?msockid=1c0bddcb12d86b9e2fcdcb9c13646a78"
          }
        ]
      },
      {
        "search_query": "Adidas Stan Smith competitors market positioning sneakers competitive landscape sneaker market",
        "results_count": 10,
        "results": [
          {
            "title": "Business Model Analyst Adidas vs Nike: Business Model Comparison, Revenue, and Strategy Analysis",
            "content": "September 25, 2024 - When it comes to the sportswear industry, the rivalry between Adidas vs Nike commands attention. These two companies are titans in the market , each with a rich legacy and a dedicated following that spans the globe.",
            "url": "https://businessmodelanalyst.com/adidas-vs-nike/"
          },
          {
            "title": "Start.io Adidas Target Market Analysis & Consumer Demographics | Start.io",
            "content": "May 14, 2025 - Nike is Adidas biggest competitor , with significantly higher brand value and net revenue compared to Adidas. Nevertheless, Adidas holds strong in its position as the second-largest sportswear brand in the world, with triple the market share compared to the next closest competitor, VF Corporation.",
            "url": "https://www.start.io/blog/adidas-target-market-segmentation-and-marketing-strategy-audience-demographics-competitors/"
          },
          {
            "title": "Edrawsoft Adidas Marketing Mix (4Ps) Analysis | EdrawMind",
            "content": "The competitive pricing comes into play with its regular products, taking into account the prices of rival companies like Nike and Puma . The skimming pricing strategy is used whenever Adidas launches a cutting-edge product that is more advanced than what competitors offer.",
            "url": "https://www.edrawmind.com/article/adidas-marketing-mix-analysis.html"
          },
          {
            "title": "StartupTalky Adidas Marketing Strategy | Marketing Campaigns | Pricing Strategy | USP",
            "content": "March 19, 2025 - Dive into Adidas ' USP and uncover the marketing strategy differentiating it from competitors . Discover impactful Adidas marketing strategies and insights.",
            "url": "https://startuptalky.com/adidas-marketing-strategy/"
          },
          {
            "title": "Growth Navigate 6 Top Adidas Competitors 2024 (Alternatives)",
            "content": "March 18, 2024 - Despite its strong market presence, Adidas faces substantial competition from other key players like Nike, Puma, and Under Armour . This dynamic competitive landscape, combined with Adidas' position as the fifth-largest apparel brand globally with a staggering brand value and significant employee ...",
            "url": "https://www.growthnavigate.com/top-adidas-competitors"
          },
          {
            "title": "Datahut Nike vs Adidas: Competitive Analysis with Data Visualizations - Datahut",
            "content": "June 27, 2025 - When it comes to footwear, Nike and Adidas are two of the biggest names in the industry . Both companies are well-established, have a large and loyal following of consumers, and have a wide range of products known for their quality, performance, and style.We scraped the product data of Nike ...",
            "url": "https://www.blog.datahut.co/post/competitive-analysis-nike-vs-adidas"
          },
          {
            "title": "Marketing Dive Sneaker supremacy: Nike and Adidas battle for brand love | Marketing Dive",
            "content": "May 10, 2022 - Duking it out over six decades, the athletic wear companies influenced sports marketing and culture like few others. Who dominates in the stretch ahead may hinge on innovation and acting on pledges.",
            "url": "https://www.marketingdive.com/news/sneaker-supremacy-nike-adidas-brand-rivalry/621712/"
          },
          {
            "title": "Drapersonline The trainer brands taking market share from Nike and Adidas",
            "content": "May 8, 2024 - Hoka and On Running increased their market share during the pandemic. Drapers examines whether the niche-but-growing sports footwear brands are likely to overtake sportswear giants Adidas and Nike.",
            "url": "https://www.drapersonline.com/insight/analysis/the-trainer-brands-taking-market-share-from-nike-and-adidas"
          },
          {
            "title": "Reuters Adidas targets larger US market share as Nike struggles | Reuters",
            "content": "February 28, 2025 - Whether Adidas can win more American shoppers from market leader Nike will be key to its continued success this year, investors and analysts said, as the German brand looks for new sources of growth beyond its Samba and Gazelle sneakers .",
            "url": "https://www.reuters.com/business/retail-consumer/adidas-targets-larger-us-market-share-nike-struggles-2025-02-28/"
          },
          {
            "title": "ResearchGate (PDF) Analysis of the Marketing Strategy of Adidas",
            "content": "September 13, 2023 - polyester and worked with partners to develop vegetable leathers , such as the Adidas Stan Smith, which is a vegan version [8]. All of these contribute to improving the reputation of the Adidas brand, winning the hearts and minds of consumers and increasing the competitiveness of the brand.",
            "url": "https://www.researchgate.net/publication/373896269_Analysis_of_the_Marketing_Strategy_of_Adidas"
          }
        ]
      }
    ],
    "total_results": 30
  },
  "formatted_output": "COMPETITOR SEARCH: Adidas Stan Smith competitors market positioning sneakers vs competitors comparison\nRESULT 1:\nTitle: Sneaker and Activewear | adidas US\nContent: Find sport-specific sneakers to support your passion, and shop versatile activewear and accessories that support everyday comfort. adidas has you covered with world-class …\nURL: https://www.adidas.com/us?msockid=1c0bddcb12d86b9e2fcdcb9c13646a78\n---\n\nCOMPETITOR SEARCH: Adidas Stan Smith competitors market positioning sneakers vs competitors comparison\nRESULT 2:\nTitle: adidas Online Shop | adidas US\nContent: SHOP BY COLLECTION adicolor Premium Collaborations adidas by Stella McCartney Gazelle Originals Samba\nURL: https://www.adidas.com/us/welcome?msockid=1c0bddcb12d86b9e2fcdcb9c13646a78\n---\n\nCOMPETITOR SEARCH: Adidas Stan Smith competitors market positioning sneakers vs competitors comparison\nRESULT 3:\nTitle: adidas Shoes, Sneakers & Slides | adidas US\nContent: Shop adidas shoes for training, sport, and casual lifestyle at the official adidas online store. Browse all the hottest styles like UltraBoost, NMD, and more.\nURL: https://www.adidas.com/us/shoes?msockid=1c0bddcb12d86b9e2fcdcb9c13646a78\n---\n\nCOMPETITOR SEARCH: Adidas Stan Smith competitors market positioning sneakers vs competitors comparison\nRESULT 4:\nTitle: New Shoes | adidas US\nContent: Discover new shoes at adidas. Explore the latest drops combining sleek designs and ultimate comfort for everyday wear and standout style.\nURL: https://www.adidas.com/us/new_arrivals?msockid=1c0bddcb12d86b9e2fcdcb9c13646a78\n---\n\nCOMPETITOR SEARCH: Adidas Stan Smith competitors market positioning sneakers vs competitors comparison\nRESULT 5:\nTitle: Men's Shoes - adidas US\nContent: Shop men's shoes at adidas. Explore performance sneakers and versatile everyday pairs that blend performance-driven comfort and lifestyle appeal.\nURL: https://www.adidas.com/us/men-shoes?msockid=1c0bddcb12d86b9e2fcdcb9c13646a78\n---\n\nCOMPETITOR SEARCH: Adidas Stan Smith competitors market positioning sneakers vs competitors comparison\nRESULT 6:\nTitle: Men's Sneakers and Workout Clothes | adidas US\nContent: Workout with cutting-edge cushioning, or set the casual standard off the field with heritage sports style. adidas is here, and has always been, with men's workout clothes and sneakers for …\nURL: https://www.adidas.com/us/men?msockid=1c0bddcb12d86b9e2fcdcb9c13646a78\n---\n\nCOMPETITOR SEARCH: Adidas Stan Smith competitors market positioning sneakers vs competitors comparison\nRESULT 7:\nTitle: Men's Clothes & Shoes on Sale | adidas US\nContent: Shop men's clothes & shoes on sale at adidas. Discover stylish, comfortable essentials perfect for sports-inspired looks and everyday athleisure vibes.\nURL: https://www.adidas.com/us/men-sale?msockid=1c0bddcb12d86b9e2fcdcb9c13646a78\n---\n\nCOMPETITOR SEARCH: Adidas Stan Smith competitors market positioning sneakers vs competitors comparison\nRESULT 8:\nTitle: Women's Sneakers and Activewear | adidas US\nContent: Experience adidas technologies that support cool, dry comfort through intense workouts. Put your fitness first with adidas women's workout shoes and running clothes that breathe, manage …\nURL: https://www.adidas.com/us/women?msockid=1c0bddcb12d86b9e2fcdcb9c13646a78\n---\n\nCOMPETITOR SEARCH: Adidas Stan Smith competitors market positioning sneakers vs competitors comparison\nRESULT 9:\nTitle: Shop New Clothes & Shoes For Men | adidas US\nContent: Browse new clothes and shoes for men at adidas. Check out the latest arrivals in apparel and footwear for any sport or season.\nURL: https://www.adidas.com/us/men-new_arrivals?msockid=1c0bddcb12d86b9e2fcdcb9c13646a78\n---\n\nCOMPETITOR SEARCH: Adidas Stan Smith competitors market positioning sneakers vs competitors comparison\nRESULT 10:\nTitle: Men's Sneakers - adidas US\nContent: Shop the latest men's athletic shoes and sneakers from adidas. Grab a pair of slip on sneakers, classic sneakers or retro sneaker styles for men today.\nURL: https://www.adidas.com/us/men-athletic_sneakers?msockid=1c0bddcb12d86b9e2fcdcb9c13646a78\n---\n\nCOMPETITOR SEARCH: Adidas Stan Smith competitors market positioning sneakers market share analysis 2025\nRESULT 1:\nTitle: Sneaker and Activewear | adidas US\nContent: Find sport-specific sneakers to support your passion, and shop versatile activewear and accessories that support everyday comfort. adidas has you covered with world-class …\nURL: https://www.adidas.com/us?msockid=1c0bddcb12d86b9e2fcdcb9c13646a78\n---\n\nCOMPETITOR SEARCH: Adidas Stan Smith competitors market positioning sneakers market share analysis 2025\nRESULT 2:\nTitle: adidas Online Shop | adidas US\nContent: SHOP BY COLLECTION adicolor Premium Collaborations adidas by Stella McCartney Gazelle Originals Samba\nURL: https://www.adidas.com/us/welcome?msockid=1c0bddcb12d86b9e2fcdcb9c13646a78\n---\n\nCOMPETITOR SEARCH: Adidas Stan Smith competitors market positioning sneakers market share analysis 2025\nRESULT 3:\nTitle: adidas Shoes, Sneakers & Slides | adidas US\nContent: Shop adidas shoes for training, sport, and casual lifestyle at the official adidas online store. Browse all the hottest styles like UltraBoost, NMD, and more.\nURL: https://www.adidas.com/us/shoes?msockid=1c0bddcb12d86b9e2fcdcb9c13646a78\n---\n\nCOMPETITOR SEARCH: Adidas Stan Smith competitors market positioning sneakers market share analysis 2025\nRESULT 4:\nTitle: New Shoes | adidas US\nContent: Discover new shoes at adidas. Explore the latest drops combining sleek designs and ultimate comfort for everyday wear and standout style.\nURL: https://www.adidas.com/us/new_arrivals?msockid=1c0bddcb12d86b9e2fcdcb9c13646a78\n---\n\nCOMPETITOR SEARCH: Adidas Stan Smith competitors market positioning sneakers market share analysis 2025\nRESULT 5:\nTitle: Men's Shoes - adidas US\nContent: Shop men's shoes at adidas. Explore performance sneakers and versatile everyday pairs that blend performance-driven comfort and lifestyle appeal.\nURL: https://www.adidas.com/us/men-shoes?msockid=1c0bddcb12d86b9e2fcdcb9c13646a78\n---\n\nCOMPETITOR SEARCH: Adidas Stan Smith competitors market positioning sneakers market share analysis 2025\nRESULT 6:\nTitle: Men's Sneakers and Workout Clothes | adidas US\nContent: Workout with cutting-edge cushioning, or set the casual standard off the field with heritage sports style. adidas is here, and has always been, with men's workout clothes and sneakers for …\nURL: https://www.adidas.com/us/men?msockid=1c0bddcb12d86b9e2fcdcb9c13646a78\n---\n\nCOMPETITOR SEARCH: Adidas Stan Smith competitors market positioning sneakers market share analysis 2025\nRESULT 7:\nTitle: Men's Clothes & Shoes on Sale | adidas US\nContent: Shop men's clothes & shoes on sale at adidas. Discover stylish, comfortable essentials perfect for sports-inspired looks and everyday athleisure vibes.\nURL: https://www.adidas.com/us/men-sale?msockid=1c0bddcb12d86b9e2fcdcb9c13646a78\n---\n\nCOMPETITOR SEARCH: Adidas Stan Smith competitors market positioning sneakers market share analysis 2025\nRESULT 8:\nTitle: Women's Sneakers and Activewear | adidas US\nContent: Experience adidas technologies that support cool, dry comfort through intense workouts. Put your fitness first with adidas women's workout shoes and running clothes that breathe, manage …\nURL: https://www.adidas.com/us/women?msockid=1c0bddcb12d86b9e2fcdcb9c13646a78\n---\n\nCOMPETITOR SEARCH: Adidas Stan Smith competitors market positioning sneakers market share analysis 2025\nRESULT 9:\nTitle: Shop New Clothes & Shoes For Men | adidas US\nContent: Browse new clothes and shoes for men at adidas. Check out the latest arrivals in apparel and footwear for any sport or season.\nURL: https://www.adidas.com/us/men-new_arrivals?msockid=1c0bddcb12d86b9e2fcdcb9c13646a78\n---\n\nCOMPETITOR SEARCH: Adidas Stan Smith competitors market positioning sneakers market share analysis 2025\nRESULT 10:\nTitle: Men's Sneakers - adidas US\nContent: Shop the latest men's athletic shoes and sneakers from adidas. Grab a pair of slip on sneakers, classic sneakers or retro sneaker styles for men today.\nURL: https://www.adidas.com/us/men-athletic_sneakers?msockid=1c0bddcb12d86b9e2fcdcb9c13646a78\n---\n\nCOMPETITOR SEARCH: Adidas Stan Smith competitors market positioning sneakers competitive landscape sneaker market\nRESULT 1:\nTitle: Business Model Analyst Adidas vs Nike: Business Model Comparison, Revenue, and Strategy Analysis\nContent: September 25, 2024 - When it comes to the sportswear industry, the rivalry between Adidas vs Nike commands attention. These two companies are titans in the market , each with a rich legacy and a dedicated following that spans the globe.\nURL: https://businessmodelanalyst.com/adidas-vs-nike/\n---\n\nCOMPETITOR SEARCH: Adidas Stan Smith competitors market positioning sneakers competitive landscape sneaker market\nRESULT 2:\nTitle: Start.io Adidas Target Market Analysis & Consumer Demographics | Start.io\nContent: May 14, 2025 - Nike is Adidas biggest competitor , with significantly higher brand value and net revenue compared to Adidas. Nevertheless, Adidas holds strong in its position as the second-largest sportswear brand in the world, with triple the market share compared to the next closest competitor, VF Corporation.\nURL: https://www.start.io/blog/adidas-target-market-segmentation-and-marketing-strategy-audience-demographics-competitors/\n---\n\nCOMPETITOR SEARCH: Adidas Stan Smith competitors market positioning sneakers competitive landscape sneaker market\nRESULT 3:\nTitle: Edrawsoft Adidas Marketing Mix (4Ps) Analysis | EdrawMind\nContent: The competitive pricing comes into play with its regular products, taking into account the prices of rival companies like Nike and Puma . The skimming pricing strategy is used whenever Adidas launches a cutting-edge product that is more advanced than what competitors offer.\nURL: https://www.edrawmind.com/article/adidas-marketing-mix-analysis.html\n---\n\nCOMPETITOR SEARCH: Adidas Stan Smith competitors market positioning sneakers competitive landscape sneaker market\nRESULT 4:\nTitle: StartupTalky Adidas Marketing Strategy | Marketing Campaigns | Pricing Strategy | USP\nContent: March 19, 2025 - Dive into Adidas ' USP and uncover the marketing strategy differentiating it from competitors . Discover impactful Adidas marketing strategies and insights.\nURL: https://startuptalky.com/adidas-marketing-strategy/\n---\n\nCOMPETITOR SEARCH: Adidas Stan Smith competitors market positioning sneakers competitive landscape sneaker market\nRESULT 5:\nTitle: Growth Navigate 6 Top Adidas Competitors 2024 (Alternatives)\nContent: March 18, 2024 - Despite its strong market presence, Adidas faces substantial competition from other key players like Nike, Puma, and Under Armour . This dynamic competitive landscape, combined with Adidas' position as the fifth-largest apparel brand globally with a staggering brand value and significant employee ...\nURL: https://www.growthnavigate.com/top-adidas-competitors\n---\n\nCOMPETITOR SEARCH: Adidas Stan Smith competitors market positioning sneakers competitive landscape sneaker market\nRESULT 6:\nTitle: Datahut Nike vs Adidas: Competitive Analysis with Data Visualizations - Datahut\nContent: June 27, 2025 - When it comes to footwear, Nike and Adidas are two of the biggest names in the industry . Both companies are well-established, have a large and loyal following of consumers, and have a wide range of products known for their quality, performance, and style.We scraped the product data of Nike ...\nURL: https://www.blog.datahut.co/post/competitive-analysis-nike-vs-adidas\n---\n\nCOMPETITOR SEARCH: Adidas Stan Smith competitors market positioning sneakers competitive landscape sneaker market\nRESULT 7:\nTitle: Marketing Dive Sneaker supremacy: Nike and Adidas battle for brand love | Marketing Dive\nContent: May 10, 2022 - Duking it out over six decades, the athletic wear companies influenced sports marketing and culture like few others. Who dominates in the stretch ahead may hinge on innovation and acting on pledges.\nURL: https://www.marketingdive.com/news/sneaker-supremacy-nike-adidas-brand-rivalry/621712/\n---\n\nCOMPETITOR SEARCH: Adidas Stan Smith competitors market positioning sneakers competitive landscape sneaker market\nRESULT 8:\nTitle: Drapersonline The trainer brands taking market share from Nike and Adidas\nContent: May 8, 2024 - Hoka and On Running increased their market share during the pandemic. Drapers examines whether the niche-but-growing sports footwear brands are likely to overtake sportswear giants Adidas and Nike.\nURL: https://www.drapersonline.com/insight/analysis/the-trainer-brands-taking-market-share-from-nike-and-adidas\n---\n\nCOMPETITOR SEARCH: Adidas Stan Smith competitors market positioning sneakers competitive landscape sneaker market\nRESULT 9:\nTitle: Reuters Adidas targets larger US market share as Nike struggles | Reuters\nContent: February 28, 2025 - Whether Adidas can win more American shoppers from market leader Nike will be key to its continued success this year, investors and analysts said, as the German brand looks for new sources of growth beyond its Samba and Gazelle sneakers .\nURL: https://www.reuters.com/business/retail-consumer/adidas-targets-larger-us-market-share-nike-struggles-2025-02-28/\n---\n\nCOMPETITOR SEARCH: Adidas Stan Smith competitors market positioning sneakers competitive landscape sneaker market\nRESULT 10:\nTitle: ResearchGate (PDF) Analysis of the Marketing Strategy of Adidas\nContent: September 13, 2023 - polyester and worked with partners to develop vegetable leathers , such as the Adidas Stan Smith, which is a vegan version [8]. All of these contribute to improving the reputation of the Adidas brand, winning the hearts and minds of consumers and increasing the competitiveness of the brand.\nURL: https://www.researchgate.net/publication/373896269_Analysis_of_the_Marketing_Strategy_of_Adidas\n---\n"
}