{
  "metadata": {
    "search_type": "competitor_search",
    "original_query": "Adidas Stan Smith vs Nike Air Force 1 vs Converse Chuck Taylor vs Puma classic white sneakers comparison",
    "timestamp": "2025-08-29T08:47:53.092271",
    "pwd": "/Users/orchidee/Documents/AI-market-agent/src",
    "saved_to": "/Users/orchidee/Documents/AI-market-agent/data/competitor_search_20250829_084753.json"
  },
  "search_results": {
    "queries": [
      {
        "search_query": "Adidas Stan Smith vs Nike Air Force 1 vs Converse Chuck Taylor vs Puma classic white sneakers comparison vs competitors comparison",
        "results_count": 10,
        "results": [
          {
            "title": "CONVERSE CHUCK TAYLOR 70 VS ALL STARS ! - YouTube",
            "content": "The Converse Chuck Taylor All Star is one of the most recognizable sneaker silhouettes in history. This classic sneaker has spanned generations and solidifie...",
            "url": "https://www.youtube.com/watch?v=dUAN99HEbwE"
          },
          {
            "title": "15 Best White Sneakers for Men 2025, According to GQ Editors | GQ",
            "content": "The Best White Sneaker for Adidas Stans : Adidas Samba LT Shoes, $120.Far, far gone from its tennis originas, the Stan Smiths are the shoe for lowkey creatives. Bleach- white , with a rounded toe, they were the sneakers that begat minimalist sneakers .",
            "url": "https://www.gq.com/story/best-white-sneakers"
          },
          {
            "title": "Adidas Samba Sizing Vs Nike | TikTok",
            "content": "Black Vs White Sambas Adidas . Nike Cortez Vs Adidas Samba Comparison . Adidas Samba Sizing Compared to Reeboks.",
            "url": "https://www.tiktok.com/discover/adidas-samba-sizing-vs-nike"
          },
          {
            "title": "Adidas Samba Real vs . Fake Guide 2025: How Can I Tell If... - Extrabux",
            "content": "Adidas Samba vs . Spezial vs . Stan Smith vs . Grand Court: Differences and Reivews 2025.Recommendation. Apple Watch Ultra 2 Real vs . Fake Guide 2025: How To Tell Original From Fake? Microsoft 365 A 1 vs . A3 vs . A5: Full Comparison & Verdict 2025.",
            "url": "https://www.extrabux.com/en/guide/8295001"
          },
          {
            "title": "Stan smith vs af 1 2025",
            "content": "Comparativa Adidas Stan Smith vs Nike Air Force 1 Runnea Very well made. C.",
            "url": "https://ohranatruda.of.by/?o=491503714"
          },
          {
            "title": "Do Hey Dude Shoes Fit Big or Small? [Sizing Comparison Photos]...",
            "content": "nike -womens- air -max-excee- vs -hey-dude-sizing. The main takeaway is expect Hey Dude shoe sizing to fall within the realm of true-to-size. If you don’t want to read through the entire article, you can see sizing comparison photos in the quick video below.",
            "url": "https://workwearcommand.com/hey-dude-shoe-sizing/"
          },
          {
            "title": "Стоит ли ходить с подворотами в 2025 году?",
            "content": "Nike Air Force 1 – универсальный силуэт, который идеально сочетается с подворотами.New Balance 550 – ретро-модель, которая органично смотрится в casual и streetwear образах. Puma Suede – классика, которая отлично дополняет подвёрнутые джинсы.",
            "url": "https://xn--80awro.xn--p1ai/news/stoit-li-khodit-s-podvorotami-v-2025-godu"
          },
          {
            "title": "ТОП-30 классических кроссовок — SHOPOZZ",
            "content": "Такие бренды, как Nike Air Max 1 , Adidas Samba, Converse Chuck Taylor All-Star, Reebok Classic Leather, Vans Old Skool, знакомы каждому. Они пережили не один модный виток, но сохранили свою популярность.кроссовки Adidas Originals Stan Smith .",
            "url": "https://shopozz.ru/article/view/top-30-klassicheskih-krossovok"
          },
          {
            "title": "ТОП-10 Кроссовок на осень 2025",
            "content": "Adidas Samba. Nike Air Force 1 . Кто еще не теряет популярности? Конечно же, белые Найк Эйр Форс 1. Эту пару полюбили за универсальный и минималистичный дизайн. Nike Air Jordan 1. Vans Old Skool. Converse Chuck Taylor . Asics Gel-Kayano 14. New Balance 9060.",
            "url": "https://outmaxshop.ru/article/2499-top-10-krossovok-na-osen-2025"
          },
          {
            "title": "ТОП лучших непромокаемых кроссовок 2022 года",
            "content": "Converse Chuck Taylor All Star Winter. Максимальную защиту от непогоды в этих мужских непромокаемых кроссовках обеспечивает технология Counter Climate с подкладкой.",
            "url": "https://sneakerfreak.ru/top-nepromokaemyh-krossovok/"
          }
        ]
      },
      {
        "search_query": "Adidas Stan Smith vs Nike Air Force 1 vs Converse Chuck Taylor vs Puma classic white sneakers comparison market share analysis 2025",
        "results_count": 10,
        "results": [
          {
            "title": "CONVERSE CHUCK TAYLOR 70 VS ALL STARS ! - YouTube",
            "content": "The Converse Chuck Taylor All Star is one of the most recognizable sneaker silhouettes in history. This classic sneaker has spanned generations and solidifie...",
            "url": "https://www.youtube.com/watch?v=dUAN99HEbwE"
          },
          {
            "title": "Стоит ли ходить с подворотами в 2025 году?",
            "content": "Nike Air Force 1 – универсальный силуэт, который идеально сочетается с подворотами.New Balance 550 – ретро-модель, которая органично смотрится в casual и streetwear образах. Puma Suede – классика, которая отлично дополняет подвёрнутые джинсы.",
            "url": "https://xn--80awro.xn--p1ai/news/stoit-li-khodit-s-podvorotami-v-2025-godu"
          },
          {
            "title": "15 Best White Sneakers for Men 2025 , According to GQ Editors | GQ",
            "content": "The Best White Sneaker for Adidas Stans : Adidas Samba LT Shoes, $120.Far, far gone from its tennis originas, the Stan Smiths are the shoe for lowkey creatives. Bleach- white , with a rounded toe, they were the sneakers that begat minimalist sneakers .",
            "url": "https://www.gq.com/story/best-white-sneakers"
          },
          {
            "title": "ТОП-10 Кроссовок на осень 2025",
            "content": "Adidas Samba. Nike Air Force 1 . Кто еще не теряет популярности? Nike Air Jordan 1. Vans Old Skool. Converse Chuck Taylor . Asics Gel-Kayano 14. New Balance 9060.",
            "url": "https://outmaxshop.ru/article/2499-top-10-krossovok-na-osen-2025"
          },
          {
            "title": "Топ-13 лучших кроссовок adidas : рейтинг 2025",
            "content": "Кроссовки adidas Stan Originals Stan Smith .Самые удобные кроссовки на каждый день: Puma , New Balance, adidas .",
            "url": "https://dolyame.ru/media/adidas-best-sneakers/"
          },
          {
            "title": "Как отличить оригинальные кроссовки nike от подделки?",
            "content": "В этой статье, мы расскажем Вам, как же всё-таки отличить оригинальные кроссовки Nike от подделки.",
            "url": "https://insneaker.ru/blogs/blog/fourth"
          },
          {
            "title": "Nike Release Dates 2025 - Updated in Real Time",
            "content": "The iconic Nike Air Force 1 followed in 1982 and also introduced the first six basketball-sponsored athletes wearing the sneaker on-court in the NBA.",
            "url": "https://www.soleretriever.com/sneaker-release-dates/nike"
          },
          {
            "title": "Adidas Samba Real vs . Fake Guide 2025 : How Can I Tell If... - Extrabux",
            "content": "Adidas Samba vs . Spezial vs . Stan Smith vs . Grand Court: Differences and Reivews 2025 .Recommendation. Apple Watch Ultra 2 Real vs . Fake Guide 2025 : How To Tell Original From Fake? Microsoft 365 A 1 vs . A3 vs . A5: Full Comparison & Verdict 2025 .",
            "url": "https://www.extrabux.com/en/guide/8295001"
          },
          {
            "title": "Stan smith vs af 1 2025",
            "content": "Comparativa Adidas Stan Smith vs Nike Air Force 1 Runnea Very well made. C.",
            "url": "https://ohranatruda.of.by/?o=491503714"
          },
          {
            "title": "ТОП-30 классических кроссовок — SHOPOZZ",
            "content": "Такие бренды, как Nike Air Max 1 , Adidas Samba, Converse Chuck Taylor All-Star, Reebok Classic Leather, Vans Old Skool, знакомы каждому. Они пережили не один модный виток, но сохранили свою популярность.кроссовки Adidas Originals Stan Smith .",
            "url": "https://shopozz.ru/article/view/top-30-klassicheskih-krossovok"
          }
        ]
      },
      {
        "search_query": "Adidas Stan Smith vs Nike Air Force 1 vs Converse Chuck Taylor vs Puma classic white sneakers comparison competitive landscape sneaker market",
        "results_count": 10,
        "results": [
          {
            "title": "Sneaker and Activewear | adidas US",
            "content": "Explore adidas sneakers for sports and daily wear. From versatile activewear to sporting goods and accessories for all ages and all levels.",
            "url": "https://www.adidas.com/us?msockid=0fb64cfb21fa66d1235b5aac200e670b"
          },
          {
            "title": "adidas | DICK'S Sporting Goods",
            "content": "Shop adidas shoes by sport, with shoes and cleats engineered for everything from football and baseball to basketball, running and golf. adidas shoes are built with a supportive but lightweight …",
            "url": "https://www.dickssportinggoods.com/s/brand-shop/adidas?msockid=0fb64cfb21fa66d1235b5aac200e670b"
          },
          {
            "title": "adidas Shoes, Apparel, & Accessories - Foot Locker",
            "content": "Shop the latest selection of adidas at Foot Locker. Find the hottest sneaker drops from brands like Jordan, Nike, Under Armour, New Balance, and a bunch more. Free shipping for FLX members.",
            "url": "https://www.footlocker.com/category/brands/adidas.html"
          },
          {
            "title": "Shop adidas Online - Nordstrom Rack",
            "content": "Find the latest selection of adidas in-store or online at Nordstrom. Shipping is always free and returns are accepted at any location. In-store pickup and alterations services available.",
            "url": "https://www.nordstromrack.com/brands/adidas?msockid=0fb64cfb21fa66d1235b5aac200e670b"
          },
          {
            "title": "adidas Online Shop | adidas US",
            "content": "SHOP BY COLLECTION adicolor Premium Collaborations adidas by Stella McCartney Gazelle Originals Samba",
            "url": "https://www.adidas.com/us/welcome?msockid=0fb64cfb21fa66d1235b5aac200e670b"
          },
          {
            "title": "adidas | Shoes, Apparel, Bags, & More | Zappos | Zappos.com",
            "content": "This collection features all your favorite classic adidas designs along with their latest trendsetting looks. With a variety of styles for men, women and kids, there’s something for everyone in our …",
            "url": "https://www.zappos.com/c/adidas?msockid=0fb64cfb21fa66d1235b5aac200e670b"
          },
          {
            "title": "adidas Shoes | Curbside Pickup Available at DICK'S",
            "content": "Shop the complete collection of adidas sneakers, cleats and more at DICK'S Sporting Goods. Browse top-rated adidas shoes for any sport, including adidas Running Shoes, adidas …",
            "url": "https://www.dickssportinggoods.com/f/adidas-athletic-sneakers?msockid=0fb64cfb21fa66d1235b5aac200e670b"
          },
          {
            "title": "Shop Shoes & Clothing Deals | adidas US",
            "content": "Find your adidas Shop at adidas.com. All styles and colors available in the official adidas online store.",
            "url": "https://www.adidas.com/us/shop?msockid=0fb64cfb21fa66d1235b5aac200e670b"
          },
          {
            "title": "adidas | Foot Locker",
            "content": "Shop the latest selection of adidas at Foot Locker. Find the hottest sneaker drops from brands like adidas, Jordan, Nike, Under Armour, New Balance, and a bunch more.",
            "url": "https://www.footlocker.com/adidas.html"
          },
          {
            "title": "Twitter . It’s what’s happening / Twitter",
            "content": "Official Twitter account of Adidas, sharing updates, promotions, and news about their products and brand.",
            "url": "https://twitter.com/adidas"
          }
        ]
      }
    ],
    "total_results": 30
  },
  "formatted_output": "COMPETITOR SEARCH: Adidas Stan Smith vs Nike Air Force 1 vs Converse Chuck Taylor vs Puma classic white sneakers comparison vs competitors comparison\nRESULT 1:\nTitle: CONVERSE CHUCK TAYLOR 70 VS ALL STARS ! - YouTube\nContent: The Converse Chuck Taylor All Star is one of the most recognizable sneaker silhouettes in history. This classic sneaker has spanned generations and solidifie...\nURL: https://www.youtube.com/watch?v=dUAN99HEbwE\n---\n\nCOMPETITOR SEARCH: Adidas Stan Smith vs Nike Air Force 1 vs Converse Chuck Taylor vs Puma classic white sneakers comparison vs competitors comparison\nRESULT 2:\nTitle: 15 Best White Sneakers for Men 2025, According to GQ Editors | GQ\nContent: The Best White Sneaker for Adidas Stans : Adidas Samba LT Shoes, $120.Far, far gone from its tennis originas, the Stan Smiths are the shoe for lowkey creatives. Bleach- white , with a rounded toe, they were the sneakers that begat minimalist sneakers .\nURL: https://www.gq.com/story/best-white-sneakers\n---\n\nCOMPETITOR SEARCH: Adidas Stan Smith vs Nike Air Force 1 vs Converse Chuck Taylor vs Puma classic white sneakers comparison vs competitors comparison\nRESULT 3:\nTitle: Adidas Samba Sizing Vs Nike | TikTok\nContent: Black Vs White Sambas Adidas . Nike Cortez Vs Adidas Samba Comparison . Adidas Samba Sizing Compared to Reeboks.\nURL: https://www.tiktok.com/discover/adidas-samba-sizing-vs-nike\n---\n\nCOMPETITOR SEARCH: Adidas Stan Smith vs Nike Air Force 1 vs Converse Chuck Taylor vs Puma classic white sneakers comparison vs competitors comparison\nRESULT 4:\nTitle: Adidas Samba Real vs . Fake Guide 2025: How Can I Tell If... - Extrabux\nContent: Adidas Samba vs . Spezial vs . Stan Smith vs . Grand Court: Differences and Reivews 2025.Recommendation. Apple Watch Ultra 2 Real vs . Fake Guide 2025: How To Tell Original From Fake? Microsoft 365 A 1 vs . A3 vs . A5: Full Comparison & Verdict 2025.\nURL: https://www.extrabux.com/en/guide/8295001\n---\n\nCOMPETITOR SEARCH: Adidas Stan Smith vs Nike Air Force 1 vs Converse Chuck Taylor vs Puma classic white sneakers comparison vs competitors comparison\nRESULT 5:\nTitle: Stan smith vs af 1 2025\nContent: Comparativa Adidas Stan Smith vs Nike Air Force 1 Runnea Very well made. C.\nURL: https://ohranatruda.of.by/?o=491503714\n---\n\nCOMPETITOR SEARCH: Adidas Stan Smith vs Nike Air Force 1 vs Converse Chuck Taylor vs Puma classic white sneakers comparison vs competitors comparison\nRESULT 6:\nTitle: Do Hey Dude Shoes Fit Big or Small? [Sizing Comparison Photos]...\nContent: nike -womens- air -max-excee- vs -hey-dude-sizing. The main takeaway is expect Hey Dude shoe sizing to fall within the realm of true-to-size. If you don’t want to read through the entire article, you can see sizing comparison photos in the quick video below.\nURL: https://workwearcommand.com/hey-dude-shoe-sizing/\n---\n\nCOMPETITOR SEARCH: Adidas Stan Smith vs Nike Air Force 1 vs Converse Chuck Taylor vs Puma classic white sneakers comparison vs competitors comparison\nRESULT 7:\nTitle: Стоит ли ходить с подворотами в 2025 году?\nContent: Nike Air Force 1 – универсальный силуэт, который идеально сочетается с подворотами.New Balance 550 – ретро-модель, которая органично смотрится в casual и streetwear образах. Puma Suede – классика, которая отлично дополняет подвёрнутые джинсы.\nURL: https://xn--80awro.xn--p1ai/news/stoit-li-khodit-s-podvorotami-v-2025-godu\n---\n\nCOMPETITOR SEARCH: Adidas Stan Smith vs Nike Air Force 1 vs Converse Chuck Taylor vs Puma classic white sneakers comparison vs competitors comparison\nRESULT 8:\nTitle: ТОП-30 классических кроссовок — SHOPOZZ\nContent: Такие бренды, как Nike Air Max 1 , Adidas Samba, Converse Chuck Taylor All-Star, Reebok Classic Leather, Vans Old Skool, знакомы каждому. Они пережили не один модный виток, но сохранили свою популярность.кроссовки Adidas Originals Stan Smith .\nURL: https://shopozz.ru/article/view/top-30-klassicheskih-krossovok\n---\n\nCOMPETITOR SEARCH: Adidas Stan Smith vs Nike Air Force 1 vs Converse Chuck Taylor vs Puma classic white sneakers comparison vs competitors comparison\nRESULT 9:\nTitle: ТОП-10 Кроссовок на осень 2025\nContent: Adidas Samba. Nike Air Force 1 . Кто еще не теряет популярности? Конечно же, белые Найк Эйр Форс 1. Эту пару полюбили за универсальный и минималистичный дизайн. Nike Air Jordan 1. Vans Old Skool. Converse Chuck Taylor . Asics Gel-Kayano 14. New Balance 9060.\nURL: https://outmaxshop.ru/article/2499-top-10-krossovok-na-osen-2025\n---\n\nCOMPETITOR SEARCH: Adidas Stan Smith vs Nike Air Force 1 vs Converse Chuck Taylor vs Puma classic white sneakers comparison vs competitors comparison\nRESULT 10:\nTitle: ТОП лучших непромокаемых кроссовок 2022 года\nContent: Converse Chuck Taylor All Star Winter. Максимальную защиту от непогоды в этих мужских непромокаемых кроссовках обеспечивает технология Counter Climate с подкладкой.\nURL: https://sneakerfreak.ru/top-nepromokaemyh-krossovok/\n---\n\nCOMPETITOR SEARCH: Adidas Stan Smith vs Nike Air Force 1 vs Converse Chuck Taylor vs Puma classic white sneakers comparison market share analysis 2025\nRESULT 1:\nTitle: CONVERSE CHUCK TAYLOR 70 VS ALL STARS ! - YouTube\nContent: The Converse Chuck Taylor All Star is one of the most recognizable sneaker silhouettes in history. This classic sneaker has spanned generations and solidifie...\nURL: https://www.youtube.com/watch?v=dUAN99HEbwE\n---\n\nCOMPETITOR SEARCH: Adidas Stan Smith vs Nike Air Force 1 vs Converse Chuck Taylor vs Puma classic white sneakers comparison market share analysis 2025\nRESULT 2:\nTitle: Стоит ли ходить с подворотами в 2025 году?\nContent: Nike Air Force 1 – универсальный силуэт, который идеально сочетается с подворотами.New Balance 550 – ретро-модель, которая органично смотрится в casual и streetwear образах. Puma Suede – классика, которая отлично дополняет подвёрнутые джинсы.\nURL: https://xn--80awro.xn--p1ai/news/stoit-li-khodit-s-podvorotami-v-2025-godu\n---\n\nCOMPETITOR SEARCH: Adidas Stan Smith vs Nike Air Force 1 vs Converse Chuck Taylor vs Puma classic white sneakers comparison market share analysis 2025\nRESULT 3:\nTitle: 15 Best White Sneakers for Men 2025 , According to GQ Editors | GQ\nContent: The Best White Sneaker for Adidas Stans : Adidas Samba LT Shoes, $120.Far, far gone from its tennis originas, the Stan Smiths are the shoe for lowkey creatives. Bleach- white , with a rounded toe, they were the sneakers that begat minimalist sneakers .\nURL: https://www.gq.com/story/best-white-sneakers\n---\n\nCOMPETITOR SEARCH: Adidas Stan Smith vs Nike Air Force 1 vs Converse Chuck Taylor vs Puma classic white sneakers comparison market share analysis 2025\nRESULT 4:\nTitle: ТОП-10 Кроссовок на осень 2025\nContent: Adidas Samba. Nike Air Force 1 . Кто еще не теряет популярности? Nike Air Jordan 1. Vans Old Skool. Converse Chuck Taylor . Asics Gel-Kayano 14. New Balance 9060.\nURL: https://outmaxshop.ru/article/2499-top-10-krossovok-na-osen-2025\n---\n\nCOMPETITOR SEARCH: Adidas Stan Smith vs Nike Air Force 1 vs Converse Chuck Taylor vs Puma classic white sneakers comparison market share analysis 2025\nRESULT 5:\nTitle: Топ-13 лучших кроссовок adidas : рейтинг 2025\nContent: Кроссовки adidas Stan Originals Stan Smith .Самые удобные кроссовки на каждый день: Puma , New Balance, adidas .\nURL: https://dolyame.ru/media/adidas-best-sneakers/\n---\n\nCOMPETITOR SEARCH: Adidas Stan Smith vs Nike Air Force 1 vs Converse Chuck Taylor vs Puma classic white sneakers comparison market share analysis 2025\nRESULT 6:\nTitle: Как отличить оригинальные кроссовки nike от подделки?\nContent: В этой статье, мы расскажем Вам, как же всё-таки отличить оригинальные кроссовки Nike от подделки.\nURL: https://insneaker.ru/blogs/blog/fourth\n---\n\nCOMPETITOR SEARCH: Adidas Stan Smith vs Nike Air Force 1 vs Converse Chuck Taylor vs Puma classic white sneakers comparison market share analysis 2025\nRESULT 7:\nTitle: Nike Release Dates 2025 - Updated in Real Time\nContent: The iconic Nike Air Force 1 followed in 1982 and also introduced the first six basketball-sponsored athletes wearing the sneaker on-court in the NBA.\nURL: https://www.soleretriever.com/sneaker-release-dates/nike\n---\n\nCOMPETITOR SEARCH: Adidas Stan Smith vs Nike Air Force 1 vs Converse Chuck Taylor vs Puma classic white sneakers comparison market share analysis 2025\nRESULT 8:\nTitle: Adidas Samba Real vs . Fake Guide 2025 : How Can I Tell If... - Extrabux\nContent: Adidas Samba vs . Spezial vs . Stan Smith vs . Grand Court: Differences and Reivews 2025 .Recommendation. Apple Watch Ultra 2 Real vs . Fake Guide 2025 : How To Tell Original From Fake? Microsoft 365 A 1 vs . A3 vs . A5: Full Comparison & Verdict 2025 .\nURL: https://www.extrabux.com/en/guide/8295001\n---\n\nCOMPETITOR SEARCH: Adidas Stan Smith vs Nike Air Force 1 vs Converse Chuck Taylor vs Puma classic white sneakers comparison market share analysis 2025\nRESULT 9:\nTitle: Stan smith vs af 1 2025\nContent: Comparativa Adidas Stan Smith vs Nike Air Force 1 Runnea Very well made. C.\nURL: https://ohranatruda.of.by/?o=491503714\n---\n\nCOMPETITOR SEARCH: Adidas Stan Smith vs Nike Air Force 1 vs Converse Chuck Taylor vs Puma classic white sneakers comparison market share analysis 2025\nRESULT 10:\nTitle: ТОП-30 классических кроссовок — SHOPOZZ\nContent: Такие бренды, как Nike Air Max 1 , Adidas Samba, Converse Chuck Taylor All-Star, Reebok Classic Leather, Vans Old Skool, знакомы каждому. Они пережили не один модный виток, но сохранили свою популярность.кроссовки Adidas Originals Stan Smith .\nURL: https://shopozz.ru/article/view/top-30-klassicheskih-krossovok\n---\n\nCOMPETITOR SEARCH: Adidas Stan Smith vs Nike Air Force 1 vs Converse Chuck Taylor vs Puma classic white sneakers comparison competitive landscape sneaker market\nRESULT 1:\nTitle: Sneaker and Activewear | adidas US\nContent: Explore adidas sneakers for sports and daily wear. From versatile activewear to sporting goods and accessories for all ages and all levels.\nURL: https://www.adidas.com/us?msockid=0fb64cfb21fa66d1235b5aac200e670b\n---\n\nCOMPETITOR SEARCH: Adidas Stan Smith vs Nike Air Force 1 vs Converse Chuck Taylor vs Puma classic white sneakers comparison competitive landscape sneaker market\nRESULT 2:\nTitle: adidas | DICK'S Sporting Goods\nContent: Shop adidas shoes by sport, with shoes and cleats engineered for everything from football and baseball to basketball, running and golf. adidas shoes are built with a supportive but lightweight …\nURL: https://www.dickssportinggoods.com/s/brand-shop/adidas?msockid=0fb64cfb21fa66d1235b5aac200e670b\n---\n\nCOMPETITOR SEARCH: Adidas Stan Smith vs Nike Air Force 1 vs Converse Chuck Taylor vs Puma classic white sneakers comparison competitive landscape sneaker market\nRESULT 3:\nTitle: adidas Shoes, Apparel, & Accessories - Foot Locker\nContent: Shop the latest selection of adidas at Foot Locker. Find the hottest sneaker drops from brands like Jordan, Nike, Under Armour, New Balance, and a bunch more. Free shipping for FLX members.\nURL: https://www.footlocker.com/category/brands/adidas.html\n---\n\nCOMPETITOR SEARCH: Adidas Stan Smith vs Nike Air Force 1 vs Converse Chuck Taylor vs Puma classic white sneakers comparison competitive landscape sneaker market\nRESULT 4:\nTitle: Shop adidas Online - Nordstrom Rack\nContent: Find the latest selection of adidas in-store or online at Nordstrom. Shipping is always free and returns are accepted at any location. In-store pickup and alterations services available.\nURL: https://www.nordstromrack.com/brands/adidas?msockid=0fb64cfb21fa66d1235b5aac200e670b\n---\n\nCOMPETITOR SEARCH: Adidas Stan Smith vs Nike Air Force 1 vs Converse Chuck Taylor vs Puma classic white sneakers comparison competitive landscape sneaker market\nRESULT 5:\nTitle: adidas Online Shop | adidas US\nContent: SHOP BY COLLECTION adicolor Premium Collaborations adidas by Stella McCartney Gazelle Originals Samba\nURL: https://www.adidas.com/us/welcome?msockid=0fb64cfb21fa66d1235b5aac200e670b\n---\n\nCOMPETITOR SEARCH: Adidas Stan Smith vs Nike Air Force 1 vs Converse Chuck Taylor vs Puma classic white sneakers comparison competitive landscape sneaker market\nRESULT 6:\nTitle: adidas | Shoes, Apparel, Bags, & More | Zappos | Zappos.com\nContent: This collection features all your favorite classic adidas designs along with their latest trendsetting looks. With a variety of styles for men, women and kids, there’s something for everyone in our …\nURL: https://www.zappos.com/c/adidas?msockid=0fb64cfb21fa66d1235b5aac200e670b\n---\n\nCOMPETITOR SEARCH: Adidas Stan Smith vs Nike Air Force 1 vs Converse Chuck Taylor vs Puma classic white sneakers comparison competitive landscape sneaker market\nRESULT 7:\nTitle: adidas Shoes | Curbside Pickup Available at DICK'S\nContent: Shop the complete collection of adidas sneakers, cleats and more at DICK'S Sporting Goods. Browse top-rated adidas shoes for any sport, including adidas Running Shoes, adidas …\nURL: https://www.dickssportinggoods.com/f/adidas-athletic-sneakers?msockid=0fb64cfb21fa66d1235b5aac200e670b\n---\n\nCOMPETITOR SEARCH: Adidas Stan Smith vs Nike Air Force 1 vs Converse Chuck Taylor vs Puma classic white sneakers comparison competitive landscape sneaker market\nRESULT 8:\nTitle: Shop Shoes & Clothing Deals | adidas US\nContent: Find your adidas Shop at adidas.com. All styles and colors available in the official adidas online store.\nURL: https://www.adidas.com/us/shop?msockid=0fb64cfb21fa66d1235b5aac200e670b\n---\n\nCOMPETITOR SEARCH: Adidas Stan Smith vs Nike Air Force 1 vs Converse Chuck Taylor vs Puma classic white sneakers comparison competitive landscape sneaker market\nRESULT 9:\nTitle: adidas | Foot Locker\nContent: Shop the latest selection of adidas at Foot Locker. Find the hottest sneaker drops from brands like adidas, Jordan, Nike, Under Armour, New Balance, and a bunch more.\nURL: https://www.footlocker.com/adidas.html\n---\n\nCOMPETITOR SEARCH: Adidas Stan Smith vs Nike Air Force 1 vs Converse Chuck Taylor vs Puma classic white sneakers comparison competitive landscape sneaker market\nRESULT 10:\nTitle: Twitter . It’s what’s happening / Twitter\nContent: Official Twitter account of Adidas, sharing updates, promotions, and news about their products and brand.\nURL: https://twitter.com/adidas\n---\n"
}