{
  "metadata": {
    "search_type": "competitor_search",
    "original_query": "Adidas Stan Smith competitors market positioning sneakers competitive landscape",
    "timestamp": "2025-08-29T09:02:39.081568",
    "pwd": "/Users/orchidee/Documents/AI-market-agent/src",
    "saved_to": "/Users/orchidee/Documents/AI-market-agent/data/competitor_search_20250829_090239.json"
  },
  "search_results": {
    "queries": [
      {
        "search_query": "Adidas Stan Smith competitors market positioning sneakers competitive landscape vs competitors comparison",
        "results_count": 10,
        "results": [
          {
            "title": "Adidas Stan Smith - Wikipedia",
            "content": "Adidas Stan Smith is a tennis shoe made by Adidas , and first launched in 1965. Originally named \" Adidas Robert Haillet\" after the brand endorsed French prominent player Robert Haillet, in 1978 the sneakers were renamed after Stan Smith ...",
            "url": "https://en.wikipedia.org/wiki/Adidas_Stan_Smith"
          },
          {
            "title": "Stan Smith Shoes | adidas US",
            "content": "The Stan Smith shoes from adidas Originals are an icon for a reason. The streamlined look and no-frills design add a simple and luxurious touch to every outfit.",
            "url": "https://www.adidas.com/us/stan_smith"
          },
          {
            "title": "15 Best White Sneakers for Men 2025, According to GQ Editors | GQ",
            "content": "Best White Sneaker for Adidas Stans : Adidas Samba OG Sneaker .Puma's long held an underdog position in the ongoing sneaker wars. That's fine with us, because that just means its classic styles are really sleeper hits.",
            "url": "https://www.gq.com/story/best-white-sneakers"
          },
          {
            "title": "Classic Homer Simpson Meme Inspires New Adidas Sneakers - Nerdist",
            "content": "Adidas Stan Smith Homer Simpson sneaker packaging.New Adidas Stan Smith shoes inspired by the Homer Simpson backing into the hedges moment from The Simpsons.",
            "url": "https://nerdist.com/article/homer-simpson-bushes-meme-becomes-new-adidas-sneakers/"
          },
          {
            "title": "Adidas Stan Smith Homer Simpson: Dâ€™oh",
            "content": "Wondering if the Adidas Stan Smith Homer Simpson is right for you? We take a look at the materials, quality, build and more to find out.",
            "url": "https://100wears.com/adidas-stan-smith-homer-simpson-doh/"
          },
          {
            "title": "Balenciaga x adidas Stan Smith Takes 'Dirty Sneaker ... | Man of Many",
            "content": "Balenciaga x adidas Stan Smith will officially release on December 16th at 3:00 pm GMT with prices starting at $800 USD.",
            "url": "https://manofmany.com/style/sneakers/balenciaga-adidas-stan-smith"
          },
          {
            "title": "History - adidas Group",
            "content": "A partnership with Stan Smith , seen here during his 1972 Wimbledon victory, signaled the start of a 50+ year relationship between adidas and the tennis icon.",
            "url": "https://www.adidas-group.com/en/about/history"
          },
          {
            "title": "adidas Jeremy Scott Sneakers for Men for Sale | Authenticity... | eBay",
            "content": "Get the best deals on adidas Jeremy Scott Sneakers for Men when you shop the largest online selection at eBay.com.",
            "url": "https://www.ebay.com/b/adidas-Jeremy-Scott-Sneakers-for-Men/15709/bn_57962"
          },
          {
            "title": "adidas sneaker stan smith - Bud Blady",
            "content": "adidas sneaker stan smith . Written By wwkellyvfjnu Wednesday, December 29, 2021 Add Comment Edit.Upcoming sneaker releases This is your go-to destination for adidas release dates. Such a good move from adidas that even Stan Smiths competitors beat.",
            "url": "https://bud-blady.blogspot.com/2021/12/adidas-sneaker-stan-smith.html"
          },
          {
            "title": "Adidas stan smith pink hotsell",
            "content": "adidas Originals Stan Smith Pink And Gold Sneakers Women in White Lyst Very well made.",
            "url": "https://panel.bulutgym.com/?p=14251221"
          }
        ]
      },
      {
        "search_query": "Adidas Stan Smith competitors market positioning sneakers competitive landscape market share analysis 2025",
        "results_count": 10,
        "results": [
          {
            "title": "Adidas Stan Smith - Wikipedia",
            "content": "Adidas Stan Smith is a tennis shoe made by Adidas , and first launched in 1965. Originally named \" Adidas Robert Haillet\" after the brand endorsed French prominent player Robert Haillet, in 1978 the sneakers were renamed after Stan Smith ...",
            "url": "https://en.wikipedia.org/wiki/Adidas_Stan_Smith"
          },
          {
            "title": "15 Best White Sneakers for Men 2025 , According to GQ Editors | GQ",
            "content": "We've tested countless versions of the best white sneakers for men over the years, and our favorites include pairs from brands like Adidas , Nike, and more.The Best White Sneaker for Adidas Stans : Adidas Samba LT Shoes, $120.",
            "url": "https://www.gq.com/story/best-white-sneakers"
          },
          {
            "title": "Stan Smith Shoes | adidas US",
            "content": "Shop Stan Smith shoes at adidas . Iconic style meets comfort in these classic sneakers , perfect for casual wear and your most fashion-forward outfits.",
            "url": "https://www.adidas.com/us/stan_smith"
          },
          {
            "title": "Foot Locker's Sneaker Market Position | Free Essay Example for...",
            "content": "1.2. Importance of Market Position Analysis 3.1. Market Share Analysis Market share in the sneaker industry depends on the category.",
            "url": "https://aithor.com/essay-examples/foot-lockers-sneaker-market-position"
          },
          {
            "title": "10 Editor-loved Comfy White Sneakers for Travel",
            "content": "Adidas Stan Smith sneakers . Courtesy of Adidas . sneakers sightseeing. They have a slightly less sporty look than other models on the market , meaning you can easily dress them up from day to night, and my feet never feel sore or fatigued after walking for hours in these.",
            "url": "https://www.travelandleisure.com/best-editor-loved-white-sneakers-8645563"
          },
          {
            "title": "Classic Homer Simpson Meme Inspires New Adidas Sneakers - Nerdist",
            "content": "Adidas Stan Smith Homer Simpson sneaker packaging.New Adidas Stan Smith shoes inspired by the Homer Simpson backing into the hedges moment from The Simpsons.",
            "url": "https://nerdist.com/article/homer-simpson-bushes-meme-becomes-new-adidas-sneakers/"
          },
          {
            "title": "United States Prefab Bathroom Pods Market Size 2026 | Innovation...",
            "content": "2. Market Competition by Manufacturers.United States Market Price Analysis by Region (2019-2024) 3.6 United States Production and Value, Year-over-Year Growth.",
            "url": "https://www.linkedin.com/pulse/united-states-prefab-bathroom-pods-market-size-2026-aqede/"
          },
          {
            "title": "Work Smarter, Not Harder: Top 5 AI Prompts Every Marketing ...",
            "content": "As Baltimore's marketing landscape evolves, combining AI efficiency with human creativity and strategic insight will be key to working smarter, not harder amid automation trends. Table of Contents. Methodology: How We Identified the Top 5 AI Prompts for Baltimore Marketers .",
            "url": "https://www.nucamp.co/blog/coding-bootcamp-baltimore-md-marketing-work-smarter-not-harder-top-5-ai-prompts-every-marketing-professional-in-baltimore-should-use-in-2025"
          },
          {
            "title": "EPE Film Market 2025 Business Standards and Competition ...",
            "content": "The EPE Film market report helps to understand the standard terms and conditions, such as offers, warranty, worthiness, and others. The report also helps identify the trends and factors driving the market 's growth along with a market segmentation analysis .",
            "url": "https://logcla.com/blogs/827856/EPE-Film-Market-2025-Business-Standards-and-Competition-Landscape-2034"
          },
          {
            "title": "TikTok SWOT Analysis ( 2025 ) | Business Strategy Hub",
            "content": "Founded in 2016, TikTok boasts a user-friendly interface, loyal user base, and global market presence. It faces competition ,content moderation challenges.",
            "url": "https://bstrategyhub.com/tiktok-swot-analysis/"
          }
        ]
      },
      {
        "search_query": "Adidas Stan Smith competitors market positioning sneakers competitive landscape competitive landscape sneaker market",
        "results_count": 10,
        "results": [
          {
            "title": "Sneakers - Wikipedia",
            "content": "Adidas Stan Smith of the 1980s. Sneaker sales rose so high, they began to adversely affect the sales of conventional leather shoes, leading to a fierce advertising war for market share in the late '50s. In the 1970s, jogging for exercise became increasingly popular, and trainers...",
            "url": "https://en.wikipedia.org/wiki/Sneakers"
          },
          {
            "title": "Stan Smith Shoes | adidas US",
            "content": "Shop Stan Smith shoes at adidas . Iconic style meets comfort in these classic sneakers , perfect for casual wear and your most fashion-forward outfits.",
            "url": "https://www.adidas.com/us/stan_smith"
          },
          {
            "title": "15 Best White Sneakers for Men 2025, According to GQ Editors | GQ",
            "content": "Best White Sneaker for Adidas Stans : Adidas Samba OG Sneaker .Puma's long held an underdog position in the ongoing sneaker wars. That's fine with us, because that just means its classic styles are really sleeper hits.",
            "url": "https://www.gq.com/story/best-white-sneakers"
          },
          {
            "title": "Sneakermarktonderzoek",
            "content": "In the sneaker market , it competes with Nike and Adidas , leveraging partnerships with celebrities, athletes, and fashion designers to attract consumers.",
            "url": "https://www.sisinternational.com/nl/expertise/industrieen/sneaker-market-research/"
          },
          {
            "title": "10 Editor-loved Comfy White Sneakers for Travel",
            "content": "Adidas Stan Smith sneakers . Courtesy of Adidas . sneakers sightseeing. They have a slightly less sporty look than other models on the market , meaning you can easily dress them up from day to night, and my feet never feel sore or fatigued after walking for hours in these.",
            "url": "https://www.travelandleisure.com/best-editor-loved-white-sneakers-8645563"
          },
          {
            "title": "History - adidas Group",
            "content": "A partnership with Stan Smith , seen here during his 1972 Wimbledon victory, signaled the start of a 50+ year relationship between adidas and the tennis icon.",
            "url": "https://www.adidas-group.com/en/about/history"
          },
          {
            "title": "Uncovering the Sneaker Market Landscape - Osum",
            "content": "In the competitive sneaker market , effective market segmentation is crucial for sneaker companies to understand their target consumers and develop tailored marketing strategies.Stay ahead of your competition . Discover new ways to unlock 10X growth.",
            "url": "https://blog.osum.com/sneaker-market-segmentation/"
          },
          {
            "title": "Comparing Nike, Adidas , and Under Armour in the... | Sneaker Style",
            "content": "The U.S. sneaker market has evolved into a battleground of innovation, cultural relevance, and brand loyalty. Among the top contenders, Nike, Adidas , and Under Armour have carved out distinct identities while competing fiercely for market share and cultural dominance.",
            "url": "https://sneakerstyle.us/Comparing-Nike-Adidas-and-Under-Armour-in-the-U-S-Sneaker-Scene"
          },
          {
            "title": "Sneakers and Activewear | adidas Canada",
            "content": "Find your style with sneakers and workout clothes from adidas . Explore bold designs and casual favourites that support fitness and everyday wear.",
            "url": "https://www.adidas.ca/"
          },
          {
            "title": "How to Succeed in Sneaker Reselling: Key Factors to... - BlockApps Inc.",
            "content": "As the sneaker resale market continues to experience exponential growth, with projections valuing it at $51.2 billion by 2032 ( Market Decipher), understanding.",
            "url": "https://blockapps.net/blog/key-factors-to-consider-for-successful-sneaker-reselling/"
          }
        ]
      }
    ],
    "total_results": 30
  },
  "formatted_output": "COMPETITOR SEARCH: Adidas Stan Smith competitors market positioning sneakers competitive landscape vs competitors comparison\nRESULT 1:\nTitle: Adidas Stan Smith - Wikipedia\nContent: Adidas Stan Smith is a tennis shoe made by Adidas , and first launched in 1965. Originally named \" Adidas Robert Haillet\" after the brand endorsed French prominent player Robert Haillet, in 1978 the sneakers were renamed after Stan Smith ...\nURL: https://en.wikipedia.org/wiki/Adidas_Stan_Smith\n---\n\nCOMPETITOR SEARCH: Adidas Stan Smith competitors market positioning sneakers competitive landscape vs competitors comparison\nRESULT 2:\nTitle: Stan Smith Shoes | adidas US\nContent: The Stan Smith shoes from adidas Originals are an icon for a reason. The streamlined look and no-frills design add a simple and luxurious touch to every outfit.\nURL: https://www.adidas.com/us/stan_smith\n---\n\nCOMPETITOR SEARCH: Adidas Stan Smith competitors market positioning sneakers competitive landscape vs competitors comparison\nRESULT 3:\nTitle: 15 Best White Sneakers for Men 2025, According to GQ Editors | GQ\nContent: Best White Sneaker for Adidas Stans : Adidas Samba OG Sneaker .Puma's long held an underdog position in the ongoing sneaker wars. That's fine with us, because that just means its classic styles are really sleeper hits.\nURL: https://www.gq.com/story/best-white-sneakers\n---\n\nCOMPETITOR SEARCH: Adidas Stan Smith competitors market positioning sneakers competitive landscape vs competitors comparison\nRESULT 4:\nTitle: Classic Homer Simpson Meme Inspires New Adidas Sneakers - Nerdist\nContent: Adidas Stan Smith Homer Simpson sneaker packaging.New Adidas Stan Smith shoes inspired by the Homer Simpson backing into the hedges moment from The Simpsons.\nURL: https://nerdist.com/article/homer-simpson-bushes-meme-becomes-new-adidas-sneakers/\n---\n\nCOMPETITOR SEARCH: Adidas Stan Smith competitors market positioning sneakers competitive landscape vs competitors comparison\nRESULT 5:\nTitle: Adidas Stan Smith Homer Simpson: Dâ€™oh\nContent: Wondering if the Adidas Stan Smith Homer Simpson is right for you? We take a look at the materials, quality, build and more to find out.\nURL: https://100wears.com/adidas-stan-smith-homer-simpson-doh/\n---\n\nCOMPETITOR SEARCH: Adidas Stan Smith competitors market positioning sneakers competitive landscape vs competitors comparison\nRESULT 6:\nTitle: Balenciaga x adidas Stan Smith Takes 'Dirty Sneaker ... | Man of Many\nContent: Balenciaga x adidas Stan Smith will officially release on December 16th at 3:00 pm GMT with prices starting at $800 USD.\nURL: https://manofmany.com/style/sneakers/balenciaga-adidas-stan-smith\n---\n\nCOMPETITOR SEARCH: Adidas Stan Smith competitors market positioning sneakers competitive landscape vs competitors comparison\nRESULT 7:\nTitle: History - adidas Group\nContent: A partnership with Stan Smith , seen here during his 1972 Wimbledon victory, signaled the start of a 50+ year relationship between adidas and the tennis icon.\nURL: https://www.adidas-group.com/en/about/history\n---\n\nCOMPETITOR SEARCH: Adidas Stan Smith competitors market positioning sneakers competitive landscape vs competitors comparison\nRESULT 8:\nTitle: adidas Jeremy Scott Sneakers for Men for Sale | Authenticity... | eBay\nContent: Get the best deals on adidas Jeremy Scott Sneakers for Men when you shop the largest online selection at eBay.com.\nURL: https://www.ebay.com/b/adidas-Jeremy-Scott-Sneakers-for-Men/15709/bn_57962\n---\n\nCOMPETITOR SEARCH: Adidas Stan Smith competitors market positioning sneakers competitive landscape vs competitors comparison\nRESULT 9:\nTitle: adidas sneaker stan smith - Bud Blady\nContent: adidas sneaker stan smith . Written By wwkellyvfjnu Wednesday, December 29, 2021 Add Comment Edit.Upcoming sneaker releases This is your go-to destination for adidas release dates. Such a good move from adidas that even Stan Smiths competitors beat.\nURL: https://bud-blady.blogspot.com/2021/12/adidas-sneaker-stan-smith.html\n---\n\nCOMPETITOR SEARCH: Adidas Stan Smith competitors market positioning sneakers competitive landscape vs competitors comparison\nRESULT 10:\nTitle: Adidas stan smith pink hotsell\nContent: adidas Originals Stan Smith Pink And Gold Sneakers Women in White Lyst Very well made.\nURL: https://panel.bulutgym.com/?p=14251221\n---\n\nCOMPETITOR SEARCH: Adidas Stan Smith competitors market positioning sneakers competitive landscape market share analysis 2025\nRESULT 1:\nTitle: Adidas Stan Smith - Wikipedia\nContent: Adidas Stan Smith is a tennis shoe made by Adidas , and first launched in 1965. Originally named \" Adidas Robert Haillet\" after the brand endorsed French prominent player Robert Haillet, in 1978 the sneakers were renamed after Stan Smith ...\nURL: https://en.wikipedia.org/wiki/Adidas_Stan_Smith\n---\n\nCOMPETITOR SEARCH: Adidas Stan Smith competitors market positioning sneakers competitive landscape market share analysis 2025\nRESULT 2:\nTitle: 15 Best White Sneakers for Men 2025 , According to GQ Editors | GQ\nContent: We've tested countless versions of the best white sneakers for men over the years, and our favorites include pairs from brands like Adidas , Nike, and more.The Best White Sneaker for Adidas Stans : Adidas Samba LT Shoes, $120.\nURL: https://www.gq.com/story/best-white-sneakers\n---\n\nCOMPETITOR SEARCH: Adidas Stan Smith competitors market positioning sneakers competitive landscape market share analysis 2025\nRESULT 3:\nTitle: Stan Smith Shoes | adidas US\nContent: Shop Stan Smith shoes at adidas . Iconic style meets comfort in these classic sneakers , perfect for casual wear and your most fashion-forward outfits.\nURL: https://www.adidas.com/us/stan_smith\n---\n\nCOMPETITOR SEARCH: Adidas Stan Smith competitors market positioning sneakers competitive landscape market share analysis 2025\nRESULT 4:\nTitle: Foot Locker's Sneaker Market Position | Free Essay Example for...\nContent: 1.2. Importance of Market Position Analysis 3.1. Market Share Analysis Market share in the sneaker industry depends on the category.\nURL: https://aithor.com/essay-examples/foot-lockers-sneaker-market-position\n---\n\nCOMPETITOR SEARCH: Adidas Stan Smith competitors market positioning sneakers competitive landscape market share analysis 2025\nRESULT 5:\nTitle: 10 Editor-loved Comfy White Sneakers for Travel\nContent: Adidas Stan Smith sneakers . Courtesy of Adidas . sneakers sightseeing. They have a slightly less sporty look than other models on the market , meaning you can easily dress them up from day to night, and my feet never feel sore or fatigued after walking for hours in these.\nURL: https://www.travelandleisure.com/best-editor-loved-white-sneakers-8645563\n---\n\nCOMPETITOR SEARCH: Adidas Stan Smith competitors market positioning sneakers competitive landscape market share analysis 2025\nRESULT 6:\nTitle: Classic Homer Simpson Meme Inspires New Adidas Sneakers - Nerdist\nContent: Adidas Stan Smith Homer Simpson sneaker packaging.New Adidas Stan Smith shoes inspired by the Homer Simpson backing into the hedges moment from The Simpsons.\nURL: https://nerdist.com/article/homer-simpson-bushes-meme-becomes-new-adidas-sneakers/\n---\n\nCOMPETITOR SEARCH: Adidas Stan Smith competitors market positioning sneakers competitive landscape market share analysis 2025\nRESULT 7:\nTitle: United States Prefab Bathroom Pods Market Size 2026 | Innovation...\nContent: 2. Market Competition by Manufacturers.United States Market Price Analysis by Region (2019-2024) 3.6 United States Production and Value, Year-over-Year Growth.\nURL: https://www.linkedin.com/pulse/united-states-prefab-bathroom-pods-market-size-2026-aqede/\n---\n\nCOMPETITOR SEARCH: Adidas Stan Smith competitors market positioning sneakers competitive landscape market share analysis 2025\nRESULT 8:\nTitle: Work Smarter, Not Harder: Top 5 AI Prompts Every Marketing ...\nContent: As Baltimore's marketing landscape evolves, combining AI efficiency with human creativity and strategic insight will be key to working smarter, not harder amid automation trends. Table of Contents. Methodology: How We Identified the Top 5 AI Prompts for Baltimore Marketers .\nURL: https://www.nucamp.co/blog/coding-bootcamp-baltimore-md-marketing-work-smarter-not-harder-top-5-ai-prompts-every-marketing-professional-in-baltimore-should-use-in-2025\n---\n\nCOMPETITOR SEARCH: Adidas Stan Smith competitors market positioning sneakers competitive landscape market share analysis 2025\nRESULT 9:\nTitle: EPE Film Market 2025 Business Standards and Competition ...\nContent: The EPE Film market report helps to understand the standard terms and conditions, such as offers, warranty, worthiness, and others. The report also helps identify the trends and factors driving the market 's growth along with a market segmentation analysis .\nURL: https://logcla.com/blogs/827856/EPE-Film-Market-2025-Business-Standards-and-Competition-Landscape-2034\n---\n\nCOMPETITOR SEARCH: Adidas Stan Smith competitors market positioning sneakers competitive landscape market share analysis 2025\nRESULT 10:\nTitle: TikTok SWOT Analysis ( 2025 ) | Business Strategy Hub\nContent: Founded in 2016, TikTok boasts a user-friendly interface, loyal user base, and global market presence. It faces competition ,content moderation challenges.\nURL: https://bstrategyhub.com/tiktok-swot-analysis/\n---\n\nCOMPETITOR SEARCH: Adidas Stan Smith competitors market positioning sneakers competitive landscape competitive landscape sneaker market\nRESULT 1:\nTitle: Sneakers - Wikipedia\nContent: Adidas Stan Smith of the 1980s. Sneaker sales rose so high, they began to adversely affect the sales of conventional leather shoes, leading to a fierce advertising war for market share in the late '50s. In the 1970s, jogging for exercise became increasingly popular, and trainers...\nURL: https://en.wikipedia.org/wiki/Sneakers\n---\n\nCOMPETITOR SEARCH: Adidas Stan Smith competitors market positioning sneakers competitive landscape competitive landscape sneaker market\nRESULT 2:\nTitle: Stan Smith Shoes | adidas US\nContent: Shop Stan Smith shoes at adidas . Iconic style meets comfort in these classic sneakers , perfect for casual wear and your most fashion-forward outfits.\nURL: https://www.adidas.com/us/stan_smith\n---\n\nCOMPETITOR SEARCH: Adidas Stan Smith competitors market positioning sneakers competitive landscape competitive landscape sneaker market\nRESULT 3:\nTitle: 15 Best White Sneakers for Men 2025, According to GQ Editors | GQ\nContent: Best White Sneaker for Adidas Stans : Adidas Samba OG Sneaker .Puma's long held an underdog position in the ongoing sneaker wars. That's fine with us, because that just means its classic styles are really sleeper hits.\nURL: https://www.gq.com/story/best-white-sneakers\n---\n\nCOMPETITOR SEARCH: Adidas Stan Smith competitors market positioning sneakers competitive landscape competitive landscape sneaker market\nRESULT 4:\nTitle: Sneakermarktonderzoek\nContent: In the sneaker market , it competes with Nike and Adidas , leveraging partnerships with celebrities, athletes, and fashion designers to attract consumers.\nURL: https://www.sisinternational.com/nl/expertise/industrieen/sneaker-market-research/\n---\n\nCOMPETITOR SEARCH: Adidas Stan Smith competitors market positioning sneakers competitive landscape competitive landscape sneaker market\nRESULT 5:\nTitle: 10 Editor-loved Comfy White Sneakers for Travel\nContent: Adidas Stan Smith sneakers . Courtesy of Adidas . sneakers sightseeing. They have a slightly less sporty look than other models on the market , meaning you can easily dress them up from day to night, and my feet never feel sore or fatigued after walking for hours in these.\nURL: https://www.travelandleisure.com/best-editor-loved-white-sneakers-8645563\n---\n\nCOMPETITOR SEARCH: Adidas Stan Smith competitors market positioning sneakers competitive landscape competitive landscape sneaker market\nRESULT 6:\nTitle: History - adidas Group\nContent: A partnership with Stan Smith , seen here during his 1972 Wimbledon victory, signaled the start of a 50+ year relationship between adidas and the tennis icon.\nURL: https://www.adidas-group.com/en/about/history\n---\n\nCOMPETITOR SEARCH: Adidas Stan Smith competitors market positioning sneakers competitive landscape competitive landscape sneaker market\nRESULT 7:\nTitle: Uncovering the Sneaker Market Landscape - Osum\nContent: In the competitive sneaker market , effective market segmentation is crucial for sneaker companies to understand their target consumers and develop tailored marketing strategies.Stay ahead of your competition . Discover new ways to unlock 10X growth.\nURL: https://blog.osum.com/sneaker-market-segmentation/\n---\n\nCOMPETITOR SEARCH: Adidas Stan Smith competitors market positioning sneakers competitive landscape competitive landscape sneaker market\nRESULT 8:\nTitle: Comparing Nike, Adidas , and Under Armour in the... | Sneaker Style\nContent: The U.S. sneaker market has evolved into a battleground of innovation, cultural relevance, and brand loyalty. Among the top contenders, Nike, Adidas , and Under Armour have carved out distinct identities while competing fiercely for market share and cultural dominance.\nURL: https://sneakerstyle.us/Comparing-Nike-Adidas-and-Under-Armour-in-the-U-S-Sneaker-Scene\n---\n\nCOMPETITOR SEARCH: Adidas Stan Smith competitors market positioning sneakers competitive landscape competitive landscape sneaker market\nRESULT 9:\nTitle: Sneakers and Activewear | adidas Canada\nContent: Find your style with sneakers and workout clothes from adidas . Explore bold designs and casual favourites that support fitness and everyday wear.\nURL: https://www.adidas.ca/\n---\n\nCOMPETITOR SEARCH: Adidas Stan Smith competitors market positioning sneakers competitive landscape competitive landscape sneaker market\nRESULT 10:\nTitle: How to Succeed in Sneaker Reselling: Key Factors to... - BlockApps Inc.\nContent: As the sneaker resale market continues to experience exponential growth, with projections valuing it at $51.2 billion by 2032 ( Market Decipher), understanding.\nURL: https://blockapps.net/blog/key-factors-to-consider-for-successful-sneaker-reselling/\n---\n"
}