{
  "metadata": {
    "search_type": "competitor_search",
    "original_query": "Adidas Stan Smith competitors market positioning sneakers competitive landscape",
    "timestamp": "2025-08-29T08:47:06.280630",
    "pwd": "/Users/orchidee/Documents/AI-market-agent/src",
    "saved_to": "/Users/orchidee/Documents/AI-market-agent/data/competitor_search_20250829_084706.json"
  },
  "search_results": {
    "queries": [
      {
        "search_query": "Adidas Stan Smith competitors market positioning sneakers competitive landscape vs competitors comparison",
        "results_count": 10,
        "results": [
          {
            "title": "Sneaker and Activewear | adidas US",
            "content": "Explore adidas sneakers for sports and daily wear. From versatile activewear to sporting goods and accessories for all ages and all levels.",
            "url": "https://www.adidas.com/us?msockid=13d116996a516ad0194400ce6be26b99"
          },
          {
            "title": "adidas | DICK'S Sporting Goods",
            "content": "Shop adidas shoes by sport, with shoes and cleats engineered for everything from football and baseball to basketball, running and golf. adidas shoes are built with a supportive but lightweight fit and flexible grooves along the sole for easy movement.",
            "url": "https://www.dickssportinggoods.com/s/brand-shop/adidas?msockid=13d116996a516ad0194400ce6be26b99"
          },
          {
            "title": "adidas Shoes, Apparel, & Accessories - Foot Locker",
            "content": "Shop the latest selection of adidas at Foot Locker. Find the hottest sneaker drops from brands like Jordan, Nike, Under Armour, New Balance, and a bunch more. Free shipping for FLX members.",
            "url": "https://www.footlocker.com/category/brands/adidas.html"
          },
          {
            "title": "Shop adidas Online - Nordstrom Rack",
            "content": "Find the latest selection of adidas in-store or online at Nordstrom. Shipping is always free and returns are accepted at any location. In-store pickup and alterations services available.",
            "url": "https://www.nordstromrack.com/brands/adidas?msockid=13d116996a516ad0194400ce6be26b99"
          },
          {
            "title": "adidas Online Shop | adidas US",
            "content": "SHOP BY COLLECTION adicolor Premium Collaborations adidas by Stella McCartney Gazelle Originals Samba",
            "url": "https://www.adidas.com/us/welcome?msockid=13d116996a516ad0194400ce6be26b99"
          },
          {
            "title": "adidas | Shoes, Apparel, Bags, & More | Zappos | Zappos.com",
            "content": "This collection features all your favorite classic adidas designs along with their latest trendsetting looks. With a variety of styles for men, women and kids, there’s something for everyone in our …",
            "url": "https://www.zappos.com/c/adidas?msockid=13d116996a516ad0194400ce6be26b99"
          },
          {
            "title": "adidas Shoes | Curbside Pickup Available at DICK'S",
            "content": "Shop the complete collection of adidas sneakers, cleats and more at DICK'S Sporting Goods. Browse top-rated adidas shoes for any sport, including adidas Running Shoes, adidas Basketball Shoes, adidas Cleats, adidas Golf Shoes and more.",
            "url": "https://www.dickssportinggoods.com/f/adidas-athletic-sneakers?msockid=13d116996a516ad0194400ce6be26b99"
          },
          {
            "title": "Shop Shoes & Clothing Deals | adidas US",
            "content": "Find your adidas Shop at adidas.com. All styles and colors available in the official adidas online store.",
            "url": "https://www.adidas.com/us/shop?msockid=13d116996a516ad0194400ce6be26b99"
          },
          {
            "title": "adidas | Foot Locker",
            "content": "Shop the latest selection of adidas at Foot Locker. Find the hottest sneaker drops from brands like adidas, Jordan, Nike, Under Armour, New Balance, and a bunch more.",
            "url": "https://www.footlocker.com/adidas.html"
          },
          {
            "title": "Twitter . It’s what’s happening / Twitter",
            "content": "Official Twitter account of Adidas, sharing updates, promotions, and news about their products and brand.",
            "url": "https://twitter.com/adidas"
          }
        ]
      },
      {
        "search_query": "Adidas Stan Smith competitors market positioning sneakers competitive landscape market share analysis 2025",
        "results_count": 10,
        "results": [
          {
            "title": "15 Best White Sneakers for Men 2025 , According to GQ Editors | GQ",
            "content": "We've tested countless versions of the best white sneakers for men over the years, and our favorites include pairs from brands like Adidas , Nike, and more.The Best White Sneaker for Adidas Stans : Adidas Samba LT Shoes, $120.",
            "url": "https://www.gq.com/story/best-white-sneakers"
          },
          {
            "title": "Stan Smith Shoes | adidas US",
            "content": "Shop Stan Smith shoes at adidas . Iconic style meets comfort in these classic sneakers , perfect for casual wear and your most fashion-forward outfits.",
            "url": "https://www.adidas.com/us/stan_smith"
          },
          {
            "title": "10 Editor-loved Comfy White Sneakers for Travel",
            "content": "Adidas Stan Smith sneakers . Courtesy of Adidas . sneakers sightseeing. They have a slightly less sporty look than other models on the market , meaning you can easily dress them up from day to night, and my feet never feel sore or fatigued after walking for hours in these.",
            "url": "https://www.travelandleisure.com/best-editor-loved-white-sneakers-8645563"
          },
          {
            "title": "Foot Locker's Sneaker Market Position | Free Essay Example for...",
            "content": "1.2. Importance of Market Position Analysis 3.1. Market Share Analysis Market share in the sneaker industry depends on the category.",
            "url": "https://aithor.com/essay-examples/foot-lockers-sneaker-market-position"
          },
          {
            "title": "Classic Homer Simpson Meme Inspires New Adidas Sneakers - Nerdist",
            "content": "Adidas Stan Smith Homer Simpson sneaker packaging.New Adidas Stan Smith shoes inspired by the Homer Simpson backing into the hedges moment from The Simpsons.",
            "url": "https://nerdist.com/article/homer-simpson-bushes-meme-becomes-new-adidas-sneakers/"
          },
          {
            "title": "Avatar World 2025 Updates: A New Era of Customization, Exploration...",
            "content": "Competitive Landscape . Avatar World is not alone in the simulation and sandbox market . Games like Roblox, The Sims, and Toca Life World continue to dominate the space. However, Avatar World differentiates itself by focusing heavily on accessibility, inclusivity, and a balanced mix of...",
            "url": "https://hexajoystick.com/blog/news/avatar-world-2025-updates-a-new-era-of-customization-exploration-and-creativity"
          },
          {
            "title": "TikTok SWOT Analysis ( 2025 ) | Business Strategy Hub",
            "content": "Founded in 2016, TikTok boasts a user-friendly interface, loyal user base, and global market presence. It faces competition ,content moderation challenges.",
            "url": "https://bstrategyhub.com/tiktok-swot-analysis/"
          },
          {
            "title": "Latin America Pen Multimeter Market Size, Insights, Forecasts & IoT...",
            "content": "Segment-specific analysis enables companies to assess competitive intensity, market share , and potential for innovation. Latin America Production Value Market Share by Manufacturers (2019-2024). Latin America Key Players of Industry Ranking, 2022 VS ...",
            "url": "https://www.linkedin.com/pulse/latin-america-pen-multimeter-market-size-insights-i1i1c/"
          },
          {
            "title": "Japan’s top 300 brands grow 6% in 2025 , led by Toyota | Brand Finance",
            "content": "TOKYO, 28 August 2025 – Toyota maintains its iron grip as Japan’s most valuable brand for a decade, as the nation’s top 300 brands experienced a 6% year-on-year growth to JPY108.0 trillion in 2025 , according to the latest Japan 300 2025 report by Brand Finance...",
            "url": "https://brandfinance.com/press-releases/japans-top-300-brands-grow-6-in-2025-led-by-toyota"
          },
          {
            "title": "AI for Competitive Intelligence | Crayon",
            "content": "Lead Product Marketing Manager, Market and Competitive Intelligence Oyster. “ Competing in a crowded market means our sellers have a lot of information to digest.",
            "url": "https://www.crayon.co/product/crayon-ai"
          }
        ]
      },
      {
        "search_query": "Adidas Stan Smith competitors market positioning sneakers competitive landscape competitive landscape sneaker market",
        "results_count": 10,
        "results": [
          {
            "title": "Stan Smith Shoes | adidas US",
            "content": "Shop Stan Smith shoes at adidas . Iconic style meets comfort in these classic sneakers , perfect for casual wear and your most fashion-forward outfits.",
            "url": "https://www.adidas.com/us/stan_smith"
          },
          {
            "title": "Sneakermarktonderzoek",
            "content": "In the sneaker market , it competes with Nike and Adidas , leveraging partnerships with celebrities, athletes, and fashion designers to attract consumers.",
            "url": "https://www.sisinternational.com/nl/expertise/industrieen/sneaker-market-research/"
          },
          {
            "title": "Comparing Nike, Adidas , and Under Armour in the... | Sneaker Style",
            "content": "The U.S. sneaker market has evolved into a battleground of innovation, cultural relevance, and brand loyalty. Among the top contenders, Nike, Adidas , and Under Armour have carved out distinct identities while competing fiercely for market share and cultural dominance.",
            "url": "https://sneakerstyle.us/Comparing-Nike-Adidas-and-Under-Armour-in-the-U-S-Sneaker-Scene"
          },
          {
            "title": "10 Editor-loved Comfy White Sneakers for Travel",
            "content": "Adidas Stan Smith sneakers . Courtesy of Adidas . sneakers sightseeing. They have a slightly less sporty look than other models on the market , meaning you can easily dress them up from day to night, and my feet never feel sore or fatigued after walking for hours in these.",
            "url": "https://www.travelandleisure.com/best-editor-loved-white-sneakers-8645563"
          },
          {
            "title": "Uncovering the Sneaker Market Landscape - Osum",
            "content": "In the competitive sneaker market , effective market segmentation is crucial for sneaker companies to understand their target consumers and develop tailored marketing strategies.Stay ahead of your competition . Discover new ways to unlock 10X growth.",
            "url": "https://blog.osum.com/sneaker-market-segmentation/"
          },
          {
            "title": "15 Best White Sneakers for Men 2025, According to GQ Editors | GQ",
            "content": "Best White Sneaker for Adidas Stans : Adidas Samba OG Sneaker .Puma's long held an underdog position in the ongoing sneaker wars. That's fine with us, because that just means its classic styles are really sleeper hits.",
            "url": "https://www.gq.com/story/best-white-sneakers"
          },
          {
            "title": "History - adidas Group",
            "content": "A partnership with Stan Smith , seen here during his 1972 Wimbledon victory, signaled the start of a 50+ year relationship between adidas and the tennis icon.",
            "url": "https://www.adidas-group.com/en/about/history"
          },
          {
            "title": "Sneakers and Activewear | adidas Canada",
            "content": "Find your style with sneakers and workout clothes from adidas . Explore bold designs and casual favourites that support fitness and everyday wear.",
            "url": "https://www.adidas.ca/"
          },
          {
            "title": "How to Succeed in Sneaker Reselling: Key Factors to... - BlockApps Inc.",
            "content": "As the sneaker resale market continues to experience exponential growth, with projections valuing it at $51.2 billion by 2032 ( Market Decipher), understanding.",
            "url": "https://blockapps.net/blog/key-factors-to-consider-for-successful-sneaker-reselling/"
          },
          {
            "title": "adidas Originals: Shop Classic Vintange Collection Online | adidas IN",
            "content": "Shop adidas Originals in India. Explore authentic streetwear, from classic sneakers to modern apparel, available online with nationwide delivery.",
            "url": "https://www.adidas.co.in/originals"
          }
        ]
      }
    ],
    "total_results": 30
  },
  "formatted_output": "COMPETITOR SEARCH: Adidas Stan Smith competitors market positioning sneakers competitive landscape vs competitors comparison\nRESULT 1:\nTitle: Sneaker and Activewear | adidas US\nContent: Explore adidas sneakers for sports and daily wear. From versatile activewear to sporting goods and accessories for all ages and all levels.\nURL: https://www.adidas.com/us?msockid=13d116996a516ad0194400ce6be26b99\n---\n\nCOMPETITOR SEARCH: Adidas Stan Smith competitors market positioning sneakers competitive landscape vs competitors comparison\nRESULT 2:\nTitle: adidas | DICK'S Sporting Goods\nContent: Shop adidas shoes by sport, with shoes and cleats engineered for everything from football and baseball to basketball, running and golf. adidas shoes are built with a supportive but lightweight fit and flexible grooves along the sole for easy movement.\nURL: https://www.dickssportinggoods.com/s/brand-shop/adidas?msockid=13d116996a516ad0194400ce6be26b99\n---\n\nCOMPETITOR SEARCH: Adidas Stan Smith competitors market positioning sneakers competitive landscape vs competitors comparison\nRESULT 3:\nTitle: adidas Shoes, Apparel, & Accessories - Foot Locker\nContent: Shop the latest selection of adidas at Foot Locker. Find the hottest sneaker drops from brands like Jordan, Nike, Under Armour, New Balance, and a bunch more. Free shipping for FLX members.\nURL: https://www.footlocker.com/category/brands/adidas.html\n---\n\nCOMPETITOR SEARCH: Adidas Stan Smith competitors market positioning sneakers competitive landscape vs competitors comparison\nRESULT 4:\nTitle: Shop adidas Online - Nordstrom Rack\nContent: Find the latest selection of adidas in-store or online at Nordstrom. Shipping is always free and returns are accepted at any location. In-store pickup and alterations services available.\nURL: https://www.nordstromrack.com/brands/adidas?msockid=13d116996a516ad0194400ce6be26b99\n---\n\nCOMPETITOR SEARCH: Adidas Stan Smith competitors market positioning sneakers competitive landscape vs competitors comparison\nRESULT 5:\nTitle: adidas Online Shop | adidas US\nContent: SHOP BY COLLECTION adicolor Premium Collaborations adidas by Stella McCartney Gazelle Originals Samba\nURL: https://www.adidas.com/us/welcome?msockid=13d116996a516ad0194400ce6be26b99\n---\n\nCOMPETITOR SEARCH: Adidas Stan Smith competitors market positioning sneakers competitive landscape vs competitors comparison\nRESULT 6:\nTitle: adidas | Shoes, Apparel, Bags, & More | Zappos | Zappos.com\nContent: This collection features all your favorite classic adidas designs along with their latest trendsetting looks. With a variety of styles for men, women and kids, there’s something for everyone in our …\nURL: https://www.zappos.com/c/adidas?msockid=13d116996a516ad0194400ce6be26b99\n---\n\nCOMPETITOR SEARCH: Adidas Stan Smith competitors market positioning sneakers competitive landscape vs competitors comparison\nRESULT 7:\nTitle: adidas Shoes | Curbside Pickup Available at DICK'S\nContent: Shop the complete collection of adidas sneakers, cleats and more at DICK'S Sporting Goods. Browse top-rated adidas shoes for any sport, including adidas Running Shoes, adidas Basketball Shoes, adidas Cleats, adidas Golf Shoes and more.\nURL: https://www.dickssportinggoods.com/f/adidas-athletic-sneakers?msockid=13d116996a516ad0194400ce6be26b99\n---\n\nCOMPETITOR SEARCH: Adidas Stan Smith competitors market positioning sneakers competitive landscape vs competitors comparison\nRESULT 8:\nTitle: Shop Shoes & Clothing Deals | adidas US\nContent: Find your adidas Shop at adidas.com. All styles and colors available in the official adidas online store.\nURL: https://www.adidas.com/us/shop?msockid=13d116996a516ad0194400ce6be26b99\n---\n\nCOMPETITOR SEARCH: Adidas Stan Smith competitors market positioning sneakers competitive landscape vs competitors comparison\nRESULT 9:\nTitle: adidas | Foot Locker\nContent: Shop the latest selection of adidas at Foot Locker. Find the hottest sneaker drops from brands like adidas, Jordan, Nike, Under Armour, New Balance, and a bunch more.\nURL: https://www.footlocker.com/adidas.html\n---\n\nCOMPETITOR SEARCH: Adidas Stan Smith competitors market positioning sneakers competitive landscape vs competitors comparison\nRESULT 10:\nTitle: Twitter . It’s what’s happening / Twitter\nContent: Official Twitter account of Adidas, sharing updates, promotions, and news about their products and brand.\nURL: https://twitter.com/adidas\n---\n\nCOMPETITOR SEARCH: Adidas Stan Smith competitors market positioning sneakers competitive landscape market share analysis 2025\nRESULT 1:\nTitle: 15 Best White Sneakers for Men 2025 , According to GQ Editors | GQ\nContent: We've tested countless versions of the best white sneakers for men over the years, and our favorites include pairs from brands like Adidas , Nike, and more.The Best White Sneaker for Adidas Stans : Adidas Samba LT Shoes, $120.\nURL: https://www.gq.com/story/best-white-sneakers\n---\n\nCOMPETITOR SEARCH: Adidas Stan Smith competitors market positioning sneakers competitive landscape market share analysis 2025\nRESULT 2:\nTitle: Stan Smith Shoes | adidas US\nContent: Shop Stan Smith shoes at adidas . Iconic style meets comfort in these classic sneakers , perfect for casual wear and your most fashion-forward outfits.\nURL: https://www.adidas.com/us/stan_smith\n---\n\nCOMPETITOR SEARCH: Adidas Stan Smith competitors market positioning sneakers competitive landscape market share analysis 2025\nRESULT 3:\nTitle: 10 Editor-loved Comfy White Sneakers for Travel\nContent: Adidas Stan Smith sneakers . Courtesy of Adidas . sneakers sightseeing. They have a slightly less sporty look than other models on the market , meaning you can easily dress them up from day to night, and my feet never feel sore or fatigued after walking for hours in these.\nURL: https://www.travelandleisure.com/best-editor-loved-white-sneakers-8645563\n---\n\nCOMPETITOR SEARCH: Adidas Stan Smith competitors market positioning sneakers competitive landscape market share analysis 2025\nRESULT 4:\nTitle: Foot Locker's Sneaker Market Position | Free Essay Example for...\nContent: 1.2. Importance of Market Position Analysis 3.1. Market Share Analysis Market share in the sneaker industry depends on the category.\nURL: https://aithor.com/essay-examples/foot-lockers-sneaker-market-position\n---\n\nCOMPETITOR SEARCH: Adidas Stan Smith competitors market positioning sneakers competitive landscape market share analysis 2025\nRESULT 5:\nTitle: Classic Homer Simpson Meme Inspires New Adidas Sneakers - Nerdist\nContent: Adidas Stan Smith Homer Simpson sneaker packaging.New Adidas Stan Smith shoes inspired by the Homer Simpson backing into the hedges moment from The Simpsons.\nURL: https://nerdist.com/article/homer-simpson-bushes-meme-becomes-new-adidas-sneakers/\n---\n\nCOMPETITOR SEARCH: Adidas Stan Smith competitors market positioning sneakers competitive landscape market share analysis 2025\nRESULT 6:\nTitle: Avatar World 2025 Updates: A New Era of Customization, Exploration...\nContent: Competitive Landscape . Avatar World is not alone in the simulation and sandbox market . Games like Roblox, The Sims, and Toca Life World continue to dominate the space. However, Avatar World differentiates itself by focusing heavily on accessibility, inclusivity, and a balanced mix of...\nURL: https://hexajoystick.com/blog/news/avatar-world-2025-updates-a-new-era-of-customization-exploration-and-creativity\n---\n\nCOMPETITOR SEARCH: Adidas Stan Smith competitors market positioning sneakers competitive landscape market share analysis 2025\nRESULT 7:\nTitle: TikTok SWOT Analysis ( 2025 ) | Business Strategy Hub\nContent: Founded in 2016, TikTok boasts a user-friendly interface, loyal user base, and global market presence. It faces competition ,content moderation challenges.\nURL: https://bstrategyhub.com/tiktok-swot-analysis/\n---\n\nCOMPETITOR SEARCH: Adidas Stan Smith competitors market positioning sneakers competitive landscape market share analysis 2025\nRESULT 8:\nTitle: Latin America Pen Multimeter Market Size, Insights, Forecasts & IoT...\nContent: Segment-specific analysis enables companies to assess competitive intensity, market share , and potential for innovation. Latin America Production Value Market Share by Manufacturers (2019-2024). Latin America Key Players of Industry Ranking, 2022 VS ...\nURL: https://www.linkedin.com/pulse/latin-america-pen-multimeter-market-size-insights-i1i1c/\n---\n\nCOMPETITOR SEARCH: Adidas Stan Smith competitors market positioning sneakers competitive landscape market share analysis 2025\nRESULT 9:\nTitle: Japan’s top 300 brands grow 6% in 2025 , led by Toyota | Brand Finance\nContent: TOKYO, 28 August 2025 – Toyota maintains its iron grip as Japan’s most valuable brand for a decade, as the nation’s top 300 brands experienced a 6% year-on-year growth to JPY108.0 trillion in 2025 , according to the latest Japan 300 2025 report by Brand Finance...\nURL: https://brandfinance.com/press-releases/japans-top-300-brands-grow-6-in-2025-led-by-toyota\n---\n\nCOMPETITOR SEARCH: Adidas Stan Smith competitors market positioning sneakers competitive landscape market share analysis 2025\nRESULT 10:\nTitle: AI for Competitive Intelligence | Crayon\nContent: Lead Product Marketing Manager, Market and Competitive Intelligence Oyster. “ Competing in a crowded market means our sellers have a lot of information to digest.\nURL: https://www.crayon.co/product/crayon-ai\n---\n\nCOMPETITOR SEARCH: Adidas Stan Smith competitors market positioning sneakers competitive landscape competitive landscape sneaker market\nRESULT 1:\nTitle: Stan Smith Shoes | adidas US\nContent: Shop Stan Smith shoes at adidas . Iconic style meets comfort in these classic sneakers , perfect for casual wear and your most fashion-forward outfits.\nURL: https://www.adidas.com/us/stan_smith\n---\n\nCOMPETITOR SEARCH: Adidas Stan Smith competitors market positioning sneakers competitive landscape competitive landscape sneaker market\nRESULT 2:\nTitle: Sneakermarktonderzoek\nContent: In the sneaker market , it competes with Nike and Adidas , leveraging partnerships with celebrities, athletes, and fashion designers to attract consumers.\nURL: https://www.sisinternational.com/nl/expertise/industrieen/sneaker-market-research/\n---\n\nCOMPETITOR SEARCH: Adidas Stan Smith competitors market positioning sneakers competitive landscape competitive landscape sneaker market\nRESULT 3:\nTitle: Comparing Nike, Adidas , and Under Armour in the... | Sneaker Style\nContent: The U.S. sneaker market has evolved into a battleground of innovation, cultural relevance, and brand loyalty. Among the top contenders, Nike, Adidas , and Under Armour have carved out distinct identities while competing fiercely for market share and cultural dominance.\nURL: https://sneakerstyle.us/Comparing-Nike-Adidas-and-Under-Armour-in-the-U-S-Sneaker-Scene\n---\n\nCOMPETITOR SEARCH: Adidas Stan Smith competitors market positioning sneakers competitive landscape competitive landscape sneaker market\nRESULT 4:\nTitle: 10 Editor-loved Comfy White Sneakers for Travel\nContent: Adidas Stan Smith sneakers . Courtesy of Adidas . sneakers sightseeing. They have a slightly less sporty look than other models on the market , meaning you can easily dress them up from day to night, and my feet never feel sore or fatigued after walking for hours in these.\nURL: https://www.travelandleisure.com/best-editor-loved-white-sneakers-8645563\n---\n\nCOMPETITOR SEARCH: Adidas Stan Smith competitors market positioning sneakers competitive landscape competitive landscape sneaker market\nRESULT 5:\nTitle: Uncovering the Sneaker Market Landscape - Osum\nContent: In the competitive sneaker market , effective market segmentation is crucial for sneaker companies to understand their target consumers and develop tailored marketing strategies.Stay ahead of your competition . Discover new ways to unlock 10X growth.\nURL: https://blog.osum.com/sneaker-market-segmentation/\n---\n\nCOMPETITOR SEARCH: Adidas Stan Smith competitors market positioning sneakers competitive landscape competitive landscape sneaker market\nRESULT 6:\nTitle: 15 Best White Sneakers for Men 2025, According to GQ Editors | GQ\nContent: Best White Sneaker for Adidas Stans : Adidas Samba OG Sneaker .Puma's long held an underdog position in the ongoing sneaker wars. That's fine with us, because that just means its classic styles are really sleeper hits.\nURL: https://www.gq.com/story/best-white-sneakers\n---\n\nCOMPETITOR SEARCH: Adidas Stan Smith competitors market positioning sneakers competitive landscape competitive landscape sneaker market\nRESULT 7:\nTitle: History - adidas Group\nContent: A partnership with Stan Smith , seen here during his 1972 Wimbledon victory, signaled the start of a 50+ year relationship between adidas and the tennis icon.\nURL: https://www.adidas-group.com/en/about/history\n---\n\nCOMPETITOR SEARCH: Adidas Stan Smith competitors market positioning sneakers competitive landscape competitive landscape sneaker market\nRESULT 8:\nTitle: Sneakers and Activewear | adidas Canada\nContent: Find your style with sneakers and workout clothes from adidas . Explore bold designs and casual favourites that support fitness and everyday wear.\nURL: https://www.adidas.ca/\n---\n\nCOMPETITOR SEARCH: Adidas Stan Smith competitors market positioning sneakers competitive landscape competitive landscape sneaker market\nRESULT 9:\nTitle: How to Succeed in Sneaker Reselling: Key Factors to... - BlockApps Inc.\nContent: As the sneaker resale market continues to experience exponential growth, with projections valuing it at $51.2 billion by 2032 ( Market Decipher), understanding.\nURL: https://blockapps.net/blog/key-factors-to-consider-for-successful-sneaker-reselling/\n---\n\nCOMPETITOR SEARCH: Adidas Stan Smith competitors market positioning sneakers competitive landscape competitive landscape sneaker market\nRESULT 10:\nTitle: adidas Originals: Shop Classic Vintange Collection Online | adidas IN\nContent: Shop adidas Originals in India. Explore authentic streetwear, from classic sneakers to modern apparel, available online with nationwide delivery.\nURL: https://www.adidas.co.in/originals\n---\n"
}