{
  "metadata": {
    "search_type": "competitor_search",
    "original_query": "Matcha powder",
    "timestamp": "2025-08-28T17:46:07.724173",
    "pwd": "/Users/orchidee/Documents/AI-market-agent/src",
    "saved_to": "/Users/orchidee/Documents/AI-market-agent/data/competitor_search_20250828_174607.json"
  },
  "search_results": {
    "queries": [
      {
        "search_query": "Matcha powder vs competitors comparison",
        "results_count": 10,
        "results": [
          {
            "title": "The 6 Best Matcha Powders of 2025, Tested & Reviewed",
            "content": "We tried 14 matchas to find the six best picks for every budget . Our favorites include options for beginners, everyday sippers, and matcha aficionados.",
            "url": "https://www.seriouseats.com/best-matcha-powder-8757655"
          },
          {
            "title": "The Best Matcha Powder, Vetted by a Daily Drinker (2025)",
            "content": "Aug 5, 2025 — Sourced from Japan and made with early harvest leaves, the best matcha powder delivers smooth flavor and vibrant color .",
            "url": "https://www.bonappetit.com/story/best-matcha-powder?srsltid=AfmBOooCBTgO39PACcm6hO-F1vYtXmc2-ApSPKyDG883R74DtVTv0r85"
          },
          {
            "title": "11 Best Matcha Powders 2025 | The Strategist",
            "content": "May 5, 2025 — 11 of the Very Best Matcha Powders . We asked matcha drinkers and bakers about their favorite tins. Portrait of Emma Wartzman",
            "url": "https://nymag.com/strategist/article/best-matcha-powder.html"
          },
          {
            "title": "What's the best cost-effective matcha available in Canada?",
            "content": "One of the big reasons matcha is so expensive is because it is aged for 6-12 months in a refrigerated storage unit. You can find other tea ...",
            "url": "https://www.reddit.com/r/tea/comments/ps153a/whats_the_best_costeffective_matcha_available_in/"
          },
          {
            "title": "Side By Side Matcha Comparison - Kimberley's Kyusu",
            "content": "Jan 24, 2022 — Matcha 1 — Nishio Bloom | Has a thick texture to its powder which took me a while to sift compared to other matchas I have but I was able to ...",
            "url": "https://kimberleyskyusu.com/2022/01/24/side-by-side-matcha-comparison-featuring-three-matchas-from-naoki-matcha/"
          },
          {
            "title": "5 of the Best Matcha Green Tea Brands Out There 2023",
            "content": "Oct 14, 2015 — My opinions are : I taste McCormick Gourmet Organic Matcha Green Tea with Ginger Seasoning but it is very strong Matcha Ginger. I taste Rishi ...",
            "url": "https://theteacupoflife.com/2015/10/5-of-best-matcha-green-tea-brands-out.html"
          },
          {
            "title": "Best Matcha on a Budget",
            "content": "Jan 12, 2025 — Best Matcha on a Budget ; 2. Hawa Matcha's Ceremonial Blend · : $0.60/g (100g) ; 3. Astrid Tea's Okita · : $1.16/g (30g) or $1.00/g (50g) ; 4. Nio ...",
            "url": "https://www.mymatchaaddiction.com/learn/bestmatchaonabudget"
          },
          {
            "title": "The Best Matcha Powders, According to Nutritionists",
            "content": "Apr 11, 2024 — We tried and tested ceremonial and culinary grade matcha powders for whisking up a cup or making a matcha latte. These are the best options.",
            "url": "https://www.goodhousekeeping.com/food-products/g43949855/best-matcha-powders/"
          },
          {
            "title": "Best Matcha Powder, Taste-Tested by Experts (2025)",
            "content": "Jun 24, 2025 — Ceremonial grade matcha is considered the higher quality powder and is ideal for drinking, while culinary grade is better for baking. While this ...",
            "url": "https://www.garagegymreviews.com/best-matcha-powder"
          },
          {
            "title": "Best Matcha Powder Review 🍵 (Aug. 2025)",
            "content": "Ceremonial Grade Matcha : Our premium, 100% organic matcha tea powder is ground from the most tender matcha leaves, plucked each spring from our farm ...",
            "url": "https://mykitchenadvisor.com/matcha-powder/"
          }
        ]
      },
      {
        "search_query": "Matcha powder market share analysis 2025",
        "results_count": 10,
        "results": [
          {
            "title": "MATCHA - Your Essential Guide to Japan Travel, Culture, Hotels, …",
            "content": "MATCHA is a media platform that introduces Japan travel information such as places to visit, hotel reservations, hot spring facilities, dining, shopping, recommended itineraries, and more. We also publish official information from local governments, tourist associations, and businesses.",
            "url": "https://matcha-jp.com/en/"
          },
          {
            "title": "MATCHA - 日本の観光・文化・ホテル情報を世界に届けるメディア",
            "content": "MATCHA (マッチャ)は、日本を観光する旅行者に、観光スポット、ホテル予約や温泉、グルメ、ショッピング、モデルコースなど、さまざまな情報を紹介するメディアです。",
            "url": "https://matcha-jp.com/jp/"
          },
          {
            "title": "Top 5 Drugstores in Japan 2025: With Duty-Free and Coupons",
            "content": "Jun 30, 2025 · Editorial assistant at MATCHA since 2022. I'm from Tokyo, and I often go to parks on weekends to see nature and dogs. I have loved international exchange since I was a child, and during my university years I studied abroad in San Jose, USA.",
            "url": "https://matcha-jp.com/en/12147"
          },
          {
            "title": "Don Quijote Must-Buy: Top 20 Skincare Items and Snacks - MATCHA",
            "content": "Jul 18, 2025 · This is the official account of MATCHA's editorial department. Our articles feature useful travel information for visitors to Japan, from how-to guides to recommended places to visit.",
            "url": "https://matcha-jp.com/en/24885"
          },
          {
            "title": "Matcha Making Tokyo | Matcha making experience in Asakusa",
            "content": "Jul 12, 2025 · If you're visiting Tokyo, why not immerse yourself in the world of matcha as a special cultural experience? At Matcha Making Tokyo, you can actually make matcha while learning about the history and traditions of the Japanese tea ceremony.",
            "url": "https://matcha-jp.com/en/12407"
          },
          {
            "title": "20 Best Things to Do in Osaka 2025: With Family, Day Trips",
            "content": "Jul 23, 2025 · Ramona, English content editor at MATCHA since 2016, has been practicing ikebana flower arrangement (Ikenobo School) and tea ceremony (Omote Senke) since 2012. She arrived in Japan in 2012 as a graduate student with a focus on Japanese literature and performing arts.",
            "url": "https://matcha-jp.com/en/5841"
          },
          {
            "title": "Osaka World Expo 2025: Dates, Ticket Prices, and Attractions",
            "content": "Apr 18, 2025 · Travel writer and assistant editor at MATCHA with extensive travel around the Osaka, Kyoto, and Wakayama areas. A Kansai insider who knows their Akashiyaki from their …",
            "url": "https://matcha-jp.com/en/24348"
          },
          {
            "title": "Ginza Shopping: Malls, Department Stores, Restaurants, and More",
            "content": "May 28, 2025 · This is the official account of MATCHA's editorial department. Our articles feature useful travel information for visitors to Japan, from how-to guides to recommended places to visit. This service includes sponsored advertisements.",
            "url": "https://matcha-jp.com/en/6221"
          },
          {
            "title": "【Fukuoka Yame】Yame, famous for Yame green tea, one of the …",
            "content": "Feb 14, 2025 · When we think about Yame, it's Yame green tea! When you come to Yame, you should definitely visit the Yame Central Tea Plantation. Because of the spectacular view of the tea plantation, you will be motivated to open up windows of your car and go for a drive. In this article, we will briefly touch on how to get to the Yame Central Tea Plantation.",
            "url": "https://matcha-jp.com/en/17160"
          },
          {
            "title": "Japanese Soy Milk: Varieties And Flavors All Tastebuds Can",
            "content": "Jun 20, 2020 · At the supermarket, you will be able to find soy milk with flavors such as matcha, oshiruko, ume (plum), black bean, and even amazake (sweet sake). The flavors are familiar to those who often eat Japanese food, while still keeping the soybean taste that many have come to …",
            "url": "https://matcha-jp.com/en/3950"
          }
        ]
      },
      {
        "search_query": "Matcha powder competitive landscape tea market",
        "results_count": 10,
        "results": [
          {
            "title": "Matcha Tea Market Size, Competitors & Forecast to 2033",
            "content": "The Matcha Tea Market, valued at USD 3.4B in 2024, is projected to reach USD 5.9B by 2033 , growing at a 6.3% CAGR.",
            "url": "https://www.researchandmarkets.com/report/matcha?srsltid=AfmBOor8Wv7T0NjtouzyRiJTJO3quJYRxk0-lJqp44vZsaDpNKsM5nxw"
          },
          {
            "title": "Matcha Tea Market Analysis, Size, Share, Industry Trends ...",
            "content": "Matcha tea market size in 2023: USD 3.4 billion . Projected market size by 2032: USD 6.3 billion. Asia-Pacific region held 42.4% market share in 2022. Powder ...",
            "url": "https://www.marketresearchfuture.com/reports/matcha-tea-market-2382"
          },
          {
            "title": "Matcha Tea Market Size, Share, Growth, Trends & Forecast",
            "content": "Matcha Tea Market size was valued at USD 3.63 Billion in 2024 and is projected to reach USD 8.67 Billion in 2031, growing at a CAGR of 11.48% from 2024 to 2031.",
            "url": "https://www.verifiedmarketresearch.com/product/matcha-tea-market/"
          },
          {
            "title": "The Matcha Tea Market: A Blend of Tradition, Health, and ...",
            "content": "It provides strategic insights into the evolving dynamics, competitive landscape , and emerging opportunities within the global Matcha Tea Market ...",
            "url": "https://www.linkedin.com/pulse/matcha-tea-market-blend-tradition-health-global-demand-bobby-singh-sx4wf"
          },
          {
            "title": "Matcha Tea Market Size, Share & Growth Report, 2025",
            "content": "The global matcha tea market size to be valued at USD 2.26 billion by 2025 and is expected to grow at a CAGR of 4.7% during the forecast period.",
            "url": "https://www.grandviewresearch.com/industry-analysis/matcha-tea-market"
          },
          {
            "title": "The Matcha Movement A Deep Dive into the Green Tea ...",
            "content": "Oct 18, 2024 — The competitive landscape of the matcha green tea powder market has seen notable mergers and acquisitions as companies seek to expand their ...",
            "url": "https://www.marketresearchintellect.com/blog/the-matcha-movement-a-deep-dive-into-the-green-tea-powder-market/"
          },
          {
            "title": "Matcha Powder Market Size, Share & Demand",
            "content": "The global matcha powder market is driven by rise in consumer focus toward adopting healthy lifestyle and health benefits associated with matcha powder .",
            "url": "https://www.alliedmarketresearch.com/matcha-powder-market"
          },
          {
            "title": "Matcha Market Size, Share & Growth Trends 2025-2032",
            "content": "Jun 6, 2025 — Matcha Market was valued at USD 4.67 Bn. in 2024 and is expected to reach USD 7.46 Bn. by 2032, at a CAGR of 6.03%.",
            "url": "https://www.stellarmr.com/report/matcha-market/2688"
          },
          {
            "title": "Matcha Tea Powder Market Size, Share, Trends & Forecast ...",
            "content": "The global matcha tea powder market was valued at US$ 11.0 Bn in 2022; It is estimated to grow at a CAGR of 7.9% from 2023 to 2031 and reach US$ 21.6 Bn by ...",
            "url": "https://www.transparencymarketresearch.com/matcha-tea-powder-market.html"
          },
          {
            "title": "Global Matcha Tea Market - 2022-2029",
            "content": "Matcha Tea Market was valued at USD YY million in 2021 . It is forecasted to reach USD YY million by 2029, growing at a CAGR of 7.34% during the forecast period ...",
            "url": "https://www.marketresearch.com/DataM-Intelligence-4Market-Research-LLP-v4207/Global-Matcha-Tea-32394348/"
          }
        ]
      }
    ],
    "total_results": 30
  },
  "formatted_output": "COMPETITOR SEARCH: Matcha powder vs competitors comparison\nRESULT 1:\nTitle: The 6 Best Matcha Powders of 2025, Tested & Reviewed\nContent: We tried 14 matchas to find the six best picks for every budget . Our favorites include options for beginners, everyday sippers, and matcha aficionados.\nURL: https://www.seriouseats.com/best-matcha-powder-8757655\n---\n\nCOMPETITOR SEARCH: Matcha powder vs competitors comparison\nRESULT 2:\nTitle: The Best Matcha Powder, Vetted by a Daily Drinker (2025)\nContent: Aug 5, 2025 — Sourced from Japan and made with early harvest leaves, the best matcha powder delivers smooth flavor and vibrant color .\nURL: https://www.bonappetit.com/story/best-matcha-powder?srsltid=AfmBOooCBTgO39PACcm6hO-F1vYtXmc2-ApSPKyDG883R74DtVTv0r85\n---\n\nCOMPETITOR SEARCH: Matcha powder vs competitors comparison\nRESULT 3:\nTitle: 11 Best Matcha Powders 2025 | The Strategist\nContent: May 5, 2025 — 11 of the Very Best Matcha Powders . We asked matcha drinkers and bakers about their favorite tins. Portrait of Emma Wartzman\nURL: https://nymag.com/strategist/article/best-matcha-powder.html\n---\n\nCOMPETITOR SEARCH: Matcha powder vs competitors comparison\nRESULT 4:\nTitle: What's the best cost-effective matcha available in Canada?\nContent: One of the big reasons matcha is so expensive is because it is aged for 6-12 months in a refrigerated storage unit. You can find other tea ...\nURL: https://www.reddit.com/r/tea/comments/ps153a/whats_the_best_costeffective_matcha_available_in/\n---\n\nCOMPETITOR SEARCH: Matcha powder vs competitors comparison\nRESULT 5:\nTitle: Side By Side Matcha Comparison - Kimberley's Kyusu\nContent: Jan 24, 2022 — Matcha 1 — Nishio Bloom | Has a thick texture to its powder which took me a while to sift compared to other matchas I have but I was able to ...\nURL: https://kimberleyskyusu.com/2022/01/24/side-by-side-matcha-comparison-featuring-three-matchas-from-naoki-matcha/\n---\n\nCOMPETITOR SEARCH: Matcha powder vs competitors comparison\nRESULT 6:\nTitle: 5 of the Best Matcha Green Tea Brands Out There 2023\nContent: Oct 14, 2015 — My opinions are : I taste McCormick Gourmet Organic Matcha Green Tea with Ginger Seasoning but it is very strong Matcha Ginger. I taste Rishi ...\nURL: https://theteacupoflife.com/2015/10/5-of-best-matcha-green-tea-brands-out.html\n---\n\nCOMPETITOR SEARCH: Matcha powder vs competitors comparison\nRESULT 7:\nTitle: Best Matcha on a Budget\nContent: Jan 12, 2025 — Best Matcha on a Budget ; 2. Hawa Matcha's Ceremonial Blend · : $0.60/g (100g) ; 3. Astrid Tea's Okita · : $1.16/g (30g) or $1.00/g (50g) ; 4. Nio ...\nURL: https://www.mymatchaaddiction.com/learn/bestmatchaonabudget\n---\n\nCOMPETITOR SEARCH: Matcha powder vs competitors comparison\nRESULT 8:\nTitle: The Best Matcha Powders, According to Nutritionists\nContent: Apr 11, 2024 — We tried and tested ceremonial and culinary grade matcha powders for whisking up a cup or making a matcha latte. These are the best options.\nURL: https://www.goodhousekeeping.com/food-products/g43949855/best-matcha-powders/\n---\n\nCOMPETITOR SEARCH: Matcha powder vs competitors comparison\nRESULT 9:\nTitle: Best Matcha Powder, Taste-Tested by Experts (2025)\nContent: Jun 24, 2025 — Ceremonial grade matcha is considered the higher quality powder and is ideal for drinking, while culinary grade is better for baking. While this ...\nURL: https://www.garagegymreviews.com/best-matcha-powder\n---\n\nCOMPETITOR SEARCH: Matcha powder vs competitors comparison\nRESULT 10:\nTitle: Best Matcha Powder Review 🍵 (Aug. 2025)\nContent: Ceremonial Grade Matcha : Our premium, 100% organic matcha tea powder is ground from the most tender matcha leaves, plucked each spring from our farm ...\nURL: https://mykitchenadvisor.com/matcha-powder/\n---\n\nCOMPETITOR SEARCH: Matcha powder market share analysis 2025\nRESULT 1:\nTitle: MATCHA - Your Essential Guide to Japan Travel, Culture, Hotels, …\nContent: MATCHA is a media platform that introduces Japan travel information such as places to visit, hotel reservations, hot spring facilities, dining, shopping, recommended itineraries, and more. We also publish official information from local governments, tourist associations, and businesses.\nURL: https://matcha-jp.com/en/\n---\n\nCOMPETITOR SEARCH: Matcha powder market share analysis 2025\nRESULT 2:\nTitle: MATCHA - 日本の観光・文化・ホテル情報を世界に届けるメディア\nContent: MATCHA (マッチャ)は、日本を観光する旅行者に、観光スポット、ホテル予約や温泉、グルメ、ショッピング、モデルコースなど、さまざまな情報を紹介するメディアです。\nURL: https://matcha-jp.com/jp/\n---\n\nCOMPETITOR SEARCH: Matcha powder market share analysis 2025\nRESULT 3:\nTitle: Top 5 Drugstores in Japan 2025: With Duty-Free and Coupons\nContent: Jun 30, 2025 · Editorial assistant at MATCHA since 2022. I'm from Tokyo, and I often go to parks on weekends to see nature and dogs. I have loved international exchange since I was a child, and during my university years I studied abroad in San Jose, USA.\nURL: https://matcha-jp.com/en/12147\n---\n\nCOMPETITOR SEARCH: Matcha powder market share analysis 2025\nRESULT 4:\nTitle: Don Quijote Must-Buy: Top 20 Skincare Items and Snacks - MATCHA\nContent: Jul 18, 2025 · This is the official account of MATCHA's editorial department. Our articles feature useful travel information for visitors to Japan, from how-to guides to recommended places to visit.\nURL: https://matcha-jp.com/en/24885\n---\n\nCOMPETITOR SEARCH: Matcha powder market share analysis 2025\nRESULT 5:\nTitle: Matcha Making Tokyo | Matcha making experience in Asakusa\nContent: Jul 12, 2025 · If you're visiting Tokyo, why not immerse yourself in the world of matcha as a special cultural experience? At Matcha Making Tokyo, you can actually make matcha while learning about the history and traditions of the Japanese tea ceremony.\nURL: https://matcha-jp.com/en/12407\n---\n\nCOMPETITOR SEARCH: Matcha powder market share analysis 2025\nRESULT 6:\nTitle: 20 Best Things to Do in Osaka 2025: With Family, Day Trips\nContent: Jul 23, 2025 · Ramona, English content editor at MATCHA since 2016, has been practicing ikebana flower arrangement (Ikenobo School) and tea ceremony (Omote Senke) since 2012. She arrived in Japan in 2012 as a graduate student with a focus on Japanese literature and performing arts.\nURL: https://matcha-jp.com/en/5841\n---\n\nCOMPETITOR SEARCH: Matcha powder market share analysis 2025\nRESULT 7:\nTitle: Osaka World Expo 2025: Dates, Ticket Prices, and Attractions\nContent: Apr 18, 2025 · Travel writer and assistant editor at MATCHA with extensive travel around the Osaka, Kyoto, and Wakayama areas. A Kansai insider who knows their Akashiyaki from their …\nURL: https://matcha-jp.com/en/24348\n---\n\nCOMPETITOR SEARCH: Matcha powder market share analysis 2025\nRESULT 8:\nTitle: Ginza Shopping: Malls, Department Stores, Restaurants, and More\nContent: May 28, 2025 · This is the official account of MATCHA's editorial department. Our articles feature useful travel information for visitors to Japan, from how-to guides to recommended places to visit. This service includes sponsored advertisements.\nURL: https://matcha-jp.com/en/6221\n---\n\nCOMPETITOR SEARCH: Matcha powder market share analysis 2025\nRESULT 9:\nTitle: 【Fukuoka Yame】Yame, famous for Yame green tea, one of the …\nContent: Feb 14, 2025 · When we think about Yame, it's Yame green tea! When you come to Yame, you should definitely visit the Yame Central Tea Plantation. Because of the spectacular view of the tea plantation, you will be motivated to open up windows of your car and go for a drive. In this article, we will briefly touch on how to get to the Yame Central Tea Plantation.\nURL: https://matcha-jp.com/en/17160\n---\n\nCOMPETITOR SEARCH: Matcha powder market share analysis 2025\nRESULT 10:\nTitle: Japanese Soy Milk: Varieties And Flavors All Tastebuds Can\nContent: Jun 20, 2020 · At the supermarket, you will be able to find soy milk with flavors such as matcha, oshiruko, ume (plum), black bean, and even amazake (sweet sake). The flavors are familiar to those who often eat Japanese food, while still keeping the soybean taste that many have come to …\nURL: https://matcha-jp.com/en/3950\n---\n\nCOMPETITOR SEARCH: Matcha powder competitive landscape tea market\nRESULT 1:\nTitle: Matcha Tea Market Size, Competitors & Forecast to 2033\nContent: The Matcha Tea Market, valued at USD 3.4B in 2024, is projected to reach USD 5.9B by 2033 , growing at a 6.3% CAGR.\nURL: https://www.researchandmarkets.com/report/matcha?srsltid=AfmBOor8Wv7T0NjtouzyRiJTJO3quJYRxk0-lJqp44vZsaDpNKsM5nxw\n---\n\nCOMPETITOR SEARCH: Matcha powder competitive landscape tea market\nRESULT 2:\nTitle: Matcha Tea Market Analysis, Size, Share, Industry Trends ...\nContent: Matcha tea market size in 2023: USD 3.4 billion . Projected market size by 2032: USD 6.3 billion. Asia-Pacific region held 42.4% market share in 2022. Powder ...\nURL: https://www.marketresearchfuture.com/reports/matcha-tea-market-2382\n---\n\nCOMPETITOR SEARCH: Matcha powder competitive landscape tea market\nRESULT 3:\nTitle: Matcha Tea Market Size, Share, Growth, Trends & Forecast\nContent: Matcha Tea Market size was valued at USD 3.63 Billion in 2024 and is projected to reach USD 8.67 Billion in 2031, growing at a CAGR of 11.48% from 2024 to 2031.\nURL: https://www.verifiedmarketresearch.com/product/matcha-tea-market/\n---\n\nCOMPETITOR SEARCH: Matcha powder competitive landscape tea market\nRESULT 4:\nTitle: The Matcha Tea Market: A Blend of Tradition, Health, and ...\nContent: It provides strategic insights into the evolving dynamics, competitive landscape , and emerging opportunities within the global Matcha Tea Market ...\nURL: https://www.linkedin.com/pulse/matcha-tea-market-blend-tradition-health-global-demand-bobby-singh-sx4wf\n---\n\nCOMPETITOR SEARCH: Matcha powder competitive landscape tea market\nRESULT 5:\nTitle: Matcha Tea Market Size, Share & Growth Report, 2025\nContent: The global matcha tea market size to be valued at USD 2.26 billion by 2025 and is expected to grow at a CAGR of 4.7% during the forecast period.\nURL: https://www.grandviewresearch.com/industry-analysis/matcha-tea-market\n---\n\nCOMPETITOR SEARCH: Matcha powder competitive landscape tea market\nRESULT 6:\nTitle: The Matcha Movement A Deep Dive into the Green Tea ...\nContent: Oct 18, 2024 — The competitive landscape of the matcha green tea powder market has seen notable mergers and acquisitions as companies seek to expand their ...\nURL: https://www.marketresearchintellect.com/blog/the-matcha-movement-a-deep-dive-into-the-green-tea-powder-market/\n---\n\nCOMPETITOR SEARCH: Matcha powder competitive landscape tea market\nRESULT 7:\nTitle: Matcha Powder Market Size, Share & Demand\nContent: The global matcha powder market is driven by rise in consumer focus toward adopting healthy lifestyle and health benefits associated with matcha powder .\nURL: https://www.alliedmarketresearch.com/matcha-powder-market\n---\n\nCOMPETITOR SEARCH: Matcha powder competitive landscape tea market\nRESULT 8:\nTitle: Matcha Market Size, Share & Growth Trends 2025-2032\nContent: Jun 6, 2025 — Matcha Market was valued at USD 4.67 Bn. in 2024 and is expected to reach USD 7.46 Bn. by 2032, at a CAGR of 6.03%.\nURL: https://www.stellarmr.com/report/matcha-market/2688\n---\n\nCOMPETITOR SEARCH: Matcha powder competitive landscape tea market\nRESULT 9:\nTitle: Matcha Tea Powder Market Size, Share, Trends & Forecast ...\nContent: The global matcha tea powder market was valued at US$ 11.0 Bn in 2022; It is estimated to grow at a CAGR of 7.9% from 2023 to 2031 and reach US$ 21.6 Bn by ...\nURL: https://www.transparencymarketresearch.com/matcha-tea-powder-market.html\n---\n\nCOMPETITOR SEARCH: Matcha powder competitive landscape tea market\nRESULT 10:\nTitle: Global Matcha Tea Market - 2022-2029\nContent: Matcha Tea Market was valued at USD YY million in 2021 . It is forecasted to reach USD YY million by 2029, growing at a CAGR of 7.34% during the forecast period ...\nURL: https://www.marketresearch.com/DataM-Intelligence-4Market-Research-LLP-v4207/Global-Matcha-Tea-32394348/\n---\n"
}