{
  "metadata": {
    "search_type": "competitor_search",
    "original_query": "Adidas Stan Smith competitors market positioning sneakers competitive landscape",
    "timestamp": "2025-08-29T10:48:07.066495",
    "pwd": "/Users/orchidee/Documents/AI-market-agent/src",
    "saved_to": "/Users/orchidee/Documents/AI-market-agent/data/competitor_search_20250829_104807.json"
  },
  "search_results": {
    "queries": [
      {
        "search_query": "Adidas Stan Smith competitors market positioning sneakers competitive landscape vs competitors comparison",
        "results_count": 10,
        "results": [
          {
            "title": "Sneakers - Wikipedia",
            "content": "Adidas Stan Smith of the 1980s. Sneaker sales rose so high, they began to adversely affect the sales of conventional leather shoes, leading to a fierce advertising war for market share in the late '50s. In the 1970s, jogging for exercise became increasingly popular, and trainers...",
            "url": "https://en.wikipedia.org/wiki/Sneakers"
          },
          {
            "title": "Stan Smith Shoes | adidas US",
            "content": "The Stan Smith shoes from adidas Originals are an icon for a reason. The streamlined look and no-frills design add a simple and luxurious touch to every outfit.",
            "url": "https://www.adidas.com/us/stan_smith"
          },
          {
            "title": "15 Best White Sneakers for Men 2025, According to GQ Editors | GQ",
            "content": "Best White Sneaker for Adidas Stans : Adidas Samba OG Sneaker .Puma's long held an underdog position in the ongoing sneaker wars. That's fine with us, because that just means its classic styles are really sleeper hits.",
            "url": "https://www.gq.com/story/best-white-sneakers"
          },
          {
            "title": "History - adidas Group",
            "content": "A partnership with Stan Smith , seen here during his 1972 Wimbledon victory, signaled the start of a 50+ year relationship between adidas and the tennis icon.",
            "url": "https://www.adidas-group.com/en/about/history"
          },
          {
            "title": "adidas Stan Smith 2 - Mammoth Pack - SneakerNews.com",
            "content": "The adidas Stan Smith 2 is a classic, but ancient? The Mammoth Pack of Smiths doesn’t have tusks, but they have been dug up, covered in a fuzzy textile upper. There are three pairs here: black with yellow and white accents, red with black and white and blue with white and red.",
            "url": "https://sneakernews.com/2009/10/21/adidas-stan-smith-2-mammoth-pack/"
          },
          {
            "title": "Amazon.com | adidas Stan Smith (End Plastic Waste) Sneaker ...",
            "content": "Buy it with. This item: adidas Stan Smith (End Plastic Waste) Sneaker , White/White/Core Green, 4 US Unisex Big Kid. $35.56$35.56.",
            "url": "https://www.amazon.com/adidas-Originals-Smith-Sneaker-White/dp/B087DV36MT"
          },
          {
            "title": "adidas Jeremy Scott Sneakers for Men for Sale | Authenticity... | eBay",
            "content": "Get the best deals on adidas Jeremy Scott Sneakers for Men when you shop the largest online selection at eBay.com.",
            "url": "https://www.ebay.com/b/adidas-Jeremy-Scott-Sneakers-for-Men/15709/bn_57962"
          },
          {
            "title": "Dime Turns it Up to 8 on New Vans Era Stub Silhouette",
            "content": "They’ve dropped colorways with Reebok, New Balance, adidas , Asics, and even Merrell, but the brand’s partnership with Vans is more like family, including over a dozen collab colorways over the years and a presenting sponsorship of the annual Dime Glory Challenge, an invite-only...",
            "url": "https://www.soleretriever.com/news/articles/dime-x-vans-era-stub-release-date-august-2025"
          },
          {
            "title": "Loklok vs iQIYI: Which Streaming Platform Should... - LOKLOK MODS",
            "content": "The streaming landscape presents two distinct platforms competing for viewer attention, each offering unique advantages and limitations.Fan communities regularly share complaints about subtitle problems, positioning this as a major weakness compared to competitors .",
            "url": "https://loklokmods.com/loklok-vs-iqiyi/"
          },
          {
            "title": "Is Sneaker Botting Still Worth It in 2025? - Web Scraping Site - WSS",
            "content": "Content NavigatorThe Sneaker Resale Market : A High-Stakes GameThe Bot Landscape : An Arms Race with No End in Sight",
            "url": "https://webscrapingsite.com/proxy/is-sneaker-botting-still-worth-it-in-2024-an-experts-analysis/"
          }
        ]
      },
      {
        "search_query": "Adidas Stan Smith competitors market positioning sneakers competitive landscape market share analysis 2025",
        "results_count": 10,
        "results": [
          {
            "title": "15 Best White Sneakers for Men 2025 , According to GQ Editors | GQ",
            "content": "We've tested countless versions of the best white sneakers for men over the years, and our favorites include pairs from brands like Adidas , Nike, and more.The Best White Sneaker for Adidas Stans : Adidas Samba LT Shoes, $120.",
            "url": "https://www.gq.com/story/best-white-sneakers"
          },
          {
            "title": "Stan Smith Shoes | adidas US",
            "content": "Shop Stan Smith shoes at adidas . Iconic style meets comfort in these classic sneakers , perfect for casual wear and your most fashion-forward outfits.",
            "url": "https://www.adidas.com/us/stan_smith"
          },
          {
            "title": "Foot Locker's Sneaker Market Position | Free Essay Example for...",
            "content": "1.2. Importance of Market Position Analysis 3.1. Market Share Analysis Market share in the sneaker industry depends on the category.",
            "url": "https://aithor.com/essay-examples/foot-lockers-sneaker-market-position"
          },
          {
            "title": "White adidas Stan Smith \"Kermit The Frog\" | SVD",
            "content": "$245.00. Sneakers adidas Stan Smith x CLOT by Edison Chen Core White JR0022.",
            "url": "https://www.sivasdescalzo.com/en/p/stan-smith-fy5460"
          },
          {
            "title": "Avatar World 2025 Updates: A New Era of Customization, Exploration...",
            "content": "Competitive Landscape . Avatar World is not alone in the simulation and sandbox market . Games like Roblox, The Sims, and Toca Life World continue to dominate the space. However, Avatar World differentiates itself by focusing heavily on accessibility, inclusivity, and a balanced mix of...",
            "url": "https://hexajoystick.com/blog/news/avatar-world-2025-updates-a-new-era-of-customization-exploration-and-creativity"
          },
          {
            "title": "TikTok SWOT Analysis ( 2025 ) | Business Strategy Hub",
            "content": "Founded in 2016, TikTok boasts a user-friendly interface, loyal user base, and global market presence. It faces competition ,content moderation challenges.",
            "url": "https://bstrategyhub.com/tiktok-swot-analysis/"
          },
          {
            "title": "Is VeChain (VET) a Buy for 2025 –2031? A Deep Dive into...",
            "content": "- Market share growth, $192.93B 2030 industry forecast, and deflationary VTHO burns position VET as a strategic buy for 2025 –2031 with $0.50 price potential.",
            "url": "https://www.ainvest.com/news/vechain-vet-buy-2025-2031-deep-dive-blockchain-supply-chain-revolution-2508/"
          },
          {
            "title": "Rise | AI Talent Salary Report 2025",
            "content": "The AI talent market of 2025 rewards speed, global thinking, and flexibility. While salaries continue climbing, smart organizations build world-class AI teams by embracing new models of work and payment. At Rise, we enable this transformation.",
            "url": "https://www.riseworks.io/blog/ai-talent-salary-report-2025"
          },
          {
            "title": "Germany Surface Profilometers Market Size 2026 | Market Intelligence...",
            "content": "Competitive Landscape : The market features a mix of established global players like Bruker, Cyber Technologies, and Veeco Instruments, alongside innovative local startups.Top Regional Trends in Germany’s Surface Profilometers Market : Geographic Analysis Report.",
            "url": "https://www.linkedin.com/pulse/germany-surface-profilometers-market-size-2026-intelligence-p0dye"
          },
          {
            "title": "Japan’s top 300 brands grow 6% in 2025 , led by Toyota | Brand Finance",
            "content": "TOKYO, 28 August 2025 – Toyota maintains its iron grip as Japan’s most valuable brand for a decade, as the nation’s top 300 brands experienced a 6% year-on-year growth to JPY108.0 trillion in 2025 , according to the latest Japan 300 2025 report by Brand Finance...",
            "url": "https://brandfinance.com/press-releases/japans-top-300-brands-grow-6-in-2025-led-by-toyota"
          }
        ]
      },
      {
        "search_query": "Adidas Stan Smith competitors market positioning sneakers competitive landscape competitive landscape sneaker market",
        "results_count": 10,
        "results": [
          {
            "title": "Start.io Adidas Target Market Analysis & Consumer Demographics | Start.io",
            "content": "May 14, 2025 - Nike is Adidas biggest competitor , with significantly higher brand value and net revenue compared to Adidas. Nevertheless, Adidas holds strong in its position as the second-largest sportswear brand in the world, with triple the market share compared to the next closest competitor, VF Corporation.",
            "url": "https://www.start.io/blog/adidas-target-market-segmentation-and-marketing-strategy-audience-demographics-competitors/"
          },
          {
            "title": "Business Model Analyst Adidas vs Nike: Business Model Comparison, Revenue, and Strategy Analysis",
            "content": "September 25, 2024 - Nike is typically considered more popular than Adidas when it comes to basketball enthusiasts with its Air Jordan line and signature athlete sneakers. Conversely, Adidas is famous for its classic designs like the Superstar and Stan Smith, as well as its performance-focused Ultraboost line .",
            "url": "https://businessmodelanalyst.com/adidas-vs-nike/"
          },
          {
            "title": "StartupTalky Adidas Marketing Strategy | Marketing Campaigns | Pricing Strategy | USP",
            "content": "March 19, 2025 - The most distinctive strategy that Adidas opts for is user & user-user-benefits-based positioning , forming Adidas' unique selling point. Through this, it builds a strong and distinct image of its products among consumers' minds. Adidas's unique selling point is developing lightweight and ...",
            "url": "https://startuptalky.com/adidas-marketing-strategy/"
          },
          {
            "title": "Growth Navigate 6 Top Adidas Competitors 2024 (Alternatives)",
            "content": "March 18, 2024 - Despite its strong market presence, Adidas faces substantial competition from other key players like Nike, Puma, and Under Armour . This dynamic competitive landscape, combined with Adidas' position as the fifth-largest apparel brand globally with a staggering brand value and significant employee ...",
            "url": "https://www.growthnavigate.com/top-adidas-competitors"
          },
          {
            "title": "EdrawMind Adidas Marketing Mix (4Ps) Analysis | EdrawMind",
            "content": "The competitive pricing comes into play with its regular products, taking into account the prices of rival companies like Nike and Puma . The skimming pricing strategy is used whenever Adidas launches a cutting-edge product that is more advanced than what competitors offer.",
            "url": "https://www.edrawmind.com/article/adidas-marketing-mix-analysis.html"
          },
          {
            "title": "ResearchGate (PDF) Analysis of the Marketing Strategy of Adidas",
            "content": "September 13, 2023 - polyester and worked with partners to develop vegetable leathers , such as the Adidas Stan Smith, which is a vegan version [8]. All of these contribute to improving the reputation of the Adidas brand, winning the hearts and minds of consumers and increasing the competitiveness of the brand.",
            "url": "https://www.researchgate.net/publication/373896269_Analysis_of_the_Marketing_Strategy_of_Adidas"
          },
          {
            "title": "Marketing Dive Sneaker supremacy: Nike and Adidas battle for brand love | Marketing Dive",
            "content": "May 10, 2022 - Duking it out over six decades, the athletic wear companies influenced sports marketing and culture like few others. Who dominates in the stretch ahead may hinge on innovation and acting on pledges.",
            "url": "https://www.marketingdive.com/news/sneaker-supremacy-nike-adidas-brand-rivalry/621712/"
          },
          {
            "title": "Datahut Blog Adidas vs Nike: Competitive Analysis with Data Visualizations",
            "content": "July 19, 2024 - Thus, market share acts as a critical ... industry, each holding substantial market shares. As of July 2024, Nike boasts a market capitalization of $115.96 billion USD, while Adidas stands at $42.06 billion USD ....",
            "url": "https://www.blog.datahut.co/post/adidas-vs-nike-competitive-analysis-with-data-visualizations"
          },
          {
            "title": "Just Style Adidas poised to thrive in highly competitive landscape - Just Style",
            "content": "November 9, 2017 - Adidas has taken aggressive steps to improve its position in the US sportswear market . Its efforts paid off somewhat in FY 2016, with currency-neutral sales of its core Adidas and Reebok brands up 24% in the region. ... The gold standard of business intelligence.",
            "url": "https://www.just-style.com/comment/adidas-poised-to-thrive-in-highly-competitive-landscape/"
          },
          {
            "title": "Edrawsoft Adidas Segmentation, Targeting, and Positioning | EdrawMind",
            "content": "Let's see Adidas segmentation, targeting, and positioning and find out how Adidas is still at the top of its game even with much market competition .",
            "url": "https://www.edrawmind.com/article/adidas-segmentation-targeting-and-positioning.html"
          }
        ]
      }
    ],
    "total_results": 30
  },
  "formatted_output": "COMPETITOR SEARCH: Adidas Stan Smith competitors market positioning sneakers competitive landscape vs competitors comparison\nRESULT 1:\nTitle: Sneakers - Wikipedia\nContent: Adidas Stan Smith of the 1980s. Sneaker sales rose so high, they began to adversely affect the sales of conventional leather shoes, leading to a fierce advertising war for market share in the late '50s. In the 1970s, jogging for exercise became increasingly popular, and trainers...\nURL: https://en.wikipedia.org/wiki/Sneakers\n---\n\nCOMPETITOR SEARCH: Adidas Stan Smith competitors market positioning sneakers competitive landscape vs competitors comparison\nRESULT 2:\nTitle: Stan Smith Shoes | adidas US\nContent: The Stan Smith shoes from adidas Originals are an icon for a reason. The streamlined look and no-frills design add a simple and luxurious touch to every outfit.\nURL: https://www.adidas.com/us/stan_smith\n---\n\nCOMPETITOR SEARCH: Adidas Stan Smith competitors market positioning sneakers competitive landscape vs competitors comparison\nRESULT 3:\nTitle: 15 Best White Sneakers for Men 2025, According to GQ Editors | GQ\nContent: Best White Sneaker for Adidas Stans : Adidas Samba OG Sneaker .Puma's long held an underdog position in the ongoing sneaker wars. That's fine with us, because that just means its classic styles are really sleeper hits.\nURL: https://www.gq.com/story/best-white-sneakers\n---\n\nCOMPETITOR SEARCH: Adidas Stan Smith competitors market positioning sneakers competitive landscape vs competitors comparison\nRESULT 4:\nTitle: History - adidas Group\nContent: A partnership with Stan Smith , seen here during his 1972 Wimbledon victory, signaled the start of a 50+ year relationship between adidas and the tennis icon.\nURL: https://www.adidas-group.com/en/about/history\n---\n\nCOMPETITOR SEARCH: Adidas Stan Smith competitors market positioning sneakers competitive landscape vs competitors comparison\nRESULT 5:\nTitle: adidas Stan Smith 2 - Mammoth Pack - SneakerNews.com\nContent: The adidas Stan Smith 2 is a classic, but ancient? The Mammoth Pack of Smiths doesn’t have tusks, but they have been dug up, covered in a fuzzy textile upper. There are three pairs here: black with yellow and white accents, red with black and white and blue with white and red.\nURL: https://sneakernews.com/2009/10/21/adidas-stan-smith-2-mammoth-pack/\n---\n\nCOMPETITOR SEARCH: Adidas Stan Smith competitors market positioning sneakers competitive landscape vs competitors comparison\nRESULT 6:\nTitle: Amazon.com | adidas Stan Smith (End Plastic Waste) Sneaker ...\nContent: Buy it with. This item: adidas Stan Smith (End Plastic Waste) Sneaker , White/White/Core Green, 4 US Unisex Big Kid. $35.56$35.56.\nURL: https://www.amazon.com/adidas-Originals-Smith-Sneaker-White/dp/B087DV36MT\n---\n\nCOMPETITOR SEARCH: Adidas Stan Smith competitors market positioning sneakers competitive landscape vs competitors comparison\nRESULT 7:\nTitle: adidas Jeremy Scott Sneakers for Men for Sale | Authenticity... | eBay\nContent: Get the best deals on adidas Jeremy Scott Sneakers for Men when you shop the largest online selection at eBay.com.\nURL: https://www.ebay.com/b/adidas-Jeremy-Scott-Sneakers-for-Men/15709/bn_57962\n---\n\nCOMPETITOR SEARCH: Adidas Stan Smith competitors market positioning sneakers competitive landscape vs competitors comparison\nRESULT 8:\nTitle: Dime Turns it Up to 8 on New Vans Era Stub Silhouette\nContent: They’ve dropped colorways with Reebok, New Balance, adidas , Asics, and even Merrell, but the brand’s partnership with Vans is more like family, including over a dozen collab colorways over the years and a presenting sponsorship of the annual Dime Glory Challenge, an invite-only...\nURL: https://www.soleretriever.com/news/articles/dime-x-vans-era-stub-release-date-august-2025\n---\n\nCOMPETITOR SEARCH: Adidas Stan Smith competitors market positioning sneakers competitive landscape vs competitors comparison\nRESULT 9:\nTitle: Loklok vs iQIYI: Which Streaming Platform Should... - LOKLOK MODS\nContent: The streaming landscape presents two distinct platforms competing for viewer attention, each offering unique advantages and limitations.Fan communities regularly share complaints about subtitle problems, positioning this as a major weakness compared to competitors .\nURL: https://loklokmods.com/loklok-vs-iqiyi/\n---\n\nCOMPETITOR SEARCH: Adidas Stan Smith competitors market positioning sneakers competitive landscape vs competitors comparison\nRESULT 10:\nTitle: Is Sneaker Botting Still Worth It in 2025? - Web Scraping Site - WSS\nContent: Content NavigatorThe Sneaker Resale Market : A High-Stakes GameThe Bot Landscape : An Arms Race with No End in Sight\nURL: https://webscrapingsite.com/proxy/is-sneaker-botting-still-worth-it-in-2024-an-experts-analysis/\n---\n\nCOMPETITOR SEARCH: Adidas Stan Smith competitors market positioning sneakers competitive landscape market share analysis 2025\nRESULT 1:\nTitle: 15 Best White Sneakers for Men 2025 , According to GQ Editors | GQ\nContent: We've tested countless versions of the best white sneakers for men over the years, and our favorites include pairs from brands like Adidas , Nike, and more.The Best White Sneaker for Adidas Stans : Adidas Samba LT Shoes, $120.\nURL: https://www.gq.com/story/best-white-sneakers\n---\n\nCOMPETITOR SEARCH: Adidas Stan Smith competitors market positioning sneakers competitive landscape market share analysis 2025\nRESULT 2:\nTitle: Stan Smith Shoes | adidas US\nContent: Shop Stan Smith shoes at adidas . Iconic style meets comfort in these classic sneakers , perfect for casual wear and your most fashion-forward outfits.\nURL: https://www.adidas.com/us/stan_smith\n---\n\nCOMPETITOR SEARCH: Adidas Stan Smith competitors market positioning sneakers competitive landscape market share analysis 2025\nRESULT 3:\nTitle: Foot Locker's Sneaker Market Position | Free Essay Example for...\nContent: 1.2. Importance of Market Position Analysis 3.1. Market Share Analysis Market share in the sneaker industry depends on the category.\nURL: https://aithor.com/essay-examples/foot-lockers-sneaker-market-position\n---\n\nCOMPETITOR SEARCH: Adidas Stan Smith competitors market positioning sneakers competitive landscape market share analysis 2025\nRESULT 4:\nTitle: White adidas Stan Smith \"Kermit The Frog\" | SVD\nContent: $245.00. Sneakers adidas Stan Smith x CLOT by Edison Chen Core White JR0022.\nURL: https://www.sivasdescalzo.com/en/p/stan-smith-fy5460\n---\n\nCOMPETITOR SEARCH: Adidas Stan Smith competitors market positioning sneakers competitive landscape market share analysis 2025\nRESULT 5:\nTitle: Avatar World 2025 Updates: A New Era of Customization, Exploration...\nContent: Competitive Landscape . Avatar World is not alone in the simulation and sandbox market . Games like Roblox, The Sims, and Toca Life World continue to dominate the space. However, Avatar World differentiates itself by focusing heavily on accessibility, inclusivity, and a balanced mix of...\nURL: https://hexajoystick.com/blog/news/avatar-world-2025-updates-a-new-era-of-customization-exploration-and-creativity\n---\n\nCOMPETITOR SEARCH: Adidas Stan Smith competitors market positioning sneakers competitive landscape market share analysis 2025\nRESULT 6:\nTitle: TikTok SWOT Analysis ( 2025 ) | Business Strategy Hub\nContent: Founded in 2016, TikTok boasts a user-friendly interface, loyal user base, and global market presence. It faces competition ,content moderation challenges.\nURL: https://bstrategyhub.com/tiktok-swot-analysis/\n---\n\nCOMPETITOR SEARCH: Adidas Stan Smith competitors market positioning sneakers competitive landscape market share analysis 2025\nRESULT 7:\nTitle: Is VeChain (VET) a Buy for 2025 –2031? A Deep Dive into...\nContent: - Market share growth, $192.93B 2030 industry forecast, and deflationary VTHO burns position VET as a strategic buy for 2025 –2031 with $0.50 price potential.\nURL: https://www.ainvest.com/news/vechain-vet-buy-2025-2031-deep-dive-blockchain-supply-chain-revolution-2508/\n---\n\nCOMPETITOR SEARCH: Adidas Stan Smith competitors market positioning sneakers competitive landscape market share analysis 2025\nRESULT 8:\nTitle: Rise | AI Talent Salary Report 2025\nContent: The AI talent market of 2025 rewards speed, global thinking, and flexibility. While salaries continue climbing, smart organizations build world-class AI teams by embracing new models of work and payment. At Rise, we enable this transformation.\nURL: https://www.riseworks.io/blog/ai-talent-salary-report-2025\n---\n\nCOMPETITOR SEARCH: Adidas Stan Smith competitors market positioning sneakers competitive landscape market share analysis 2025\nRESULT 9:\nTitle: Germany Surface Profilometers Market Size 2026 | Market Intelligence...\nContent: Competitive Landscape : The market features a mix of established global players like Bruker, Cyber Technologies, and Veeco Instruments, alongside innovative local startups.Top Regional Trends in Germany’s Surface Profilometers Market : Geographic Analysis Report.\nURL: https://www.linkedin.com/pulse/germany-surface-profilometers-market-size-2026-intelligence-p0dye\n---\n\nCOMPETITOR SEARCH: Adidas Stan Smith competitors market positioning sneakers competitive landscape market share analysis 2025\nRESULT 10:\nTitle: Japan’s top 300 brands grow 6% in 2025 , led by Toyota | Brand Finance\nContent: TOKYO, 28 August 2025 – Toyota maintains its iron grip as Japan’s most valuable brand for a decade, as the nation’s top 300 brands experienced a 6% year-on-year growth to JPY108.0 trillion in 2025 , according to the latest Japan 300 2025 report by Brand Finance...\nURL: https://brandfinance.com/press-releases/japans-top-300-brands-grow-6-in-2025-led-by-toyota\n---\n\nCOMPETITOR SEARCH: Adidas Stan Smith competitors market positioning sneakers competitive landscape competitive landscape sneaker market\nRESULT 1:\nTitle: Start.io Adidas Target Market Analysis & Consumer Demographics | Start.io\nContent: May 14, 2025 - Nike is Adidas biggest competitor , with significantly higher brand value and net revenue compared to Adidas. Nevertheless, Adidas holds strong in its position as the second-largest sportswear brand in the world, with triple the market share compared to the next closest competitor, VF Corporation.\nURL: https://www.start.io/blog/adidas-target-market-segmentation-and-marketing-strategy-audience-demographics-competitors/\n---\n\nCOMPETITOR SEARCH: Adidas Stan Smith competitors market positioning sneakers competitive landscape competitive landscape sneaker market\nRESULT 2:\nTitle: Business Model Analyst Adidas vs Nike: Business Model Comparison, Revenue, and Strategy Analysis\nContent: September 25, 2024 - Nike is typically considered more popular than Adidas when it comes to basketball enthusiasts with its Air Jordan line and signature athlete sneakers. Conversely, Adidas is famous for its classic designs like the Superstar and Stan Smith, as well as its performance-focused Ultraboost line .\nURL: https://businessmodelanalyst.com/adidas-vs-nike/\n---\n\nCOMPETITOR SEARCH: Adidas Stan Smith competitors market positioning sneakers competitive landscape competitive landscape sneaker market\nRESULT 3:\nTitle: StartupTalky Adidas Marketing Strategy | Marketing Campaigns | Pricing Strategy | USP\nContent: March 19, 2025 - The most distinctive strategy that Adidas opts for is user & user-user-benefits-based positioning , forming Adidas' unique selling point. Through this, it builds a strong and distinct image of its products among consumers' minds. Adidas's unique selling point is developing lightweight and ...\nURL: https://startuptalky.com/adidas-marketing-strategy/\n---\n\nCOMPETITOR SEARCH: Adidas Stan Smith competitors market positioning sneakers competitive landscape competitive landscape sneaker market\nRESULT 4:\nTitle: Growth Navigate 6 Top Adidas Competitors 2024 (Alternatives)\nContent: March 18, 2024 - Despite its strong market presence, Adidas faces substantial competition from other key players like Nike, Puma, and Under Armour . This dynamic competitive landscape, combined with Adidas' position as the fifth-largest apparel brand globally with a staggering brand value and significant employee ...\nURL: https://www.growthnavigate.com/top-adidas-competitors\n---\n\nCOMPETITOR SEARCH: Adidas Stan Smith competitors market positioning sneakers competitive landscape competitive landscape sneaker market\nRESULT 5:\nTitle: EdrawMind Adidas Marketing Mix (4Ps) Analysis | EdrawMind\nContent: The competitive pricing comes into play with its regular products, taking into account the prices of rival companies like Nike and Puma . The skimming pricing strategy is used whenever Adidas launches a cutting-edge product that is more advanced than what competitors offer.\nURL: https://www.edrawmind.com/article/adidas-marketing-mix-analysis.html\n---\n\nCOMPETITOR SEARCH: Adidas Stan Smith competitors market positioning sneakers competitive landscape competitive landscape sneaker market\nRESULT 6:\nTitle: ResearchGate (PDF) Analysis of the Marketing Strategy of Adidas\nContent: September 13, 2023 - polyester and worked with partners to develop vegetable leathers , such as the Adidas Stan Smith, which is a vegan version [8]. All of these contribute to improving the reputation of the Adidas brand, winning the hearts and minds of consumers and increasing the competitiveness of the brand.\nURL: https://www.researchgate.net/publication/373896269_Analysis_of_the_Marketing_Strategy_of_Adidas\n---\n\nCOMPETITOR SEARCH: Adidas Stan Smith competitors market positioning sneakers competitive landscape competitive landscape sneaker market\nRESULT 7:\nTitle: Marketing Dive Sneaker supremacy: Nike and Adidas battle for brand love | Marketing Dive\nContent: May 10, 2022 - Duking it out over six decades, the athletic wear companies influenced sports marketing and culture like few others. Who dominates in the stretch ahead may hinge on innovation and acting on pledges.\nURL: https://www.marketingdive.com/news/sneaker-supremacy-nike-adidas-brand-rivalry/621712/\n---\n\nCOMPETITOR SEARCH: Adidas Stan Smith competitors market positioning sneakers competitive landscape competitive landscape sneaker market\nRESULT 8:\nTitle: Datahut Blog Adidas vs Nike: Competitive Analysis with Data Visualizations\nContent: July 19, 2024 - Thus, market share acts as a critical ... industry, each holding substantial market shares. As of July 2024, Nike boasts a market capitalization of $115.96 billion USD, while Adidas stands at $42.06 billion USD ....\nURL: https://www.blog.datahut.co/post/adidas-vs-nike-competitive-analysis-with-data-visualizations\n---\n\nCOMPETITOR SEARCH: Adidas Stan Smith competitors market positioning sneakers competitive landscape competitive landscape sneaker market\nRESULT 9:\nTitle: Just Style Adidas poised to thrive in highly competitive landscape - Just Style\nContent: November 9, 2017 - Adidas has taken aggressive steps to improve its position in the US sportswear market . Its efforts paid off somewhat in FY 2016, with currency-neutral sales of its core Adidas and Reebok brands up 24% in the region. ... The gold standard of business intelligence.\nURL: https://www.just-style.com/comment/adidas-poised-to-thrive-in-highly-competitive-landscape/\n---\n\nCOMPETITOR SEARCH: Adidas Stan Smith competitors market positioning sneakers competitive landscape competitive landscape sneaker market\nRESULT 10:\nTitle: Edrawsoft Adidas Segmentation, Targeting, and Positioning | EdrawMind\nContent: Let's see Adidas segmentation, targeting, and positioning and find out how Adidas is still at the top of its game even with much market competition .\nURL: https://www.edrawmind.com/article/adidas-segmentation-targeting-and-positioning.html\n---\n"
}