{
  "metadata": {
    "search_type": "product_search",
    "original_query": "Adidas Stan Smith current price retail availability popularity",
    "timestamp": "2025-08-29T08:47:04.879882",
    "pwd": "/Users/orchidee/Documents/AI-market-agent/src",
    "saved_to": "/Users/orchidee/Documents/AI-market-agent/data/product_search_20250829_084704.json"
  },
  "search_results": {
    "queries": [
      {
        "search_query": "Adidas Stan Smith current price retail availability popularity price retail cost MSRP",
        "results_count": 10,
        "results": [
          {
            "title": "Stan Smith Shoes | adidas US",
            "content": "Price $100. Stan Smith Shoes. Women's Originals.The iconic Stan Smith shoes from adidas first hit the scene as a performance tennis shoe. Nowadays, these sneakers from adidas Originals are a staple of streetwear fashion.",
            "url": "https://www.adidas.com/us/stan_smith"
          },
          {
            "title": "–ö—Ä–æ—Å—Å–æ–≤–∫–∏ adidas Originals Stan Smith (–û—Ä–∏–≥–∏–Ω–∞–ª—å–Ω—ã–µ –ê–¥–∏–¥–∞—Å –°—Ç–µ–Ω...",
            "content": "–ö–∞—á–µ—Å—Ç–≤–æ –º–∞—Ç–µ—Ä–∏–∞–ª–æ–≤ –∏ –ø—Ä–æ—Å—Ç–æ—Ç–∞ ‚Äì —Ç–æ, —á—Ç–æ –Ω–∏–∫–æ–≥–¥–∞ –Ω–µ –¥–∞–¥—É—Ç –µ–π —É—Å—Ç–∞—Ä–µ—Ç—å. –ó–∞–∫–∞–∂–∏—Ç–µ –æ—Ä–∏–≥–∏–Ω–∞–ª—å–Ω—ã–µ Stan Smith –æ–Ω–ª–∞–π–Ω –∏–ª–∏ –ø—Ä–∏—Ö–æ–¥–∏—Ç–µ –≤ –Ω–∞—à–∏ —Ä–æ–∑–Ω–∏—á–Ω—ã–µ –º–∞–≥–∞–∑–∏–Ω—ã.",
            "url": "https://street-beat.ru/cat/adidas-originals/stan-smith/"
          },
          {
            "title": "adidas Stan Smith | Mens, Womens, Kids | Sneaker10",
            "content": "Discover the adidas Stan Smith iconic collection of shoes in Unbelievable Prices & Unique Offers only at Sneaker10.gr, the No1 online sneaker store!",
            "url": "https://www.sneaker10.gr/en/11714-adidas-stan-smith"
          },
          {
            "title": "Adidas Stan Smith Homer Simpson: D‚Äôoh",
            "content": "Price : $120 [Partly Sold Out; Check eBay for Current Pricing ].Why Avoid: The Adidas Stan Smith Homer Simpson isn‚Äôt the best Stan Smith they make from a quality perspective.",
            "url": "https://100wears.com/adidas-stan-smith-homer-simpson-doh/"
          },
          {
            "title": "ADIDAS ORIGINALS STAN SMITH | White Women‚Äòs Sneakers | YOOX",
            "content": "Adidas originals. Stan smith . Sneakers. Us$ 134. Reference price US$ 185.",
            "url": "https://www.yoox.com/sg/32033529QQ/item"
          },
          {
            "title": "Classic Homer Simpson Meme Inspires New Adidas Sneakers - Nerdist",
            "content": "Adidas Stan Smith Homer Simpson sneaker heel view.These specially designed The Simpsons Stan Smith shoes come at a price of $120.00, this amusing edition to the timeless footwear is now available for purchase via various Adidas retailers and online.",
            "url": "https://nerdist.com/article/homer-simpson-bushes-meme-becomes-new-adidas-sneakers/"
          },
          {
            "title": "Adidas stan smith bold w hotsell",
            "content": "Popular Products. Men's. adidas Stan Smith Recon Shoes White Free Shipping with adiClub adidas US hotsell, ADIDAS Stan Smith Bonega GY9310 Shiekh hotsell, Disney X Adidas Originals STAN SMITH PF Skateboarding Shoes Women s Low top Beige Pink POIZON hotsell...",
            "url": "https://panel.bulutgym.com/?p=14181521"
          },
          {
            "title": "Stan smith running white online",
            "content": "Gifts By Price . adidas Originals Stan Smith Amazon Fashion online, adidas Originals STAN SMITH UNISEX Sneakers low footwear white online, adidas city run fulham schedule live score today online, Stan Smith Running White Fairway online, adidas Stan Smith Shoes White...",
            "url": "https://cugms.ru/?c=21859712"
          },
          {
            "title": "Stan smith adicolor reflective 2025, Adidas Stan smith Vinted 2025",
            "content": "Gifts By Price . Stan smith outlet adicolor. Adidas Superstar Adicolor Reflective Shock Mint Grailed.",
            "url": "https://dshi21omsk.ru/?d=473721921"
          },
          {
            "title": "Buy adidas Deportivo Indoor Soccer Shoes 'Black Green... - Novelship",
            "content": "Superstar. Stan Smith . Gazelle.Requests for size exchanges can only be made within 30 days of the shipping date and are subject to availability . Please contact our customer service team before returning any product. For further information, please refer to our Term and Conditions.",
            "url": "https://novelship.com/adidas-deportivo-indoor-soccer-shoes-black-green-fy-7621"
          }
        ]
      },
      {
        "search_query": "Adidas Stan Smith current price retail availability popularity availability stock inventory",
        "results_count": 10,
        "results": [
          {
            "title": "Sneaker and Activewear | adidas US",
            "content": "Explore adidas sneakers for sports and daily wear. From versatile activewear to sporting goods and accessories for all ages and all levels.",
            "url": "https://www.adidas.com/us?msockid=273e9017cc1263f337ac8640cd006290"
          },
          {
            "title": "adidas | DICK'S Sporting Goods",
            "content": "Shop adidas shoes by sport, with shoes and cleats engineered for everything from football and baseball to basketball, running and golf. adidas shoes are built with a supportive but ‚Ä¶",
            "url": "https://www.dickssportinggoods.com/s/brand-shop/adidas?msockid=273e9017cc1263f337ac8640cd006290"
          },
          {
            "title": "adidas Shoes, Apparel, & Accessories - Foot Locker",
            "content": "Shop the latest selection of adidas at Foot Locker. Find the hottest sneaker drops from brands like Jordan, Nike, Under Armour, New Balance, and a bunch more. Free shipping for FLX members.",
            "url": "https://www.footlocker.com/category/brands/adidas.html"
          },
          {
            "title": "Shop adidas Online - Nordstrom Rack",
            "content": "Find the latest selection of adidas in-store or online at Nordstrom. Shipping is always free and returns are accepted at any location. In-store pickup and alterations services available.",
            "url": "https://www.nordstromrack.com/brands/adidas?msockid=273e9017cc1263f337ac8640cd006290"
          },
          {
            "title": "adidas Online Shop | adidas US",
            "content": "SHOP BY COLLECTION adicolor Premium Collaborations adidas by Stella McCartney Gazelle Originals Samba",
            "url": "https://www.adidas.com/us/welcome?msockid=273e9017cc1263f337ac8640cd006290"
          },
          {
            "title": "adidas | Shoes, Apparel, Bags, & More | Zappos | Zappos.com",
            "content": "This collection features all your favorite classic adidas designs along with their latest trendsetting looks. With a variety of styles for men, women and kids, there‚Äôs something for everyone in our ‚Ä¶",
            "url": "https://www.zappos.com/c/adidas?msockid=273e9017cc1263f337ac8640cd006290"
          },
          {
            "title": "adidas Shoes | Curbside Pickup Available at DICK'S",
            "content": "Shop the complete collection of adidas sneakers, cleats and more at DICK'S Sporting Goods. Browse top-rated adidas shoes for any sport, including adidas Running Shoes, adidas ‚Ä¶",
            "url": "https://www.dickssportinggoods.com/f/adidas-athletic-sneakers?msockid=273e9017cc1263f337ac8640cd006290"
          },
          {
            "title": "Shop Shoes & Clothing Deals | adidas US",
            "content": "Find your adidas Shop at adidas.com. All styles and colors available in the official adidas online store.",
            "url": "https://www.adidas.com/us/shop?msockid=273e9017cc1263f337ac8640cd006290"
          },
          {
            "title": "adidas | Foot Locker",
            "content": "Shop the latest selection of adidas at Foot Locker. Find the hottest sneaker drops from brands like adidas, Jordan, Nike, Under Armour, New Balance, and a bunch more.",
            "url": "https://www.footlocker.com/adidas.html"
          },
          {
            "title": "Twitter . It‚Äôs what‚Äôs happening / Twitter",
            "content": "Official Twitter account of Adidas, sharing updates, promotions, and news about their products and brand.",
            "url": "https://twitter.com/adidas"
          }
        ]
      },
      {
        "search_query": "Adidas Stan Smith current price retail availability popularity popularity trends demand 2025",
        "results_count": 10,
        "results": [
          {
            "title": "Wikipedia Adidas Stan Smith - Wikipedia",
            "content": "2 weeks ago - Adidas Stan Smith is a tennis shoe made by Adidas , and first launched in 1965. Originally named \" Adidas Robert Haillet\" after the brand endorsed French prominent player Robert Haillet, in 1978 the sneakers were renamed after Stan Smith , an American tennis player who was active between the end ...",
            "url": "https://en.wikipedia.org/wiki/Adidas_Stan_Smith"
          },
          {
            "title": "Top 10 Most Iconic Sneakers in the World (2025)",
            "content": "Jun 17, 2025 ‚Äî Adidas Stan Smith Overview ; üè∑Ô∏è Price Range. $85 ‚Äì $110 (standard); $120‚Äì$150 for collabs/special editions ; Popularity . Over 100 million pairs ...",
            "url": "https://atoms.com/articles/top-10-most-iconic-sneakers-in-the-world-2025"
          },
          {
            "title": "Adidas and Puma hit by tariffs, trends, and shifting demand",
            "content": "Jul 31, 2025 ‚Äî Following the Samba and Superstar, the next icon to be refreshed is the Stan Smith, the classic white tennis shoe that debuted over 40 years ...",
            "url": "https://us.fashionnetwork.com/news/Adidas-and-puma-hit-by-tariffs-trends-and-shifting-demand,1754501.html"
          },
          {
            "title": "Top Sneaker Trends for 2025: What to Watch for on StockX",
            "content": "Apr 9, 2025 ‚Äî Discover the top sneaker trends for 2025 , from anticipated releases to resale insights on StockX. Stay ahead in the sneaker game!",
            "url": "https://resalepro.com/stockx/top-sneaker-trends-for-2025/"
          },
          {
            "title": "The Everlasting Appeal of adidas Stan Smith Shoes",
            "content": "Jun 1, 2022 ‚Äî From a classic tennis shoe to popular fashion silhouette, adidas Stan Smith sneakers are an iconically stylish, comfortable and versatile ...",
            "url": "https://wwd.com/shop/shop-fashion/adidas-stan-smith-1235182376/"
          },
          {
            "title": "adidas Warns of US Price Hikes Despite Doubled Growth",
            "content": "Apr 29, 2025 ‚Äî Despite beating forecasts by reporting net income jumping 155% in the first quarter of 2025 , adidas emphasized its worries about the uncertain trade landscape.",
            "url": "https://hypebeast.com/2025/4/adidas-warns-of-us-price-hikes-despite-doubled-growth"
          },
          {
            "title": "The Best adidas Stan Smith Shoes to Buy Now - Yahoo",
            "content": "Sep 13, 2024 ‚Äî This guide for the best adidas Stan Smith shoes in 2024 with up-to-date trend insight and new models available to shop.",
            "url": "https://www.yahoo.com/lifestyle/adidas-stan-smith-became-timeless-173307049.html"
          },
          {
            "title": "adidas presents growth strategy 'Own the Game' until 2025",
            "content": "Mar 10, 2021 ‚Äî The new strategy is designed to significantly increase sales and profitability as well as gain market share until 2025 .",
            "url": "https://www.adidas-group.com/en/media/press-releases/adidas-presents-growth-strategy-own-the-game-until-2025"
          },
          {
            "title": "Sneaker and Activewear | adidas US",
            "content": "Explore adidas sneakers for sports and daily wear . From versatile activewear to sporting goods and accessories for all ages and all levels.",
            "url": "https://www.adidas.com/us"
          },
          {
            "title": "Top 9 Women's Sneakers for Summer 2025 ‚Äì Trends ...",
            "content": "Jul 14, 2025 ‚Äî Discover the 9 hottest women's sneakers for summer 2025 ‚Äì from low-profile and color-pop to gorpcore, retro suede and animal print!",
            "url": "https://warsawsneakerstore.com/en/blog/top-9-women-s-sneakers-for-summer-2025-trends-worn-by-stars.html"
          }
        ]
      }
    ],
    "total_results": 30
  },
  "formatted_output": "SEARCH: Adidas Stan Smith current price retail availability popularity price retail cost MSRP\nRESULT 1:\nTitle: Stan Smith Shoes | adidas US\nContent: Price $100. Stan Smith Shoes. Women's Originals.The iconic Stan Smith shoes from adidas first hit the scene as a performance tennis shoe. Nowadays, these sneakers from adidas Originals are a staple of streetwear fashion.\nURL: https://www.adidas.com/us/stan_smith\n---\n\nSEARCH: Adidas Stan Smith current price retail availability popularity price retail cost MSRP\nRESULT 2:\nTitle: –ö—Ä–æ—Å—Å–æ–≤–∫–∏ adidas Originals Stan Smith (–û—Ä–∏–≥–∏–Ω–∞–ª—å–Ω—ã–µ –ê–¥–∏–¥–∞—Å –°—Ç–µ–Ω...\nContent: –ö–∞—á–µ—Å—Ç–≤–æ –º–∞—Ç–µ—Ä–∏–∞–ª–æ–≤ –∏ –ø—Ä–æ—Å—Ç–æ—Ç–∞ ‚Äì —Ç–æ, —á—Ç–æ –Ω–∏–∫–æ–≥–¥–∞ –Ω–µ –¥–∞–¥—É—Ç –µ–π —É—Å—Ç–∞—Ä–µ—Ç—å. –ó–∞–∫–∞–∂–∏—Ç–µ –æ—Ä–∏–≥–∏–Ω–∞–ª—å–Ω—ã–µ Stan Smith –æ–Ω–ª–∞–π–Ω –∏–ª–∏ –ø—Ä–∏—Ö–æ–¥–∏—Ç–µ –≤ –Ω–∞—à–∏ —Ä–æ–∑–Ω–∏—á–Ω—ã–µ –º–∞–≥–∞–∑–∏–Ω—ã.\nURL: https://street-beat.ru/cat/adidas-originals/stan-smith/\n---\n\nSEARCH: Adidas Stan Smith current price retail availability popularity price retail cost MSRP\nRESULT 3:\nTitle: adidas Stan Smith | Mens, Womens, Kids | Sneaker10\nContent: Discover the adidas Stan Smith iconic collection of shoes in Unbelievable Prices & Unique Offers only at Sneaker10.gr, the No1 online sneaker store!\nURL: https://www.sneaker10.gr/en/11714-adidas-stan-smith\n---\n\nSEARCH: Adidas Stan Smith current price retail availability popularity price retail cost MSRP\nRESULT 4:\nTitle: Adidas Stan Smith Homer Simpson: D‚Äôoh\nContent: Price : $120 [Partly Sold Out; Check eBay for Current Pricing ].Why Avoid: The Adidas Stan Smith Homer Simpson isn‚Äôt the best Stan Smith they make from a quality perspective.\nURL: https://100wears.com/adidas-stan-smith-homer-simpson-doh/\n---\n\nSEARCH: Adidas Stan Smith current price retail availability popularity price retail cost MSRP\nRESULT 5:\nTitle: ADIDAS ORIGINALS STAN SMITH | White Women‚Äòs Sneakers | YOOX\nContent: Adidas originals. Stan smith . Sneakers. Us$ 134. Reference price US$ 185.\nURL: https://www.yoox.com/sg/32033529QQ/item\n---\n\nSEARCH: Adidas Stan Smith current price retail availability popularity price retail cost MSRP\nRESULT 6:\nTitle: Classic Homer Simpson Meme Inspires New Adidas Sneakers - Nerdist\nContent: Adidas Stan Smith Homer Simpson sneaker heel view.These specially designed The Simpsons Stan Smith shoes come at a price of $120.00, this amusing edition to the timeless footwear is now available for purchase via various Adidas retailers and online.\nURL: https://nerdist.com/article/homer-simpson-bushes-meme-becomes-new-adidas-sneakers/\n---\n\nSEARCH: Adidas Stan Smith current price retail availability popularity price retail cost MSRP\nRESULT 7:\nTitle: Adidas stan smith bold w hotsell\nContent: Popular Products. Men's. adidas Stan Smith Recon Shoes White Free Shipping with adiClub adidas US hotsell, ADIDAS Stan Smith Bonega GY9310 Shiekh hotsell, Disney X Adidas Originals STAN SMITH PF Skateboarding Shoes Women s Low top Beige Pink POIZON hotsell...\nURL: https://panel.bulutgym.com/?p=14181521\n---\n\nSEARCH: Adidas Stan Smith current price retail availability popularity price retail cost MSRP\nRESULT 8:\nTitle: Stan smith running white online\nContent: Gifts By Price . adidas Originals Stan Smith Amazon Fashion online, adidas Originals STAN SMITH UNISEX Sneakers low footwear white online, adidas city run fulham schedule live score today online, Stan Smith Running White Fairway online, adidas Stan Smith Shoes White...\nURL: https://cugms.ru/?c=21859712\n---\n\nSEARCH: Adidas Stan Smith current price retail availability popularity price retail cost MSRP\nRESULT 9:\nTitle: Stan smith adicolor reflective 2025, Adidas Stan smith Vinted 2025\nContent: Gifts By Price . Stan smith outlet adicolor. Adidas Superstar Adicolor Reflective Shock Mint Grailed.\nURL: https://dshi21omsk.ru/?d=473721921\n---\n\nSEARCH: Adidas Stan Smith current price retail availability popularity price retail cost MSRP\nRESULT 10:\nTitle: Buy adidas Deportivo Indoor Soccer Shoes 'Black Green... - Novelship\nContent: Superstar. Stan Smith . Gazelle.Requests for size exchanges can only be made within 30 days of the shipping date and are subject to availability . Please contact our customer service team before returning any product. For further information, please refer to our Term and Conditions.\nURL: https://novelship.com/adidas-deportivo-indoor-soccer-shoes-black-green-fy-7621\n---\n\nSEARCH: Adidas Stan Smith current price retail availability popularity availability stock inventory\nRESULT 1:\nTitle: Sneaker and Activewear | adidas US\nContent: Explore adidas sneakers for sports and daily wear. From versatile activewear to sporting goods and accessories for all ages and all levels.\nURL: https://www.adidas.com/us?msockid=273e9017cc1263f337ac8640cd006290\n---\n\nSEARCH: Adidas Stan Smith current price retail availability popularity availability stock inventory\nRESULT 2:\nTitle: adidas | DICK'S Sporting Goods\nContent: Shop adidas shoes by sport, with shoes and cleats engineered for everything from football and baseball to basketball, running and golf. adidas shoes are built with a supportive but ‚Ä¶\nURL: https://www.dickssportinggoods.com/s/brand-shop/adidas?msockid=273e9017cc1263f337ac8640cd006290\n---\n\nSEARCH: Adidas Stan Smith current price retail availability popularity availability stock inventory\nRESULT 3:\nTitle: adidas Shoes, Apparel, & Accessories - Foot Locker\nContent: Shop the latest selection of adidas at Foot Locker. Find the hottest sneaker drops from brands like Jordan, Nike, Under Armour, New Balance, and a bunch more. Free shipping for FLX members.\nURL: https://www.footlocker.com/category/brands/adidas.html\n---\n\nSEARCH: Adidas Stan Smith current price retail availability popularity availability stock inventory\nRESULT 4:\nTitle: Shop adidas Online - Nordstrom Rack\nContent: Find the latest selection of adidas in-store or online at Nordstrom. Shipping is always free and returns are accepted at any location. In-store pickup and alterations services available.\nURL: https://www.nordstromrack.com/brands/adidas?msockid=273e9017cc1263f337ac8640cd006290\n---\n\nSEARCH: Adidas Stan Smith current price retail availability popularity availability stock inventory\nRESULT 5:\nTitle: adidas Online Shop | adidas US\nContent: SHOP BY COLLECTION adicolor Premium Collaborations adidas by Stella McCartney Gazelle Originals Samba\nURL: https://www.adidas.com/us/welcome?msockid=273e9017cc1263f337ac8640cd006290\n---\n\nSEARCH: Adidas Stan Smith current price retail availability popularity availability stock inventory\nRESULT 6:\nTitle: adidas | Shoes, Apparel, Bags, & More | Zappos | Zappos.com\nContent: This collection features all your favorite classic adidas designs along with their latest trendsetting looks. With a variety of styles for men, women and kids, there‚Äôs something for everyone in our ‚Ä¶\nURL: https://www.zappos.com/c/adidas?msockid=273e9017cc1263f337ac8640cd006290\n---\n\nSEARCH: Adidas Stan Smith current price retail availability popularity availability stock inventory\nRESULT 7:\nTitle: adidas Shoes | Curbside Pickup Available at DICK'S\nContent: Shop the complete collection of adidas sneakers, cleats and more at DICK'S Sporting Goods. Browse top-rated adidas shoes for any sport, including adidas Running Shoes, adidas ‚Ä¶\nURL: https://www.dickssportinggoods.com/f/adidas-athletic-sneakers?msockid=273e9017cc1263f337ac8640cd006290\n---\n\nSEARCH: Adidas Stan Smith current price retail availability popularity availability stock inventory\nRESULT 8:\nTitle: Shop Shoes & Clothing Deals | adidas US\nContent: Find your adidas Shop at adidas.com. All styles and colors available in the official adidas online store.\nURL: https://www.adidas.com/us/shop?msockid=273e9017cc1263f337ac8640cd006290\n---\n\nSEARCH: Adidas Stan Smith current price retail availability popularity availability stock inventory\nRESULT 9:\nTitle: adidas | Foot Locker\nContent: Shop the latest selection of adidas at Foot Locker. Find the hottest sneaker drops from brands like adidas, Jordan, Nike, Under Armour, New Balance, and a bunch more.\nURL: https://www.footlocker.com/adidas.html\n---\n\nSEARCH: Adidas Stan Smith current price retail availability popularity availability stock inventory\nRESULT 10:\nTitle: Twitter . It‚Äôs what‚Äôs happening / Twitter\nContent: Official Twitter account of Adidas, sharing updates, promotions, and news about their products and brand.\nURL: https://twitter.com/adidas\n---\n\nSEARCH: Adidas Stan Smith current price retail availability popularity popularity trends demand 2025\nRESULT 1:\nTitle: Wikipedia Adidas Stan Smith - Wikipedia\nContent: 2 weeks ago - Adidas Stan Smith is a tennis shoe made by Adidas , and first launched in 1965. Originally named \" Adidas Robert Haillet\" after the brand endorsed French prominent player Robert Haillet, in 1978 the sneakers were renamed after Stan Smith , an American tennis player who was active between the end ...\nURL: https://en.wikipedia.org/wiki/Adidas_Stan_Smith\n---\n\nSEARCH: Adidas Stan Smith current price retail availability popularity popularity trends demand 2025\nRESULT 2:\nTitle: Top 10 Most Iconic Sneakers in the World (2025)\nContent: Jun 17, 2025 ‚Äî Adidas Stan Smith Overview ; üè∑Ô∏è Price Range. $85 ‚Äì $110 (standard); $120‚Äì$150 for collabs/special editions ; Popularity . Over 100 million pairs ...\nURL: https://atoms.com/articles/top-10-most-iconic-sneakers-in-the-world-2025\n---\n\nSEARCH: Adidas Stan Smith current price retail availability popularity popularity trends demand 2025\nRESULT 3:\nTitle: Adidas and Puma hit by tariffs, trends, and shifting demand\nContent: Jul 31, 2025 ‚Äî Following the Samba and Superstar, the next icon to be refreshed is the Stan Smith, the classic white tennis shoe that debuted over 40 years ...\nURL: https://us.fashionnetwork.com/news/Adidas-and-puma-hit-by-tariffs-trends-and-shifting-demand,1754501.html\n---\n\nSEARCH: Adidas Stan Smith current price retail availability popularity popularity trends demand 2025\nRESULT 4:\nTitle: Top Sneaker Trends for 2025: What to Watch for on StockX\nContent: Apr 9, 2025 ‚Äî Discover the top sneaker trends for 2025 , from anticipated releases to resale insights on StockX. Stay ahead in the sneaker game!\nURL: https://resalepro.com/stockx/top-sneaker-trends-for-2025/\n---\n\nSEARCH: Adidas Stan Smith current price retail availability popularity popularity trends demand 2025\nRESULT 5:\nTitle: The Everlasting Appeal of adidas Stan Smith Shoes\nContent: Jun 1, 2022 ‚Äî From a classic tennis shoe to popular fashion silhouette, adidas Stan Smith sneakers are an iconically stylish, comfortable and versatile ...\nURL: https://wwd.com/shop/shop-fashion/adidas-stan-smith-1235182376/\n---\n\nSEARCH: Adidas Stan Smith current price retail availability popularity popularity trends demand 2025\nRESULT 6:\nTitle: adidas Warns of US Price Hikes Despite Doubled Growth\nContent: Apr 29, 2025 ‚Äî Despite beating forecasts by reporting net income jumping 155% in the first quarter of 2025 , adidas emphasized its worries about the uncertain trade landscape.\nURL: https://hypebeast.com/2025/4/adidas-warns-of-us-price-hikes-despite-doubled-growth\n---\n\nSEARCH: Adidas Stan Smith current price retail availability popularity popularity trends demand 2025\nRESULT 7:\nTitle: The Best adidas Stan Smith Shoes to Buy Now - Yahoo\nContent: Sep 13, 2024 ‚Äî This guide for the best adidas Stan Smith shoes in 2024 with up-to-date trend insight and new models available to shop.\nURL: https://www.yahoo.com/lifestyle/adidas-stan-smith-became-timeless-173307049.html\n---\n\nSEARCH: Adidas Stan Smith current price retail availability popularity popularity trends demand 2025\nRESULT 8:\nTitle: adidas presents growth strategy 'Own the Game' until 2025\nContent: Mar 10, 2021 ‚Äî The new strategy is designed to significantly increase sales and profitability as well as gain market share until 2025 .\nURL: https://www.adidas-group.com/en/media/press-releases/adidas-presents-growth-strategy-own-the-game-until-2025\n---\n\nSEARCH: Adidas Stan Smith current price retail availability popularity popularity trends demand 2025\nRESULT 9:\nTitle: Sneaker and Activewear | adidas US\nContent: Explore adidas sneakers for sports and daily wear . From versatile activewear to sporting goods and accessories for all ages and all levels.\nURL: https://www.adidas.com/us\n---\n\nSEARCH: Adidas Stan Smith current price retail availability popularity popularity trends demand 2025\nRESULT 10:\nTitle: Top 9 Women's Sneakers for Summer 2025 ‚Äì Trends ...\nContent: Jul 14, 2025 ‚Äî Discover the 9 hottest women's sneakers for summer 2025 ‚Äì from low-profile and color-pop to gorpcore, retro suede and animal print!\nURL: https://warsawsneakerstore.com/en/blog/top-9-women-s-sneakers-for-summer-2025-trends-worn-by-stars.html\n---\n"
}