{
  "metadata": {
    "search_type": "product_search",
    "original_query": "Adidas Stan Smith current price range retail price",
    "timestamp": "2025-08-29T07:35:21.090971",
    "pwd": "/Users/orchidee/Documents/AI-market-agent/src",
    "saved_to": "/Users/orchidee/Documents/AI-market-agent/data/product_search_20250829_073521.json"
  },
  "search_results": {
    "queries": [
      {
        "search_query": "Adidas Stan Smith current price range retail price price retail cost MSRP",
        "results_count": 10,
        "results": [
          {
            "title": "adidas Stan Smith Shoes | adidas US",
            "content": "Shop Stan Smith shoes at adidas . Iconic style meets comfort in these classic sneakers, perfect for casual wear and your most fashion-forward outfits.",
            "url": "https://www.adidas.com/us/stan_smith"
          },
          {
            "title": "eBay adidas Stan Smith for Sale | Authenticity Guaranteed | eBay",
            "content": "Get the best deals on adidas Stan Smith when you shop the largest online selection at eBay.com. Free shipping on many items | Browse your favorite brands | affordable prices .",
            "url": "https://www.ebay.com/b/adidas-Stan-Smith/15709/bn_7119027579"
          },
          {
            "title": "Amazon Amazon.com: Adidas Stan Smith",
            "content": "Check each product page for other buying options. Price and other details may vary based on product size and color · Mens Sneakers – Memory Foam Fashion Mens Shoes – Lightweight and Non Slip Laced-Up Casual Men Sneakers - Perfect Men Casual Shoes for All-Day Wear (Tilton) · After viewing ...",
            "url": "https://www.amazon.com/Adidas-Stan-Smith/s?k=Adidas+Stan+Smith"
          },
          {
            "title": "adidas adidas Stan Smith Shoes Sale | adidas US",
            "content": "Grab adidas Stan Smith Shoes On Sale at adidas today! Discover the best adidas Stan Smith shoes in various styles, sizes and colors that are on sale.",
            "url": "https://www.adidas.com/us/stan_smith-shoes-sale"
          },
          {
            "title": "Zappos Mens adidas stan smith sneakers + FREE SHIPPING | Zappos",
            "content": "adidas - Ultraboost 5 Running Shoes. Color White/White/Crystal White. On sale for $170.79. MSRP $180.00 .",
            "url": "https://www.zappos.com/mens-adidas-stan-smith-sneakers"
          },
          {
            "title": "StockX Buy and Sell adidas Stan Smith Sneakers - StockX",
            "content": "Browse adidas Stan Smith Sneakers and buy or sell at market prices on StockX, the live marketplace for adidas Sneakers. Every item is Verified by StockX or sent directly from a StockX Verified Seller.",
            "url": "https://stockx.com/brands/adidas?category=sneakers&model=stan-smith"
          },
          {
            "title": "Foot Locker adidas Originals Stan Smith Shoes | Foot Locker",
            "content": "Shop the latest selection of adidas Originals Stan Smith Shoes at Foot Locker. Find the hottest sneaker drops from brands like Jordan, Nike, Under Armour, New Balance, and a bunch more. Free shipping for FLX members.",
            "url": "https://www.footlocker.com/category/shoes/adidas-originals/stan-smith.html"
          },
          {
            "title": "Men's Journal Adidas’ All-Leather Stan Smith Sneakers Are a Rare 40% Off",
            "content": "July 2, 2025 - Adidas Stan Smith Lux Sneakers are on sale for as low as $72 right now at Adidas—up to a 40% discount compared to their full price of $120. Collectors, enthusiasts, and sneakerheads alike cannot help but rave about these \"beautiful, high-quality leather sneaks,\" giving them a near-perfect ...",
            "url": "https://www.mensjournal.com/shopping/adidas-stan-smith-lux-sneakers-sale"
          },
          {
            "title": "Myntra Adidas Stan Smith Sneakers - Buy Stan Smith Shoes and Sneakers Online in India - Myntra",
            "content": "Adidas Stan Smith Shoes. Shop Stan Smith sneakers, one of the best from the house of Adidas . Buy Latest range of Stan Smith Sneakers for Men and women Online at Myntra for best price . 100% Genuine Stan Smiths .",
            "url": "https://www.myntra.com/adidas-stan-smith"
          },
          {
            "title": "Poshmark adidas stan smith - Poshmark",
            "content": "Find new and preloved adidas stan smith items at up to 70% off retail prices . Poshmark makes shopping fun, affordable & easy!",
            "url": "https://poshmark.com/brand/adidas+stan+smith"
          }
        ]
      },
      {
        "search_query": "Adidas Stan Smith current price range retail price availability stock inventory",
        "results_count": 10,
        "results": [
          {
            "title": "Adidas Stan Smith - Wikipedia",
            "content": "Adidas Stan Smith is a tennis shoe made by Adidas , and first launched in 1965. Originally named \" Adidas Robert Haillet\" after the brand endorsed French prominent player Robert Haillet, in 1978 the sneakers were renamed after Stan Smith ...",
            "url": "https://en.wikipedia.org/wiki/Adidas_Stan_Smith"
          },
          {
            "title": "Stan Smith Shoes | adidas US",
            "content": "Price $100. Stan Smith Shoes. Women's Originals.The iconic Stan Smith shoes from adidas first hit the scene as a performance tennis shoe. Nowadays, these sneakers from adidas Originals are a staple of streetwear fashion.",
            "url": "https://www.adidas.com/us/stan_smith"
          },
          {
            "title": "Adidas x Bape Mens Stan Smith Shoes – Extra Butter India",
            "content": "These signature adidas Stan Smith shoes explore the limitless world of BAPE — and the result is a trainer that flatters the original with a wave of fresh energy. Repurposing an iconic silhouette, it hints at the label's signature futuristic aesthetic that's just this side of flashy.",
            "url": "https://extrabutterny.in/products/adidas-mens-stan-smith-bape"
          },
          {
            "title": "Adidas Stan Smith Homer Simpson: D’oh",
            "content": "Price : $120 [Partly Sold Out; Check eBay for Current Pricing ].Why Avoid: The Adidas Stan Smith Homer Simpson isn’t the best Stan Smith they make from a quality perspective.",
            "url": "https://100wears.com/adidas-stan-smith-homer-simpson-doh/"
          },
          {
            "title": "ADIDAS ORIGINALS STAN SMITH | White Women‘s Sneakers | YOOX",
            "content": "ADIDAS ORIGINALS Sneakers STAN SMITH White Synthetisches Material.Reference price US$ 185. (-27%).",
            "url": "https://www.yoox.com/sg/32033529QQ/item"
          },
          {
            "title": "Classic Homer Simpson Meme Inspires New Adidas Sneakers - Nerdist",
            "content": "Adidas Stan Smith Homer Simpson sneaker heel view.These specially designed The Simpsons Stan Smith shoes come at a price of $120.00, this amusing edition to the timeless footwear is now available for purchase via various Adidas retailers and online.",
            "url": "https://nerdist.com/article/homer-simpson-bushes-meme-becomes-new-adidas-sneakers/"
          },
          {
            "title": "adidas Adifom Stan Smith Mule Shoes - Brown | adidas UK",
            "content": "Now on sale Shop for Brown Adifom Stan Smith Mule Shoes at adidas .co.uk! Free Shipping Options & 30 Day Returns at the official adidas online store.Enjoy up to 30% off a selected range , including this product. This offer cannot be combined with other promotions.",
            "url": "https://www.adidas.co.uk/adifom-stan-smith-mule-shoes/IE7052.html"
          },
          {
            "title": "History - adidas Group",
            "content": "A partnership with Stan Smith , seen here during his 1972 Wimbledon victory, signaled the start of a 50+ year relationship between adidas and the tennis icon.",
            "url": "https://www.adidas-group.com/en/about/history"
          },
          {
            "title": "From Shanghai with Love: Adidas Stan Smith Review and How to get...",
            "content": "Where to Buy. 1. Adidas .com After Adidas re-released them in January, they have been more or less consistently sold out at adidas .com, HOWEVER, they do restock them every couple of months, so try to check the site occasionally for any updated inventory .",
            "url": "https://fromshanghaiwithamour.blogspot.com/2014/05/adidas-stan-smith-review-and-how-to-get.html"
          },
          {
            "title": "Stan smith running white online",
            "content": "Move to bag. Remove. - + Price adidas Originals Stan Smith Amazon Fashion online, adidas Originals STAN SMITH UNISEX Sneakers low footwear white online, adidas city run fulham schedule live score today online, Stan Smith Running White Fairway online, adidas Stan Smith ...",
            "url": "https://cugms.ru/?c=21859712"
          }
        ]
      },
      {
        "search_query": "Adidas Stan Smith current price range retail price popularity trends demand 2025",
        "results_count": 10,
        "results": [
          {
            "title": "Sneaker and Activewear | adidas US",
            "content": "Find sport-specific sneakers to support your passion, and shop versatile activewear and accessories that support everyday comfort. adidas has you covered with world-class …",
            "url": "https://www.adidas.com/us?msockid=0d8302747b1b632a362a14237afd6248"
          },
          {
            "title": "adidas Online Shop | adidas US",
            "content": "SHOP BY COLLECTION adicolor Premium Collaborations adidas by Stella McCartney Gazelle Originals Samba",
            "url": "https://www.adidas.com/us/welcome?msockid=0d8302747b1b632a362a14237afd6248"
          },
          {
            "title": "adidas Shoes, Sneakers & Slides | adidas US",
            "content": "Shop adidas shoes for training, sport, and casual lifestyle at the official adidas online store. Browse all the hottest styles like UltraBoost, NMD, and more.",
            "url": "https://www.adidas.com/us/shoes?msockid=0d8302747b1b632a362a14237afd6248"
          },
          {
            "title": "New Shoes | adidas US",
            "content": "Discover new shoes at adidas. Explore the latest drops combining sleek designs and ultimate comfort for everyday wear and standout style.",
            "url": "https://www.adidas.com/us/new_arrivals?msockid=0d8302747b1b632a362a14237afd6248"
          },
          {
            "title": "Men's Shoes - adidas US",
            "content": "Shop men's shoes at adidas. Explore performance sneakers and versatile everyday pairs that blend performance-driven comfort and lifestyle appeal.",
            "url": "https://www.adidas.com/us/men-shoes?msockid=0d8302747b1b632a362a14237afd6248"
          },
          {
            "title": "Men's Sneakers and Workout Clothes | adidas US",
            "content": "Workout with cutting-edge cushioning, or set the casual standard off the field with heritage sports style. adidas is here, and has always been, with men's workout clothes and sneakers for …",
            "url": "https://www.adidas.com/us/men?msockid=0d8302747b1b632a362a14237afd6248"
          },
          {
            "title": "Men's Clothes & Shoes on Sale | adidas US",
            "content": "Shop men's clothes & shoes on sale at adidas. Discover stylish, comfortable essentials perfect for sports-inspired looks and everyday athleisure vibes.",
            "url": "https://www.adidas.com/us/men-sale?msockid=0d8302747b1b632a362a14237afd6248"
          },
          {
            "title": "Women's Sneakers and Activewear | adidas US",
            "content": "Experience adidas technologies that support cool, dry comfort through intense workouts. Put your fitness first with adidas women's workout shoes and running clothes that breathe, manage …",
            "url": "https://www.adidas.com/us/women?msockid=0d8302747b1b632a362a14237afd6248"
          },
          {
            "title": "Shop New Clothes & Shoes For Men | adidas US",
            "content": "Browse new clothes and shoes for men at adidas. Check out the latest arrivals in apparel and footwear for any sport or season.",
            "url": "https://www.adidas.com/us/men-new_arrivals?msockid=0d8302747b1b632a362a14237afd6248"
          },
          {
            "title": "Men's Sneakers - adidas US",
            "content": "Shop the latest men's athletic shoes and sneakers from adidas. Grab a pair of slip on sneakers, classic sneakers or retro sneaker styles for men today.",
            "url": "https://www.adidas.com/us/men-athletic_sneakers?msockid=0d8302747b1b632a362a14237afd6248"
          }
        ]
      }
    ],
    "total_results": 30
  },
  "formatted_output": "SEARCH: Adidas Stan Smith current price range retail price price retail cost MSRP\nRESULT 1:\nTitle: adidas Stan Smith Shoes | adidas US\nContent: Shop Stan Smith shoes at adidas . Iconic style meets comfort in these classic sneakers, perfect for casual wear and your most fashion-forward outfits.\nURL: https://www.adidas.com/us/stan_smith\n---\n\nSEARCH: Adidas Stan Smith current price range retail price price retail cost MSRP\nRESULT 2:\nTitle: eBay adidas Stan Smith for Sale | Authenticity Guaranteed | eBay\nContent: Get the best deals on adidas Stan Smith when you shop the largest online selection at eBay.com. Free shipping on many items | Browse your favorite brands | affordable prices .\nURL: https://www.ebay.com/b/adidas-Stan-Smith/15709/bn_7119027579\n---\n\nSEARCH: Adidas Stan Smith current price range retail price price retail cost MSRP\nRESULT 3:\nTitle: Amazon Amazon.com: Adidas Stan Smith\nContent: Check each product page for other buying options. Price and other details may vary based on product size and color · Mens Sneakers – Memory Foam Fashion Mens Shoes – Lightweight and Non Slip Laced-Up Casual Men Sneakers - Perfect Men Casual Shoes for All-Day Wear (Tilton) · After viewing ...\nURL: https://www.amazon.com/Adidas-Stan-Smith/s?k=Adidas+Stan+Smith\n---\n\nSEARCH: Adidas Stan Smith current price range retail price price retail cost MSRP\nRESULT 4:\nTitle: adidas adidas Stan Smith Shoes Sale | adidas US\nContent: Grab adidas Stan Smith Shoes On Sale at adidas today! Discover the best adidas Stan Smith shoes in various styles, sizes and colors that are on sale.\nURL: https://www.adidas.com/us/stan_smith-shoes-sale\n---\n\nSEARCH: Adidas Stan Smith current price range retail price price retail cost MSRP\nRESULT 5:\nTitle: Zappos Mens adidas stan smith sneakers + FREE SHIPPING | Zappos\nContent: adidas - Ultraboost 5 Running Shoes. Color White/White/Crystal White. On sale for $170.79. MSRP $180.00 .\nURL: https://www.zappos.com/mens-adidas-stan-smith-sneakers\n---\n\nSEARCH: Adidas Stan Smith current price range retail price price retail cost MSRP\nRESULT 6:\nTitle: StockX Buy and Sell adidas Stan Smith Sneakers - StockX\nContent: Browse adidas Stan Smith Sneakers and buy or sell at market prices on StockX, the live marketplace for adidas Sneakers. Every item is Verified by StockX or sent directly from a StockX Verified Seller.\nURL: https://stockx.com/brands/adidas?category=sneakers&model=stan-smith\n---\n\nSEARCH: Adidas Stan Smith current price range retail price price retail cost MSRP\nRESULT 7:\nTitle: Foot Locker adidas Originals Stan Smith Shoes | Foot Locker\nContent: Shop the latest selection of adidas Originals Stan Smith Shoes at Foot Locker. Find the hottest sneaker drops from brands like Jordan, Nike, Under Armour, New Balance, and a bunch more. Free shipping for FLX members.\nURL: https://www.footlocker.com/category/shoes/adidas-originals/stan-smith.html\n---\n\nSEARCH: Adidas Stan Smith current price range retail price price retail cost MSRP\nRESULT 8:\nTitle: Men's Journal Adidas’ All-Leather Stan Smith Sneakers Are a Rare 40% Off\nContent: July 2, 2025 - Adidas Stan Smith Lux Sneakers are on sale for as low as $72 right now at Adidas—up to a 40% discount compared to their full price of $120. Collectors, enthusiasts, and sneakerheads alike cannot help but rave about these \"beautiful, high-quality leather sneaks,\" giving them a near-perfect ...\nURL: https://www.mensjournal.com/shopping/adidas-stan-smith-lux-sneakers-sale\n---\n\nSEARCH: Adidas Stan Smith current price range retail price price retail cost MSRP\nRESULT 9:\nTitle: Myntra Adidas Stan Smith Sneakers - Buy Stan Smith Shoes and Sneakers Online in India - Myntra\nContent: Adidas Stan Smith Shoes. Shop Stan Smith sneakers, one of the best from the house of Adidas . Buy Latest range of Stan Smith Sneakers for Men and women Online at Myntra for best price . 100% Genuine Stan Smiths .\nURL: https://www.myntra.com/adidas-stan-smith\n---\n\nSEARCH: Adidas Stan Smith current price range retail price price retail cost MSRP\nRESULT 10:\nTitle: Poshmark adidas stan smith - Poshmark\nContent: Find new and preloved adidas stan smith items at up to 70% off retail prices . Poshmark makes shopping fun, affordable & easy!\nURL: https://poshmark.com/brand/adidas+stan+smith\n---\n\nSEARCH: Adidas Stan Smith current price range retail price availability stock inventory\nRESULT 1:\nTitle: Adidas Stan Smith - Wikipedia\nContent: Adidas Stan Smith is a tennis shoe made by Adidas , and first launched in 1965. Originally named \" Adidas Robert Haillet\" after the brand endorsed French prominent player Robert Haillet, in 1978 the sneakers were renamed after Stan Smith ...\nURL: https://en.wikipedia.org/wiki/Adidas_Stan_Smith\n---\n\nSEARCH: Adidas Stan Smith current price range retail price availability stock inventory\nRESULT 2:\nTitle: Stan Smith Shoes | adidas US\nContent: Price $100. Stan Smith Shoes. Women's Originals.The iconic Stan Smith shoes from adidas first hit the scene as a performance tennis shoe. Nowadays, these sneakers from adidas Originals are a staple of streetwear fashion.\nURL: https://www.adidas.com/us/stan_smith\n---\n\nSEARCH: Adidas Stan Smith current price range retail price availability stock inventory\nRESULT 3:\nTitle: Adidas x Bape Mens Stan Smith Shoes – Extra Butter India\nContent: These signature adidas Stan Smith shoes explore the limitless world of BAPE — and the result is a trainer that flatters the original with a wave of fresh energy. Repurposing an iconic silhouette, it hints at the label's signature futuristic aesthetic that's just this side of flashy.\nURL: https://extrabutterny.in/products/adidas-mens-stan-smith-bape\n---\n\nSEARCH: Adidas Stan Smith current price range retail price availability stock inventory\nRESULT 4:\nTitle: Adidas Stan Smith Homer Simpson: D’oh\nContent: Price : $120 [Partly Sold Out; Check eBay for Current Pricing ].Why Avoid: The Adidas Stan Smith Homer Simpson isn’t the best Stan Smith they make from a quality perspective.\nURL: https://100wears.com/adidas-stan-smith-homer-simpson-doh/\n---\n\nSEARCH: Adidas Stan Smith current price range retail price availability stock inventory\nRESULT 5:\nTitle: ADIDAS ORIGINALS STAN SMITH | White Women‘s Sneakers | YOOX\nContent: ADIDAS ORIGINALS Sneakers STAN SMITH White Synthetisches Material.Reference price US$ 185. (-27%).\nURL: https://www.yoox.com/sg/32033529QQ/item\n---\n\nSEARCH: Adidas Stan Smith current price range retail price availability stock inventory\nRESULT 6:\nTitle: Classic Homer Simpson Meme Inspires New Adidas Sneakers - Nerdist\nContent: Adidas Stan Smith Homer Simpson sneaker heel view.These specially designed The Simpsons Stan Smith shoes come at a price of $120.00, this amusing edition to the timeless footwear is now available for purchase via various Adidas retailers and online.\nURL: https://nerdist.com/article/homer-simpson-bushes-meme-becomes-new-adidas-sneakers/\n---\n\nSEARCH: Adidas Stan Smith current price range retail price availability stock inventory\nRESULT 7:\nTitle: adidas Adifom Stan Smith Mule Shoes - Brown | adidas UK\nContent: Now on sale Shop for Brown Adifom Stan Smith Mule Shoes at adidas .co.uk! Free Shipping Options & 30 Day Returns at the official adidas online store.Enjoy up to 30% off a selected range , including this product. This offer cannot be combined with other promotions.\nURL: https://www.adidas.co.uk/adifom-stan-smith-mule-shoes/IE7052.html\n---\n\nSEARCH: Adidas Stan Smith current price range retail price availability stock inventory\nRESULT 8:\nTitle: History - adidas Group\nContent: A partnership with Stan Smith , seen here during his 1972 Wimbledon victory, signaled the start of a 50+ year relationship between adidas and the tennis icon.\nURL: https://www.adidas-group.com/en/about/history\n---\n\nSEARCH: Adidas Stan Smith current price range retail price availability stock inventory\nRESULT 9:\nTitle: From Shanghai with Love: Adidas Stan Smith Review and How to get...\nContent: Where to Buy. 1. Adidas .com After Adidas re-released them in January, they have been more or less consistently sold out at adidas .com, HOWEVER, they do restock them every couple of months, so try to check the site occasionally for any updated inventory .\nURL: https://fromshanghaiwithamour.blogspot.com/2014/05/adidas-stan-smith-review-and-how-to-get.html\n---\n\nSEARCH: Adidas Stan Smith current price range retail price availability stock inventory\nRESULT 10:\nTitle: Stan smith running white online\nContent: Move to bag. Remove. - + Price adidas Originals Stan Smith Amazon Fashion online, adidas Originals STAN SMITH UNISEX Sneakers low footwear white online, adidas city run fulham schedule live score today online, Stan Smith Running White Fairway online, adidas Stan Smith ...\nURL: https://cugms.ru/?c=21859712\n---\n\nSEARCH: Adidas Stan Smith current price range retail price popularity trends demand 2025\nRESULT 1:\nTitle: Sneaker and Activewear | adidas US\nContent: Find sport-specific sneakers to support your passion, and shop versatile activewear and accessories that support everyday comfort. adidas has you covered with world-class …\nURL: https://www.adidas.com/us?msockid=0d8302747b1b632a362a14237afd6248\n---\n\nSEARCH: Adidas Stan Smith current price range retail price popularity trends demand 2025\nRESULT 2:\nTitle: adidas Online Shop | adidas US\nContent: SHOP BY COLLECTION adicolor Premium Collaborations adidas by Stella McCartney Gazelle Originals Samba\nURL: https://www.adidas.com/us/welcome?msockid=0d8302747b1b632a362a14237afd6248\n---\n\nSEARCH: Adidas Stan Smith current price range retail price popularity trends demand 2025\nRESULT 3:\nTitle: adidas Shoes, Sneakers & Slides | adidas US\nContent: Shop adidas shoes for training, sport, and casual lifestyle at the official adidas online store. Browse all the hottest styles like UltraBoost, NMD, and more.\nURL: https://www.adidas.com/us/shoes?msockid=0d8302747b1b632a362a14237afd6248\n---\n\nSEARCH: Adidas Stan Smith current price range retail price popularity trends demand 2025\nRESULT 4:\nTitle: New Shoes | adidas US\nContent: Discover new shoes at adidas. Explore the latest drops combining sleek designs and ultimate comfort for everyday wear and standout style.\nURL: https://www.adidas.com/us/new_arrivals?msockid=0d8302747b1b632a362a14237afd6248\n---\n\nSEARCH: Adidas Stan Smith current price range retail price popularity trends demand 2025\nRESULT 5:\nTitle: Men's Shoes - adidas US\nContent: Shop men's shoes at adidas. Explore performance sneakers and versatile everyday pairs that blend performance-driven comfort and lifestyle appeal.\nURL: https://www.adidas.com/us/men-shoes?msockid=0d8302747b1b632a362a14237afd6248\n---\n\nSEARCH: Adidas Stan Smith current price range retail price popularity trends demand 2025\nRESULT 6:\nTitle: Men's Sneakers and Workout Clothes | adidas US\nContent: Workout with cutting-edge cushioning, or set the casual standard off the field with heritage sports style. adidas is here, and has always been, with men's workout clothes and sneakers for …\nURL: https://www.adidas.com/us/men?msockid=0d8302747b1b632a362a14237afd6248\n---\n\nSEARCH: Adidas Stan Smith current price range retail price popularity trends demand 2025\nRESULT 7:\nTitle: Men's Clothes & Shoes on Sale | adidas US\nContent: Shop men's clothes & shoes on sale at adidas. Discover stylish, comfortable essentials perfect for sports-inspired looks and everyday athleisure vibes.\nURL: https://www.adidas.com/us/men-sale?msockid=0d8302747b1b632a362a14237afd6248\n---\n\nSEARCH: Adidas Stan Smith current price range retail price popularity trends demand 2025\nRESULT 8:\nTitle: Women's Sneakers and Activewear | adidas US\nContent: Experience adidas technologies that support cool, dry comfort through intense workouts. Put your fitness first with adidas women's workout shoes and running clothes that breathe, manage …\nURL: https://www.adidas.com/us/women?msockid=0d8302747b1b632a362a14237afd6248\n---\n\nSEARCH: Adidas Stan Smith current price range retail price popularity trends demand 2025\nRESULT 9:\nTitle: Shop New Clothes & Shoes For Men | adidas US\nContent: Browse new clothes and shoes for men at adidas. Check out the latest arrivals in apparel and footwear for any sport or season.\nURL: https://www.adidas.com/us/men-new_arrivals?msockid=0d8302747b1b632a362a14237afd6248\n---\n\nSEARCH: Adidas Stan Smith current price range retail price popularity trends demand 2025\nRESULT 10:\nTitle: Men's Sneakers - adidas US\nContent: Shop the latest men's athletic shoes and sneakers from adidas. Grab a pair of slip on sneakers, classic sneakers or retro sneaker styles for men today.\nURL: https://www.adidas.com/us/men-athletic_sneakers?msockid=0d8302747b1b632a362a14237afd6248\n---\n"
}