{
  "metadata": {
    "search_type": "sentiment_search",
    "original_query": "Matcha powder",
    "timestamp": "2025-08-28T17:46:11.616408",
    "pwd": "/Users/orchidee/Documents/AI-market-agent/src",
    "saved_to": "/Users/orchidee/Documents/AI-market-agent/data/sentiment_search_20250828_174611.json"
  },
  "search_results": {
    "queries": [
      {
        "search_query": "Matcha powder customer reviews ratings",
        "results_count": 10,
        "results": [
          {
            "title": "Matcha Review | Matcha.com Ratings & Customer Reviews ‚Äì",
            "content": "Matcha 's review score is based on Matcha 's customer ratings , its brand popularity, its price competitiveness, as well as the breadth and quality of ...",
            "url": "https://matcha.knoji.com/"
          },
          {
            "title": "15 Best Matcha Powder (2024) ‚Äì With Tests & Expert Reviews",
            "content": "Below we will review each brand of matcha and rate them on several different criteria in order to determine the best brand of matcha powder .",
            "url": "https://www.matchaconnection.com/best-matcha-green-tea-powder/"
          },
          {
            "title": "Best Matcha Powder Review üçµ (Aug. 2025)",
            "content": "... have incorporated the best-rated matcha powder ... Customer Satisfaction is our Priority, Therefore, Our Matcha Powder has 100% Money Back Guarantee.",
            "url": "https://mykitchenadvisor.com/matcha-powder/"
          },
          {
            "title": "BEST Organic Matcha Powder Review - Buttered Side Up",
            "content": "I typed ‚Äú organic matcha powder made in Japan ‚Äù into Amazon, then sorted by average customer review , and purchased the top 4 brands.",
            "url": "https://www.butteredsideupblog.com/best-organic-matcha-powder-review/"
          },
          {
            "title": "The best matcha powder, tested and reviewed by a registered",
            "content": "... reviewer called it an \"exceptional ... With nearly 4,000 ratings and an average of 4.7 out of 5 stars, the reviews for this matcha are outstanding.",
            "url": "https://www.yahoo.com/lifestyle/best-matcha-powder-211516287.html"
          },
          {
            "title": "'This stuff is amazing!': Amazon's No.1 bestselling matcha",
            "content": "Worth noting: This matcha green tea powder has a whopping 54,000 five-star reviews from people who swear by it. ... Organic Matcha Green Tea Powder ...",
            "url": "https://www.yahoo.com/lifestyle/jade-leaf-matcha-powder-sale-093736678.html"
          },
          {
            "title": "Matcha Bar Review | Matchabar.co Ratings & Customer Reviews",
            "content": "Matcha Bar's review score is based on Matcha Bar's customer ratings , its brand popularity, its price competitiveness, as well as the breadth and ...",
            "url": "https://matchabar.knoji.com/"
          },
          {
            "title": "The 10 Best Matcha of 2025 (Reviews) - FindThisBest",
            "content": "MATCHA DNA Organic Matcha Green Tea Powder is a Farm Direct to Customer Product, USDA Certified Organic, and tested for Lead and heavy metals by ...",
            "url": "https://www.findthisbest.com/best-matcha"
          },
          {
            "title": "Best Matcha Powder For Beginners - Little Beauty Blog",
            "content": "Looking for the best matcha powder for beginners? Discover top-rated, easy-to-use matcha brands perfect for your first sip.",
            "url": "https://littlebeautyblog.com/health-wellness/best-matcha-powder-for-beginners/"
          },
          {
            "title": "The 6 Best Matcha Powders - Love and Lemons",
            "content": "To select which matcha powders to test, we got recommendations from readers and matcha -drinking friends and looked online to find other well reviewed ...",
            "url": "https://www.loveandlemons.com/best-matcha-powders/"
          }
        ]
      },
      {
        "search_query": "Matcha powder user experience feedback",
        "results_count": 10,
        "results": [
          {
            "title": "People who like matcha...Can you explain it to me? Please ...",
            "content": "I like it because it's like the ultimate green tea . Well done matcha is not bitter. It's vegetal and rich, but also sweet (without added sugar).",
            "url": "https://www.reddit.com/r/tea/comments/wgaabv/people_who_like_matchacan_you_explain_it_to_me/"
          },
          {
            "title": "The 6 Best Matcha Powders of 2025, Tested & Reviewed",
            "content": "I particularly liked the Rishi Tea Everyday Matcha , which was fantastic (especially in lattes) and affordable. Slightly more expensive, but available in a ...",
            "url": "https://www.seriouseats.com/best-matcha-powder-8757655"
          },
          {
            "title": "The Best Matcha Powder, Tested & Reviewed",
            "content": "Mar 21, 2025 ‚Äî Blue Bottle's matcha tasted the most well-balanced of any matcha I tested . It tastes round and smooth but also has a zippy punch. This matcha ...",
            "url": "https://www.foodandwine.com/best-matcha-powder-8695612"
          },
          {
            "title": "What is your review of Matcha?",
            "content": "Matcha is the best green tea in all respects be it taste or health benefits i have ever had. There are some awesome recipes related to matcha ...",
            "url": "https://www.quora.com/What-is-your-review-of-Matcha"
          },
          {
            "title": "Matcha Green Tea Reviews & Brand Buying Guide",
            "content": "Mar 19, 2014 ‚Äî Buy reviewing a wide selection of brands, surveying them based on color, price, taste and packaging. And I will give my own tips and tricks for enjoying matcha ...",
            "url": "https://healthyhappylife.com/matcha-green-tea-brand-reviews-buying/"
          },
          {
            "title": "Matcha Review: Not Just Any Green Drink - Horizon",
            "content": "May 20, 2025 ‚Äî This matcha was delicious to say the least; the strawberry taste was not overpowering at all, and it actually tasted like good matcha . I am not ...",
            "url": "https://lhshorizon.com/14193/arts-entertainment/matcha-review-not-just-any-green-drink/"
          },
          {
            "title": "BEST Organic Matcha Powder Review",
            "content": "Jul 15, 2021 ‚Äî I've been a fan of Encha since the beginning. They manage to offer customer high quality, organic matcha for a reasonable price. At 67¬¢ per gram ...",
            "url": "https://www.butteredsideupblog.com/best-organic-matcha-powder-review/"
          },
          {
            "title": "Organic Matcha Green Tea Powder",
            "content": "So happy with this product , I even got my sister hooked and she didn't like her first matcha experience so it was a win win! ... User Info. Services. Shop.",
            "url": "https://chamberlaincoffee.eu/products/matcha-green-tea-powder"
          },
          {
            "title": "ORGANIC MATCHA GREEN TEA POWDER | Yupik",
            "content": "One cup of matcha is equivalent to 10 cups of green tea! Matcha powder also contains 6 times more antioxidants than goji berries , 7 times more than dark ...",
            "url": "https://yupik.com/en/organic-matcha-green-tea-powder-p33025?srsltid=AfmBOorTmui_woBXtXMghgnhojh6S53Qrpdm6iZaESZPFeQXDSGzd1e2"
          },
          {
            "title": "MATCHA - Your Essential Guide to Japan Travel, Culture, Hotels, ‚Ä¶",
            "content": "MATCHA is a media platform that introduces Japan travel information such as places to visit, hotel reservations, hot spring facilities, dining, shopping, recommended itineraries, and more. We also ‚Ä¶",
            "url": "https://matcha-jp.com/en/"
          }
        ]
      },
      {
        "search_query": "Matcha powder complaints issues problems",
        "results_count": 10,
        "results": [
          {
            "title": "Is Too Much Matcha Bad? A 2025 Guide to Side Effects",
            "content": "Can matcha cause liver issues ? Does matcha contain lead or other heavy metals? Is matcha bad for your stomach?Can matcha cause liver issues ? This is a valid concern, as high doses of green tea extract supplements have been linked to liver stress or damage in rare cases.",
            "url": "https://flavor365.com/how-much-matcha-is-too-much-a-deep-dive-on-daily-limits/"
          },
          {
            "title": "Matcha side effects: How overconsumption can affect liver and digestion",
            "content": "Too much matcha may lead to digestive issues , anxiety, rapid heartbeat, and disrupted sleep due to its high caffeine content. It can also increase the risk of iron absorption problems and kidney stones when consumed in excess.",
            "url": "https://paritytrial.com/matcha-side-effects-how-overconsumption-can-affect-liver-and-digestion-1840.html"
          },
          {
            "title": "Is It Safe To Drink Matcha Powder Every Day? - Blog",
            "content": "Matcha , a finely ground powder made from specially grown and processed green tea leaves, has gained immense popularity in recent years due to its unique flavor and potential health benefits.",
            "url": "https://www.hongdanaturals.com/info/is-it-safe-to-drink-matcha-powder-every-day-97949030.html"
          },
          {
            "title": "7 actually delicious matcha recipes that don't taste like grass...",
            "content": "That's when I realized the problem wasn't matcha ‚Äîit was how most of us were using it. Here's what nobody tells you: matcha is like garlic or fish sauce.1 teaspoon matcha powder . 1 tablespoon almond butter (or sunflower seed butter for nut-free). 1 teaspoon vanilla extract.",
            "url": "https://vegoutmag.com/recipes/s-7-actually-delicious-matcha-recipes-that-dont-taste-like-grass-as-a-former-matcha-hater/"
          },
          {
            "title": "Is matcha really good for you? Here's what the science says | Gathered",
            "content": "What is true, is matcha tea is extremely low-calorie, so if replacing your morning latte, you‚Äôre already winning. How do you take it? Because it‚Äôs a powder , you whisk it into hot water, with or without milk, and drink it. Or you can add it to smoothies, such as the viral strawberry matcha latte.",
            "url": "https://www.gathered.how/news/matcha-tea"
          },
          {
            "title": "Matcha Powder : The Secret to Enhancing Your Morning Smoothies",
            "content": "Enhance your morning smoothies with Matcha Powder ! This Japanese green tea boosts energy and focus. Try it now for a healthy, delicious start to your day!",
            "url": "https://kyoto.co.in/matcha-powder-enhance-morning-smoothies/"
          },
          {
            "title": "Is Matcha Tea Good for Diabetics? A Scientific Look - Biology Insights",
            "content": "Delve into the scientific evaluation of matcha tea for diabetics, exploring its potential health advantages and important consumption guidance.",
            "url": "https://biologyinsights.com/is-matcha-tea-good-for-diabetics-a-scientific-look/"
          },
          {
            "title": "Good Matcha Powder at Whole Foods | TikTok",
            "content": "Discover videos related to Good Matcha Powder at Whole Foods on TikTok. Last updated 2025-02-24.",
            "url": "https://www.tiktok.com/discover/good-matcha-powder-at-whole-foods"
          },
          {
            "title": "We‚Äôve Been Drinking: Homemade Matcha Lattes in the... | The Horticult",
            "content": "Matcha , the posh and powdered variety of green tea, is having a moment. Just last month Gotham crowned it ‚Äúthe new black coffee,‚Äù and last week the New York Times included it in its ongoing coverage of the tea tempest.",
            "url": "https://thehorticult.com/weve-been-drinking-homemade-matcha-lattes-in-the-morning/"
          },
          {
            "title": "Matcha boom strains supply in Japan as tradition meets trend",
            "content": "\" Matcha should not just be a trend‚Äîwe want it to be established as both a flavor and a symbol of Japan as a global brand,\" said Tomoyuki Kawai, a ministry official in charge of tea.",
            "url": "https://www.parisnews.net/news/278529870/matcha-boom-strains-supply-in-japan-as-tradition-meets-trend"
          }
        ]
      }
    ],
    "total_results": 30
  },
  "formatted_output": "SENTIMENT SEARCH: Matcha powder customer reviews ratings\nRESULT 1:\nTitle: Matcha Review | Matcha.com Ratings & Customer Reviews ‚Äì\nContent: Matcha 's review score is based on Matcha 's customer ratings , its brand popularity, its price competitiveness, as well as the breadth and quality of ...\nURL: https://matcha.knoji.com/\n---\n\nSENTIMENT SEARCH: Matcha powder customer reviews ratings\nRESULT 2:\nTitle: 15 Best Matcha Powder (2024) ‚Äì With Tests & Expert Reviews\nContent: Below we will review each brand of matcha and rate them on several different criteria in order to determine the best brand of matcha powder .\nURL: https://www.matchaconnection.com/best-matcha-green-tea-powder/\n---\n\nSENTIMENT SEARCH: Matcha powder customer reviews ratings\nRESULT 3:\nTitle: Best Matcha Powder Review üçµ (Aug. 2025)\nContent: ... have incorporated the best-rated matcha powder ... Customer Satisfaction is our Priority, Therefore, Our Matcha Powder has 100% Money Back Guarantee.\nURL: https://mykitchenadvisor.com/matcha-powder/\n---\n\nSENTIMENT SEARCH: Matcha powder customer reviews ratings\nRESULT 4:\nTitle: BEST Organic Matcha Powder Review - Buttered Side Up\nContent: I typed ‚Äú organic matcha powder made in Japan ‚Äù into Amazon, then sorted by average customer review , and purchased the top 4 brands.\nURL: https://www.butteredsideupblog.com/best-organic-matcha-powder-review/\n---\n\nSENTIMENT SEARCH: Matcha powder customer reviews ratings\nRESULT 5:\nTitle: The best matcha powder, tested and reviewed by a registered\nContent: ... reviewer called it an \"exceptional ... With nearly 4,000 ratings and an average of 4.7 out of 5 stars, the reviews for this matcha are outstanding.\nURL: https://www.yahoo.com/lifestyle/best-matcha-powder-211516287.html\n---\n\nSENTIMENT SEARCH: Matcha powder customer reviews ratings\nRESULT 6:\nTitle: 'This stuff is amazing!': Amazon's No.1 bestselling matcha\nContent: Worth noting: This matcha green tea powder has a whopping 54,000 five-star reviews from people who swear by it. ... Organic Matcha Green Tea Powder ...\nURL: https://www.yahoo.com/lifestyle/jade-leaf-matcha-powder-sale-093736678.html\n---\n\nSENTIMENT SEARCH: Matcha powder customer reviews ratings\nRESULT 7:\nTitle: Matcha Bar Review | Matchabar.co Ratings & Customer Reviews\nContent: Matcha Bar's review score is based on Matcha Bar's customer ratings , its brand popularity, its price competitiveness, as well as the breadth and ...\nURL: https://matchabar.knoji.com/\n---\n\nSENTIMENT SEARCH: Matcha powder customer reviews ratings\nRESULT 8:\nTitle: The 10 Best Matcha of 2025 (Reviews) - FindThisBest\nContent: MATCHA DNA Organic Matcha Green Tea Powder is a Farm Direct to Customer Product, USDA Certified Organic, and tested for Lead and heavy metals by ...\nURL: https://www.findthisbest.com/best-matcha\n---\n\nSENTIMENT SEARCH: Matcha powder customer reviews ratings\nRESULT 9:\nTitle: Best Matcha Powder For Beginners - Little Beauty Blog\nContent: Looking for the best matcha powder for beginners? Discover top-rated, easy-to-use matcha brands perfect for your first sip.\nURL: https://littlebeautyblog.com/health-wellness/best-matcha-powder-for-beginners/\n---\n\nSENTIMENT SEARCH: Matcha powder customer reviews ratings\nRESULT 10:\nTitle: The 6 Best Matcha Powders - Love and Lemons\nContent: To select which matcha powders to test, we got recommendations from readers and matcha -drinking friends and looked online to find other well reviewed ...\nURL: https://www.loveandlemons.com/best-matcha-powders/\n---\n\nSENTIMENT SEARCH: Matcha powder user experience feedback\nRESULT 1:\nTitle: People who like matcha...Can you explain it to me? Please ...\nContent: I like it because it's like the ultimate green tea . Well done matcha is not bitter. It's vegetal and rich, but also sweet (without added sugar).\nURL: https://www.reddit.com/r/tea/comments/wgaabv/people_who_like_matchacan_you_explain_it_to_me/\n---\n\nSENTIMENT SEARCH: Matcha powder user experience feedback\nRESULT 2:\nTitle: The 6 Best Matcha Powders of 2025, Tested & Reviewed\nContent: I particularly liked the Rishi Tea Everyday Matcha , which was fantastic (especially in lattes) and affordable. Slightly more expensive, but available in a ...\nURL: https://www.seriouseats.com/best-matcha-powder-8757655\n---\n\nSENTIMENT SEARCH: Matcha powder user experience feedback\nRESULT 3:\nTitle: The Best Matcha Powder, Tested & Reviewed\nContent: Mar 21, 2025 ‚Äî Blue Bottle's matcha tasted the most well-balanced of any matcha I tested . It tastes round and smooth but also has a zippy punch. This matcha ...\nURL: https://www.foodandwine.com/best-matcha-powder-8695612\n---\n\nSENTIMENT SEARCH: Matcha powder user experience feedback\nRESULT 4:\nTitle: What is your review of Matcha?\nContent: Matcha is the best green tea in all respects be it taste or health benefits i have ever had. There are some awesome recipes related to matcha ...\nURL: https://www.quora.com/What-is-your-review-of-Matcha\n---\n\nSENTIMENT SEARCH: Matcha powder user experience feedback\nRESULT 5:\nTitle: Matcha Green Tea Reviews & Brand Buying Guide\nContent: Mar 19, 2014 ‚Äî Buy reviewing a wide selection of brands, surveying them based on color, price, taste and packaging. And I will give my own tips and tricks for enjoying matcha ...\nURL: https://healthyhappylife.com/matcha-green-tea-brand-reviews-buying/\n---\n\nSENTIMENT SEARCH: Matcha powder user experience feedback\nRESULT 6:\nTitle: Matcha Review: Not Just Any Green Drink - Horizon\nContent: May 20, 2025 ‚Äî This matcha was delicious to say the least; the strawberry taste was not overpowering at all, and it actually tasted like good matcha . I am not ...\nURL: https://lhshorizon.com/14193/arts-entertainment/matcha-review-not-just-any-green-drink/\n---\n\nSENTIMENT SEARCH: Matcha powder user experience feedback\nRESULT 7:\nTitle: BEST Organic Matcha Powder Review\nContent: Jul 15, 2021 ‚Äî I've been a fan of Encha since the beginning. They manage to offer customer high quality, organic matcha for a reasonable price. At 67¬¢ per gram ...\nURL: https://www.butteredsideupblog.com/best-organic-matcha-powder-review/\n---\n\nSENTIMENT SEARCH: Matcha powder user experience feedback\nRESULT 8:\nTitle: Organic Matcha Green Tea Powder\nContent: So happy with this product , I even got my sister hooked and she didn't like her first matcha experience so it was a win win! ... User Info. Services. Shop.\nURL: https://chamberlaincoffee.eu/products/matcha-green-tea-powder\n---\n\nSENTIMENT SEARCH: Matcha powder user experience feedback\nRESULT 9:\nTitle: ORGANIC MATCHA GREEN TEA POWDER | Yupik\nContent: One cup of matcha is equivalent to 10 cups of green tea! Matcha powder also contains 6 times more antioxidants than goji berries , 7 times more than dark ...\nURL: https://yupik.com/en/organic-matcha-green-tea-powder-p33025?srsltid=AfmBOorTmui_woBXtXMghgnhojh6S53Qrpdm6iZaESZPFeQXDSGzd1e2\n---\n\nSENTIMENT SEARCH: Matcha powder user experience feedback\nRESULT 10:\nTitle: MATCHA - Your Essential Guide to Japan Travel, Culture, Hotels, ‚Ä¶\nContent: MATCHA is a media platform that introduces Japan travel information such as places to visit, hotel reservations, hot spring facilities, dining, shopping, recommended itineraries, and more. We also ‚Ä¶\nURL: https://matcha-jp.com/en/\n---\n\nSENTIMENT SEARCH: Matcha powder complaints issues problems\nRESULT 1:\nTitle: Is Too Much Matcha Bad? A 2025 Guide to Side Effects\nContent: Can matcha cause liver issues ? Does matcha contain lead or other heavy metals? Is matcha bad for your stomach?Can matcha cause liver issues ? This is a valid concern, as high doses of green tea extract supplements have been linked to liver stress or damage in rare cases.\nURL: https://flavor365.com/how-much-matcha-is-too-much-a-deep-dive-on-daily-limits/\n---\n\nSENTIMENT SEARCH: Matcha powder complaints issues problems\nRESULT 2:\nTitle: Matcha side effects: How overconsumption can affect liver and digestion\nContent: Too much matcha may lead to digestive issues , anxiety, rapid heartbeat, and disrupted sleep due to its high caffeine content. It can also increase the risk of iron absorption problems and kidney stones when consumed in excess.\nURL: https://paritytrial.com/matcha-side-effects-how-overconsumption-can-affect-liver-and-digestion-1840.html\n---\n\nSENTIMENT SEARCH: Matcha powder complaints issues problems\nRESULT 3:\nTitle: Is It Safe To Drink Matcha Powder Every Day? - Blog\nContent: Matcha , a finely ground powder made from specially grown and processed green tea leaves, has gained immense popularity in recent years due to its unique flavor and potential health benefits.\nURL: https://www.hongdanaturals.com/info/is-it-safe-to-drink-matcha-powder-every-day-97949030.html\n---\n\nSENTIMENT SEARCH: Matcha powder complaints issues problems\nRESULT 4:\nTitle: 7 actually delicious matcha recipes that don't taste like grass...\nContent: That's when I realized the problem wasn't matcha ‚Äîit was how most of us were using it. Here's what nobody tells you: matcha is like garlic or fish sauce.1 teaspoon matcha powder . 1 tablespoon almond butter (or sunflower seed butter for nut-free). 1 teaspoon vanilla extract.\nURL: https://vegoutmag.com/recipes/s-7-actually-delicious-matcha-recipes-that-dont-taste-like-grass-as-a-former-matcha-hater/\n---\n\nSENTIMENT SEARCH: Matcha powder complaints issues problems\nRESULT 5:\nTitle: Is matcha really good for you? Here's what the science says | Gathered\nContent: What is true, is matcha tea is extremely low-calorie, so if replacing your morning latte, you‚Äôre already winning. How do you take it? Because it‚Äôs a powder , you whisk it into hot water, with or without milk, and drink it. Or you can add it to smoothies, such as the viral strawberry matcha latte.\nURL: https://www.gathered.how/news/matcha-tea\n---\n\nSENTIMENT SEARCH: Matcha powder complaints issues problems\nRESULT 6:\nTitle: Matcha Powder : The Secret to Enhancing Your Morning Smoothies\nContent: Enhance your morning smoothies with Matcha Powder ! This Japanese green tea boosts energy and focus. Try it now for a healthy, delicious start to your day!\nURL: https://kyoto.co.in/matcha-powder-enhance-morning-smoothies/\n---\n\nSENTIMENT SEARCH: Matcha powder complaints issues problems\nRESULT 7:\nTitle: Is Matcha Tea Good for Diabetics? A Scientific Look - Biology Insights\nContent: Delve into the scientific evaluation of matcha tea for diabetics, exploring its potential health advantages and important consumption guidance.\nURL: https://biologyinsights.com/is-matcha-tea-good-for-diabetics-a-scientific-look/\n---\n\nSENTIMENT SEARCH: Matcha powder complaints issues problems\nRESULT 8:\nTitle: Good Matcha Powder at Whole Foods | TikTok\nContent: Discover videos related to Good Matcha Powder at Whole Foods on TikTok. Last updated 2025-02-24.\nURL: https://www.tiktok.com/discover/good-matcha-powder-at-whole-foods\n---\n\nSENTIMENT SEARCH: Matcha powder complaints issues problems\nRESULT 9:\nTitle: We‚Äôve Been Drinking: Homemade Matcha Lattes in the... | The Horticult\nContent: Matcha , the posh and powdered variety of green tea, is having a moment. Just last month Gotham crowned it ‚Äúthe new black coffee,‚Äù and last week the New York Times included it in its ongoing coverage of the tea tempest.\nURL: https://thehorticult.com/weve-been-drinking-homemade-matcha-lattes-in-the-morning/\n---\n\nSENTIMENT SEARCH: Matcha powder complaints issues problems\nRESULT 10:\nTitle: Matcha boom strains supply in Japan as tradition meets trend\nContent: \" Matcha should not just be a trend‚Äîwe want it to be established as both a flavor and a symbol of Japan as a global brand,\" said Tomoyuki Kawai, a ministry official in charge of tea.\nURL: https://www.parisnews.net/news/278529870/matcha-boom-strains-supply-in-japan-as-tradition-meets-trend\n---\n"
}