{
  "metadata": {
    "search_type": "sentiment_search",
    "original_query": "Adidas Stan Smith reviews comfort quality durability",
    "timestamp": "2025-08-29T08:47:11.504187",
    "pwd": "/Users/orchidee/Documents/AI-market-agent/src",
    "saved_to": "/Users/orchidee/Documents/AI-market-agent/data/sentiment_search_20250829_084711.json"
  },
  "search_results": {
    "queries": [
      {
        "search_query": "Adidas Stan Smith reviews comfort quality durability customer reviews ratings",
        "results_count": 10,
        "results": [
          {
            "title": "Zappos Customer Reviews adidas Originals Stan Smith",
            "content": "These are not the same quality as the same shoes I bought 2 years ago. Seem like a cheap outlet version. ... This review was submitted as a sweepstakes or contest entry in exchange for an opportunity to win a prize. Classic style and, surprisingly, the most comfortable casual trainers I've had. I had had a couple of pairs of Stan Smiths as an adolescent and remembered them as quietly cool but rather stiff. However, these shoes now and superbly comfortable . Customer ...",
            "url": "https://www.zappos.com/product/review/9551926"
          },
          {
            "title": "Reviewed Adidas Stan Smith review: Are they worth it? - Reviewed",
            "content": "June 21, 2024 - The upper fit snug, but after roughly two hours of light activity, I was able to break them in . I wear men’s size 11.5 and found that they fit true to size, though I found them more comfortable with the laces loosened and tied without threading them through at the top-most eyelets.",
            "url": "https://www.reviewed.com/style/features/adidas-stan-smith-review"
          },
          {
            "title": "Dappered In Review: Adidas Stan Smith Lux Sneakers",
            "content": "You can tell that the softer leather uppers, decent leather linings, and foam-backed insoles are putting in work to keep things as comfortable as possible. No complaints here! Score: 5/5 Stars – Fits exactly as all my other Adidas sneakers do and these are comfy. Overall, I’m pretty happy ...",
            "url": "https://dappered.com/2023/02/in-review-adidas-stan-smith-lux-sneakers/"
          },
          {
            "title": "Customer Reviews adidas Stan Smith",
            "content": "The damaged leather not only affects the appearance of the product but also raises concerns about its durability . I expected better quality for the price I paid ...",
            "url": "https://www.zappos.com/product/review/8808872/page/218"
          },
          {
            "title": "adidas Originals Stan Smith",
            "content": "5 out of 5 stars. really nice shoe, very comfortable ... Yes, I recommend this product. adidas.com. Originally posted on adidas.com.",
            "url": "https://www.champssports.com/product/model/adidas-originals-stan-smith/212048.html"
          },
          {
            "title": "Quora Are Adidas Stan Smith shoes comfortable? - Quora",
            "content": "Answer (1 of 7): Adidas Stan Smith is one of the comfortable shoe that adidas as ever made. You can't compare the technology of Stan Smith with the technology of the boost that comes with the Ultraboost, yeezys and all. These shoe are an iconic pair of history. Actually adidas believes in the or...",
            "url": "https://www.quora.com/Are-Adidas-Stan-Smith-shoes-comfortable"
          },
          {
            "title": "Medium Adidas Stan Smith Review + On feet| ALL BLACK | by Tobiadey.eth | Medium",
            "content": "December 13, 2018 - Overall- They are great everyday shoes, comfortable, true to size, long lasting although the leather starts to wrinkle . Overall, I’m happy with them for the price I paid and I wear them regularly . They’re not a steal or anything, but if you want a pair of sneakers, they’re a solid choice ...",
            "url": "https://medium.com/@tobiadey/adidas-stan-smith-review-on-feet-all-black-8aa99bc3046b"
          },
          {
            "title": "Trusted Reviews Adidas Stan Smith Review | Trusted Reviews",
            "content": "Complete Review of Adidas Stan Smith . Clean looking, Real iconic and Comfortable shoes. Not only for tennis but also casual sneakers of all time Adidas Stan Smith is Clean looking, Real iconic and Comfortable shoes. Not only for tennis but also casual sneakers of all time.",
            "url": "https://www.izreview.com/adidas-stan-smith-shoes-review/"
          },
          {
            "title": "SneakerLens Adidas Stan Smith Shoes Review - In-Depth Analysis | SneakerLens",
            "content": "June 15, 2025 - Fashion-conscious consumers seeking ... appreciating vegan materials ... The Adidas Stan Smith remains a style icon with unmatched versatility, earning its 4.2/5 rating primarily through design excellence and versatility....",
            "url": "https://www.sneakerlens.com/adidas-stan-smith-shoes-review/"
          },
          {
            "title": "Zappos Customer Reviews adidas Stan Smith",
            "content": "Very comfortable for walking, very good support . Classic shoe. My Adidas Gazelles are a full size smaller than my usual, but these are only half a size smaller than my usual.",
            "url": "https://www.zappos.com/product/review/8808872/page/5"
          }
        ]
      },
      {
        "search_query": "Adidas Stan Smith reviews comfort quality durability user experience feedback",
        "results_count": 10,
        "results": [
          {
            "title": "Customer Reviews adidas Stan Smith",
            "content": "Good quality, true to original style with nice fit . Service and ease of ordering experience = 5 star shoe/experience. ... Comfort superb, I get compliments ...",
            "url": "https://www.zappos.com/product/review/8513559/page/75"
          },
          {
            "title": "In Review: Adidas Stan Smith Lux Sneakers",
            "content": "Feb 21, 2023 — The upgraded upper leather is nice enough , the new lining feels pretty good, and the insole is comfortable and supportive out of the box.",
            "url": "https://dappered.com/2023/02/in-review-adidas-stan-smith-lux-sneakers/"
          },
          {
            "title": "Adidas Stan Smith Review | 2025 real user experience on ...",
            "content": "May 17, 2025 — We will explore their aesthetics, comfort , pricing, and overall value, helping you decide if these sneakers are the right fit for your wardrobe.",
            "url": "https://www.lemon8-app.com/experience/adidas-stan-smith-review?region=us"
          },
          {
            "title": "adidas Originals Stan Smith White/White/Green - Shoes",
            "content": "After the lockdown started using again. In one month my feet were soaked, when I saw, the sole was completely destroyed, full of holes. Adidas should invest in ...",
            "url": "https://www.stylerunner.com/au/products/adidas-originals-stan-smith-fx5502?bvstate=pg:2/ct:r"
          },
          {
            "title": "adidas Originals Stan Smith Velcro Primegreen Reviews",
            "content": "This is my second pair of these. They are very comfortable and fit well . They also more or less pair with any clothes I decide to wear.",
            "url": "https://www.zappos.com/product/review/9486985/page/18"
          },
          {
            "title": "Adidas Stan Smith Shoes Review - In-Depth Analysis",
            "content": "Stan Smith shoes review (2025): Classic design meets sustainable materials . 4.2/5 from 241 users. Perfect for style, mixed durability. Is it right for you?",
            "url": "https://www.sneakerlens.com/adidas-stan-smith-shoes-review/"
          },
          {
            "title": "ADIDAS STAN SMITH BONEGA",
            "content": "Great fit and comfort ! ... Having slightly wider feet, these shoes fit in great and extremely comfortable for full day. Yes, I recommend this product.",
            "url": "https://www.brownsshoes.com/en/women/shoes/sneakers/product/adidas/stan-smith-bonega/262617.html?srsltid=AfmBOopkTwfF6ycBOozD-oH3Ud4ihAn2lsi3YLIqv4UQOe53um9IKJWM"
          },
          {
            "title": "Sneaker and Activewear | adidas US",
            "content": "Explore adidas sneakers for sports and daily wear. From versatile activewear to sporting goods and accessories for all ages and all levels.",
            "url": "https://www.adidas.com/us?msockid=1d13ebf809d867d20f74fdaf08776616"
          },
          {
            "title": "adidas | DICK'S Sporting Goods",
            "content": "Shop adidas shoes by sport, with shoes and cleats engineered for everything from football and baseball to basketball, running and golf. adidas shoes are built with a supportive but lightweight …",
            "url": "https://www.dickssportinggoods.com/s/brand-shop/adidas?msockid=1d13ebf809d867d20f74fdaf08776616"
          },
          {
            "title": "adidas Shoes, Apparel, & Accessories - Foot Locker",
            "content": "Shop the latest selection of adidas at Foot Locker. Find the hottest sneaker drops from brands like Jordan, Nike, Under Armour, New Balance, and a bunch more. Free shipping for FLX members.",
            "url": "https://www.footlocker.com/category/brands/adidas.html"
          }
        ]
      },
      {
        "search_query": "Adidas Stan Smith reviews comfort quality durability complaints issues problems",
        "results_count": 10,
        "results": [
          {
            "title": "Sneaker and Activewear | adidas US",
            "content": "Explore adidas sneakers for sports and daily wear. From versatile activewear to sporting goods and accessories for all ages and all levels.",
            "url": "https://www.adidas.com/us?msockid=1d13ebf809d867d20f74fdaf08776616"
          },
          {
            "title": "adidas | DICK'S Sporting Goods",
            "content": "Shop adidas shoes by sport, with shoes and cleats engineered for everything from football and baseball to basketball, running and golf. adidas shoes are built with a supportive but lightweight …",
            "url": "https://www.dickssportinggoods.com/s/brand-shop/adidas?msockid=1d13ebf809d867d20f74fdaf08776616"
          },
          {
            "title": "adidas Shoes, Apparel, & Accessories - Foot Locker",
            "content": "Shop the latest selection of adidas at Foot Locker. Find the hottest sneaker drops from brands like Jordan, Nike, Under Armour, New Balance, and a bunch more. Free shipping for FLX members.",
            "url": "https://www.footlocker.com/category/brands/adidas.html"
          },
          {
            "title": "Shop adidas Online - Nordstrom Rack",
            "content": "Find the latest selection of adidas in-store or online at Nordstrom. Shipping is always free and returns are accepted at any location. In-store pickup and alterations services available.",
            "url": "https://www.nordstromrack.com/brands/adidas?msockid=1d13ebf809d867d20f74fdaf08776616"
          },
          {
            "title": "adidas Online Shop | adidas US",
            "content": "SHOP BY COLLECTION adicolor Premium Collaborations adidas by Stella McCartney Gazelle Originals Samba",
            "url": "https://www.adidas.com/us/welcome?msockid=1d13ebf809d867d20f74fdaf08776616"
          },
          {
            "title": "adidas | Shoes, Apparel, Bags, & More | Zappos | Zappos.com",
            "content": "This collection features all your favorite classic adidas designs along with their latest trendsetting looks. With a variety of styles for men, women and kids, there’s something for everyone in our …",
            "url": "https://www.zappos.com/c/adidas?msockid=1d13ebf809d867d20f74fdaf08776616"
          },
          {
            "title": "adidas Shoes | Curbside Pickup Available at DICK'S",
            "content": "Shop the complete collection of adidas sneakers, cleats and more at DICK'S Sporting Goods. Browse top-rated adidas shoes for any sport, including adidas Running Shoes, adidas Basketball …",
            "url": "https://www.dickssportinggoods.com/f/adidas-athletic-sneakers?msockid=1d13ebf809d867d20f74fdaf08776616"
          },
          {
            "title": "Shop Shoes & Clothing Deals | adidas US",
            "content": "Find your adidas Shop at adidas.com. All styles and colors available in the official adidas online store.",
            "url": "https://www.adidas.com/us/shop?msockid=1d13ebf809d867d20f74fdaf08776616"
          },
          {
            "title": "adidas | Foot Locker",
            "content": "Shop the latest selection of adidas at Foot Locker. Find the hottest sneaker drops from brands like adidas, Jordan, Nike, Under Armour, New Balance, and a bunch more.",
            "url": "https://www.footlocker.com/adidas.html"
          },
          {
            "title": "Twitter . It’s what’s happening / Twitter",
            "content": "Official Twitter account of Adidas, sharing updates, promotions, and news about their products and brand.",
            "url": "https://twitter.com/adidas"
          }
        ]
      }
    ],
    "total_results": 30
  },
  "formatted_output": "SENTIMENT SEARCH: Adidas Stan Smith reviews comfort quality durability customer reviews ratings\nRESULT 1:\nTitle: Zappos Customer Reviews adidas Originals Stan Smith\nContent: These are not the same quality as the same shoes I bought 2 years ago. Seem like a cheap outlet version. ... This review was submitted as a sweepstakes or contest entry in exchange for an opportunity to win a prize. Classic style and, surprisingly, the most comfortable casual trainers I've had. I had had a couple of pairs of Stan Smiths as an adolescent and remembered them as quietly cool but rather stiff. However, these shoes now and superbly comfortable . Customer ...\nURL: https://www.zappos.com/product/review/9551926\n---\n\nSENTIMENT SEARCH: Adidas Stan Smith reviews comfort quality durability customer reviews ratings\nRESULT 2:\nTitle: Reviewed Adidas Stan Smith review: Are they worth it? - Reviewed\nContent: June 21, 2024 - The upper fit snug, but after roughly two hours of light activity, I was able to break them in . I wear men’s size 11.5 and found that they fit true to size, though I found them more comfortable with the laces loosened and tied without threading them through at the top-most eyelets.\nURL: https://www.reviewed.com/style/features/adidas-stan-smith-review\n---\n\nSENTIMENT SEARCH: Adidas Stan Smith reviews comfort quality durability customer reviews ratings\nRESULT 3:\nTitle: Dappered In Review: Adidas Stan Smith Lux Sneakers\nContent: You can tell that the softer leather uppers, decent leather linings, and foam-backed insoles are putting in work to keep things as comfortable as possible. No complaints here! Score: 5/5 Stars – Fits exactly as all my other Adidas sneakers do and these are comfy. Overall, I’m pretty happy ...\nURL: https://dappered.com/2023/02/in-review-adidas-stan-smith-lux-sneakers/\n---\n\nSENTIMENT SEARCH: Adidas Stan Smith reviews comfort quality durability customer reviews ratings\nRESULT 4:\nTitle: Customer Reviews adidas Stan Smith\nContent: The damaged leather not only affects the appearance of the product but also raises concerns about its durability . I expected better quality for the price I paid ...\nURL: https://www.zappos.com/product/review/8808872/page/218\n---\n\nSENTIMENT SEARCH: Adidas Stan Smith reviews comfort quality durability customer reviews ratings\nRESULT 5:\nTitle: adidas Originals Stan Smith\nContent: 5 out of 5 stars. really nice shoe, very comfortable ... Yes, I recommend this product. adidas.com. Originally posted on adidas.com.\nURL: https://www.champssports.com/product/model/adidas-originals-stan-smith/212048.html\n---\n\nSENTIMENT SEARCH: Adidas Stan Smith reviews comfort quality durability customer reviews ratings\nRESULT 6:\nTitle: Quora Are Adidas Stan Smith shoes comfortable? - Quora\nContent: Answer (1 of 7): Adidas Stan Smith is one of the comfortable shoe that adidas as ever made. You can't compare the technology of Stan Smith with the technology of the boost that comes with the Ultraboost, yeezys and all. These shoe are an iconic pair of history. Actually adidas believes in the or...\nURL: https://www.quora.com/Are-Adidas-Stan-Smith-shoes-comfortable\n---\n\nSENTIMENT SEARCH: Adidas Stan Smith reviews comfort quality durability customer reviews ratings\nRESULT 7:\nTitle: Medium Adidas Stan Smith Review + On feet| ALL BLACK | by Tobiadey.eth | Medium\nContent: December 13, 2018 - Overall- They are great everyday shoes, comfortable, true to size, long lasting although the leather starts to wrinkle . Overall, I’m happy with them for the price I paid and I wear them regularly . They’re not a steal or anything, but if you want a pair of sneakers, they’re a solid choice ...\nURL: https://medium.com/@tobiadey/adidas-stan-smith-review-on-feet-all-black-8aa99bc3046b\n---\n\nSENTIMENT SEARCH: Adidas Stan Smith reviews comfort quality durability customer reviews ratings\nRESULT 8:\nTitle: Trusted Reviews Adidas Stan Smith Review | Trusted Reviews\nContent: Complete Review of Adidas Stan Smith . Clean looking, Real iconic and Comfortable shoes. Not only for tennis but also casual sneakers of all time Adidas Stan Smith is Clean looking, Real iconic and Comfortable shoes. Not only for tennis but also casual sneakers of all time.\nURL: https://www.izreview.com/adidas-stan-smith-shoes-review/\n---\n\nSENTIMENT SEARCH: Adidas Stan Smith reviews comfort quality durability customer reviews ratings\nRESULT 9:\nTitle: SneakerLens Adidas Stan Smith Shoes Review - In-Depth Analysis | SneakerLens\nContent: June 15, 2025 - Fashion-conscious consumers seeking ... appreciating vegan materials ... The Adidas Stan Smith remains a style icon with unmatched versatility, earning its 4.2/5 rating primarily through design excellence and versatility....\nURL: https://www.sneakerlens.com/adidas-stan-smith-shoes-review/\n---\n\nSENTIMENT SEARCH: Adidas Stan Smith reviews comfort quality durability customer reviews ratings\nRESULT 10:\nTitle: Zappos Customer Reviews adidas Stan Smith\nContent: Very comfortable for walking, very good support . Classic shoe. My Adidas Gazelles are a full size smaller than my usual, but these are only half a size smaller than my usual.\nURL: https://www.zappos.com/product/review/8808872/page/5\n---\n\nSENTIMENT SEARCH: Adidas Stan Smith reviews comfort quality durability user experience feedback\nRESULT 1:\nTitle: Customer Reviews adidas Stan Smith\nContent: Good quality, true to original style with nice fit . Service and ease of ordering experience = 5 star shoe/experience. ... Comfort superb, I get compliments ...\nURL: https://www.zappos.com/product/review/8513559/page/75\n---\n\nSENTIMENT SEARCH: Adidas Stan Smith reviews comfort quality durability user experience feedback\nRESULT 2:\nTitle: In Review: Adidas Stan Smith Lux Sneakers\nContent: Feb 21, 2023 — The upgraded upper leather is nice enough , the new lining feels pretty good, and the insole is comfortable and supportive out of the box.\nURL: https://dappered.com/2023/02/in-review-adidas-stan-smith-lux-sneakers/\n---\n\nSENTIMENT SEARCH: Adidas Stan Smith reviews comfort quality durability user experience feedback\nRESULT 3:\nTitle: Adidas Stan Smith Review | 2025 real user experience on ...\nContent: May 17, 2025 — We will explore their aesthetics, comfort , pricing, and overall value, helping you decide if these sneakers are the right fit for your wardrobe.\nURL: https://www.lemon8-app.com/experience/adidas-stan-smith-review?region=us\n---\n\nSENTIMENT SEARCH: Adidas Stan Smith reviews comfort quality durability user experience feedback\nRESULT 4:\nTitle: adidas Originals Stan Smith White/White/Green - Shoes\nContent: After the lockdown started using again. In one month my feet were soaked, when I saw, the sole was completely destroyed, full of holes. Adidas should invest in ...\nURL: https://www.stylerunner.com/au/products/adidas-originals-stan-smith-fx5502?bvstate=pg:2/ct:r\n---\n\nSENTIMENT SEARCH: Adidas Stan Smith reviews comfort quality durability user experience feedback\nRESULT 5:\nTitle: adidas Originals Stan Smith Velcro Primegreen Reviews\nContent: This is my second pair of these. They are very comfortable and fit well . They also more or less pair with any clothes I decide to wear.\nURL: https://www.zappos.com/product/review/9486985/page/18\n---\n\nSENTIMENT SEARCH: Adidas Stan Smith reviews comfort quality durability user experience feedback\nRESULT 6:\nTitle: Adidas Stan Smith Shoes Review - In-Depth Analysis\nContent: Stan Smith shoes review (2025): Classic design meets sustainable materials . 4.2/5 from 241 users. Perfect for style, mixed durability. Is it right for you?\nURL: https://www.sneakerlens.com/adidas-stan-smith-shoes-review/\n---\n\nSENTIMENT SEARCH: Adidas Stan Smith reviews comfort quality durability user experience feedback\nRESULT 7:\nTitle: ADIDAS STAN SMITH BONEGA\nContent: Great fit and comfort ! ... Having slightly wider feet, these shoes fit in great and extremely comfortable for full day. Yes, I recommend this product.\nURL: https://www.brownsshoes.com/en/women/shoes/sneakers/product/adidas/stan-smith-bonega/262617.html?srsltid=AfmBOopkTwfF6ycBOozD-oH3Ud4ihAn2lsi3YLIqv4UQOe53um9IKJWM\n---\n\nSENTIMENT SEARCH: Adidas Stan Smith reviews comfort quality durability user experience feedback\nRESULT 8:\nTitle: Sneaker and Activewear | adidas US\nContent: Explore adidas sneakers for sports and daily wear. From versatile activewear to sporting goods and accessories for all ages and all levels.\nURL: https://www.adidas.com/us?msockid=1d13ebf809d867d20f74fdaf08776616\n---\n\nSENTIMENT SEARCH: Adidas Stan Smith reviews comfort quality durability user experience feedback\nRESULT 9:\nTitle: adidas | DICK'S Sporting Goods\nContent: Shop adidas shoes by sport, with shoes and cleats engineered for everything from football and baseball to basketball, running and golf. adidas shoes are built with a supportive but lightweight …\nURL: https://www.dickssportinggoods.com/s/brand-shop/adidas?msockid=1d13ebf809d867d20f74fdaf08776616\n---\n\nSENTIMENT SEARCH: Adidas Stan Smith reviews comfort quality durability user experience feedback\nRESULT 10:\nTitle: adidas Shoes, Apparel, & Accessories - Foot Locker\nContent: Shop the latest selection of adidas at Foot Locker. Find the hottest sneaker drops from brands like Jordan, Nike, Under Armour, New Balance, and a bunch more. Free shipping for FLX members.\nURL: https://www.footlocker.com/category/brands/adidas.html\n---\n\nSENTIMENT SEARCH: Adidas Stan Smith reviews comfort quality durability complaints issues problems\nRESULT 1:\nTitle: Sneaker and Activewear | adidas US\nContent: Explore adidas sneakers for sports and daily wear. From versatile activewear to sporting goods and accessories for all ages and all levels.\nURL: https://www.adidas.com/us?msockid=1d13ebf809d867d20f74fdaf08776616\n---\n\nSENTIMENT SEARCH: Adidas Stan Smith reviews comfort quality durability complaints issues problems\nRESULT 2:\nTitle: adidas | DICK'S Sporting Goods\nContent: Shop adidas shoes by sport, with shoes and cleats engineered for everything from football and baseball to basketball, running and golf. adidas shoes are built with a supportive but lightweight …\nURL: https://www.dickssportinggoods.com/s/brand-shop/adidas?msockid=1d13ebf809d867d20f74fdaf08776616\n---\n\nSENTIMENT SEARCH: Adidas Stan Smith reviews comfort quality durability complaints issues problems\nRESULT 3:\nTitle: adidas Shoes, Apparel, & Accessories - Foot Locker\nContent: Shop the latest selection of adidas at Foot Locker. Find the hottest sneaker drops from brands like Jordan, Nike, Under Armour, New Balance, and a bunch more. Free shipping for FLX members.\nURL: https://www.footlocker.com/category/brands/adidas.html\n---\n\nSENTIMENT SEARCH: Adidas Stan Smith reviews comfort quality durability complaints issues problems\nRESULT 4:\nTitle: Shop adidas Online - Nordstrom Rack\nContent: Find the latest selection of adidas in-store or online at Nordstrom. Shipping is always free and returns are accepted at any location. In-store pickup and alterations services available.\nURL: https://www.nordstromrack.com/brands/adidas?msockid=1d13ebf809d867d20f74fdaf08776616\n---\n\nSENTIMENT SEARCH: Adidas Stan Smith reviews comfort quality durability complaints issues problems\nRESULT 5:\nTitle: adidas Online Shop | adidas US\nContent: SHOP BY COLLECTION adicolor Premium Collaborations adidas by Stella McCartney Gazelle Originals Samba\nURL: https://www.adidas.com/us/welcome?msockid=1d13ebf809d867d20f74fdaf08776616\n---\n\nSENTIMENT SEARCH: Adidas Stan Smith reviews comfort quality durability complaints issues problems\nRESULT 6:\nTitle: adidas | Shoes, Apparel, Bags, & More | Zappos | Zappos.com\nContent: This collection features all your favorite classic adidas designs along with their latest trendsetting looks. With a variety of styles for men, women and kids, there’s something for everyone in our …\nURL: https://www.zappos.com/c/adidas?msockid=1d13ebf809d867d20f74fdaf08776616\n---\n\nSENTIMENT SEARCH: Adidas Stan Smith reviews comfort quality durability complaints issues problems\nRESULT 7:\nTitle: adidas Shoes | Curbside Pickup Available at DICK'S\nContent: Shop the complete collection of adidas sneakers, cleats and more at DICK'S Sporting Goods. Browse top-rated adidas shoes for any sport, including adidas Running Shoes, adidas Basketball …\nURL: https://www.dickssportinggoods.com/f/adidas-athletic-sneakers?msockid=1d13ebf809d867d20f74fdaf08776616\n---\n\nSENTIMENT SEARCH: Adidas Stan Smith reviews comfort quality durability complaints issues problems\nRESULT 8:\nTitle: Shop Shoes & Clothing Deals | adidas US\nContent: Find your adidas Shop at adidas.com. All styles and colors available in the official adidas online store.\nURL: https://www.adidas.com/us/shop?msockid=1d13ebf809d867d20f74fdaf08776616\n---\n\nSENTIMENT SEARCH: Adidas Stan Smith reviews comfort quality durability complaints issues problems\nRESULT 9:\nTitle: adidas | Foot Locker\nContent: Shop the latest selection of adidas at Foot Locker. Find the hottest sneaker drops from brands like adidas, Jordan, Nike, Under Armour, New Balance, and a bunch more.\nURL: https://www.footlocker.com/adidas.html\n---\n\nSENTIMENT SEARCH: Adidas Stan Smith reviews comfort quality durability complaints issues problems\nRESULT 10:\nTitle: Twitter . It’s what’s happening / Twitter\nContent: Official Twitter account of Adidas, sharing updates, promotions, and news about their products and brand.\nURL: https://twitter.com/adidas\n---\n"
}