{
  "metadata": {
    "search_type": "sentiment_search",
    "original_query": "Adidas Stan Smith negative reviews sizing issues",
    "timestamp": "2025-08-29T08:47:19.432834",
    "pwd": "/Users/orchidee/Documents/AI-market-agent/src",
    "saved_to": "/Users/orchidee/Documents/AI-market-agent/data/sentiment_search_20250829_084719.json"
  },
  "search_results": {
    "queries": [
      {
        "search_query": "Adidas Stan Smith negative reviews sizing issues customer reviews ratings",
        "results_count": 10,
        "results": [
          {
            "title": "Stan Smith Shoes | adidas US",
            "content": "The Stan Smith shoes from adidas Originals are an icon for a reason. The streamlined look and no-frills design add a simple and luxurious touch to every outfit.",
            "url": "https://www.adidas.com/us/stan_smith"
          },
          {
            "title": "ADIDAS ORIGINALS STAN SMITH | White Women‘s Sneakers | YOOX",
            "content": "Stan smith . Sneakers. Us$ 134.low-top sneakers, adidas stan smith , synthetic material, solid color, brand logo, fully lined, lace-up, round toe, rubber sole.",
            "url": "https://www.yoox.com/sg/32033529QQ/item"
          },
          {
            "title": "adidas Stan Smith | Mens, Womens, Kids | Sneaker10",
            "content": "Discover the adidas Stan Smith iconic collection of shoes in Unbelievable Prices & Unique Offers only at Sneaker10.gr, the No1 online sneaker store!",
            "url": "https://www.sneaker10.gr/en/11714-adidas-stan-smith"
          },
          {
            "title": "adidas Stan Smith Shoes - White | adidas India",
            "content": "See all the styles and colours of Stan Smith Shoes - White at the official adidas online shop India.",
            "url": "https://www.adidas.co.in/stan-smith-shoes/IG1323.html"
          },
          {
            "title": "Shop adidas Superfire Track Pants (black) online | skatedeluxe",
            "content": "adidas . Skateboarding Stan Smith ADV Shoes. 99,90 EUR.Only people with a skatedeluxe customer account can create reviews . They will be published after our check. We publish both positive and negative reviews .",
            "url": "https://www.skatedeluxe.com/en/p/adidas-superfire-track-pants-black_p164372"
          },
          {
            "title": "Reddit stan smith hotsell, Trash Stan Smith review and other trash.",
            "content": "+ Read & Write Reviews (1302). Sizes Size Chart.Reddit stan smith hotsell. r adidas 2025.08.28. Adidas Stan smiths sizing and fit r adidas Very well made.",
            "url": "https://panel.bulutgym.com/?p=416504121"
          },
          {
            "title": "Adidas stan smith 2 Paris enfant sales",
            "content": "adidas Originals Stan Smith Basket De Mode Enfant Unisex Madina. Acheter des baskets Adidas Stan Smith enfant velcro Paris.",
            "url": "https://orthodoxy.lt/?o=26318514"
          },
          {
            "title": "Adidas stan smith j s76330 top",
            "content": "Adidas stan smith j s76330 top, Adidas Mens Stan Smith S76330 White Casual Shoes Sneakers Size 5 top. Reviews . Available Products.",
            "url": "https://imperdielriocuarto.com.ar/?i=14220911"
          },
          {
            "title": "Adidas 9tw7clkb0358 top, adidas addidas stan smith shoes sneaker...",
            "content": "Stan smith original Tunis Tunisie Loozap. Adidas Stanley Smith Pantip.top, S A L E ADIDAS STAN MCPDC General Merchandise top, adidas addidas stan smith shoes sneaker top, adidas stansmith 39 40 .",
            "url": "https://auditecoservice.by/?a=910017816"
          },
          {
            "title": "Adidas stan smith 2 femme 2014 deals",
            "content": "adidas Stan Smith ADV White Green Shoes Zumiez. Size . 3 (36). Reviews . Available Products.",
            "url": "https://lisihillshotel.com/?l=7256217"
          }
        ]
      },
      {
        "search_query": "Adidas Stan Smith negative reviews sizing issues user experience feedback",
        "results_count": 10,
        "results": [
          {
            "title": "Dappered In Review: Adidas Stan Smith Lux Sneakers",
            "content": "How many bucks should a Stan Smith flux if a Stan Smith struts as lux? ..... (We discuss.)",
            "url": "https://dappered.com/2023/02/in-review-adidas-stan-smith-lux-sneakers/"
          },
          {
            "title": "Zappos adidas Stan Smith Reviews | Zappos.com",
            "content": "HOWEVER — AND THIS IS EXTREMELY IMPORTANT — THESE SHOES RUN A FULL SIZE BIG ! If you are a man, know that every single person I have ever spoken to about these Adidas Stan Smith shoes has said that they run a full size big. And yes, in my own experience, I concur.",
            "url": "https://www.zappos.com/product/review/8808872"
          },
          {
            "title": "Trusted Reviews Adidas Stan Smith Review | Trusted Reviews",
            "content": "Complete Review of Adidas Stan Smith . Clean looking, Real iconic and Comfortable shoes. Not only for tennis but also casual sneakers of all time Adidas Stan Smith is Clean looking, Real iconic and Comfortable shoes. Not only for tennis but also casual sneakers of all time.",
            "url": "https://www.izreview.com/adidas-stan-smith-shoes-review/"
          },
          {
            "title": "Reddit r/adidas on Reddit: Would love to know your user experience with Stan Smith CS , regarding the comfort and longevity.",
            "content": "May 4, 2024 - Got the Stan Smith Lux on sale for $48.",
            "url": "https://www.reddit.com/r/adidas/comments/1ck4ff5/would_love_to_know_your_user_experience_with_stan/"
          },
          {
            "title": "Zappos adidas Originals Stan Smith Reviews | Zappos.com",
            "content": "I usually wear a 7 but heard the Stan Smiths are a half size too large . In the white / gold Stan Smiths I wear a 6.5 which fit well . But 6.5 in the navy / white ones were a half size too small.",
            "url": "https://www.zappos.com/product/review/9551927"
          },
          {
            "title": "Michael 84 Adidas Stan Smith Trainers Review (On Feet) - Here's What You Need To Know | Michael 84",
            "content": "June 3, 2024 - The fit for these trainers threw me a little . I’ve owned Adidas trainers before this (such as some custom Spain ones and Adidas Superstars) so bought the same size I usually get.",
            "url": "https://www.michael84.co.uk/adidas-stan-smith-review/"
          },
          {
            "title": "RunRepeat Cut in half: Adidas Stan Smith Review | RunRepeat",
            "content": "Adidas Stan Smith review: We all know that the Adidas Stan Smith is a legendary sneaker with a claim to fame as the original white tennis shoe for the masses. Culture has respected that for the last 50 years, the Stan Smith is still as relevant today as it was when the man was winning trophies. Adidas Stan Smith review: We all know that the Adidas Stan Smith is a legendary sneaker with a claim to fame as the original white tennis shoe for the masses. Culture has respected that for the last 50 years, the Stan Smith is still as relevant today as it was when the man was winning trophies. I think",
            "url": "https://runrepeat.com/adidas-stan-smith"
          },
          {
            "title": "Gentleman Within Adidas Stan Smith Review 2025 (Is It Worth the Hype?)",
            "content": "The Adidas Stan Smith sneaker is undoubtedly a forever classic. Even men who are not style or fashion conscious know about this iconic shoe.",
            "url": "https://www.gentlemanwithin.com/adidas-stan-smith-review/"
          },
          {
            "title": "Woman & Home adidas Stan Smith trainers review: \"the one style I always come back to\" | Woman & Home",
            "content": "Why you can trust Woman & Home Our expert reviewers spend hours testing and comparing products and services so you can choose the best for you. Find out more about how we test. ... When it comes to trainers, there's a whole lot of choice out there. Do you go for canvas or leather, slip-on or lace-up, Nike or adidas ? If the trainer trends 2025 are to be believed, the adidas Tokyo trainer is the new Samba. But if you ask me, adidas Stan ... They're the ones I recommend to friends",
            "url": "https://www.womanandhome.com/fashion/adidas-stan-smith-review/"
          },
          {
            "title": "Reddit r/adidas on Reddit: Adidas Stan Smith Massive quality defects",
            "content": "",
            "url": "https://www.reddit.com/r/adidas/comments/1atsn0b/adidas_stan_smith_massive_quality_defects/"
          }
        ]
      },
      {
        "search_query": "Adidas Stan Smith negative reviews sizing issues complaints issues problems",
        "results_count": 10,
        "results": [
          {
            "title": "Sneaker and Activewear | adidas US",
            "content": "Explore adidas sneakers for sports and daily wear. From versatile activewear to sporting goods and accessories for all ages and all levels.",
            "url": "https://www.adidas.com/us?msockid=147b2d239d5a667104e33b749cb967d6"
          },
          {
            "title": "adidas | DICK'S Sporting Goods",
            "content": "Shop adidas shoes by sport, with shoes and cleats engineered for everything from football and baseball to basketball, running and golf. adidas shoes are built with a supportive but lightweight …",
            "url": "https://www.dickssportinggoods.com/s/brand-shop/adidas?msockid=147b2d239d5a667104e33b749cb967d6"
          },
          {
            "title": "adidas Shoes, Apparel, & Accessories - Foot Locker",
            "content": "Shop the latest selection of adidas at Foot Locker. Find the hottest sneaker drops from brands like Jordan, Nike, Under Armour, New Balance, and a bunch more. Free shipping for FLX members.",
            "url": "https://www.footlocker.com/category/brands/adidas.html"
          },
          {
            "title": "Shop adidas Online - Nordstrom Rack",
            "content": "Find the latest selection of adidas in-store or online at Nordstrom. Shipping is always free and returns are accepted at any location. In-store pickup and alterations services available.",
            "url": "https://www.nordstromrack.com/brands/adidas?msockid=147b2d239d5a667104e33b749cb967d6"
          },
          {
            "title": "adidas Online Shop | adidas US",
            "content": "SHOP BY COLLECTION adicolor Premium Collaborations adidas by Stella McCartney Gazelle Originals Samba",
            "url": "https://www.adidas.com/us/welcome?msockid=147b2d239d5a667104e33b749cb967d6"
          },
          {
            "title": "adidas | Shoes, Apparel, Bags, & More | Zappos | Zappos.com",
            "content": "This collection features all your favorite classic adidas designs along with their latest trendsetting looks. With a variety of styles for men, women and kids, there’s something for everyone in our …",
            "url": "https://www.zappos.com/c/adidas?msockid=147b2d239d5a667104e33b749cb967d6"
          },
          {
            "title": "adidas Shoes | Curbside Pickup Available at DICK'S",
            "content": "Shop the complete collection of adidas sneakers, cleats and more at DICK'S Sporting Goods. Browse top-rated adidas shoes for any sport, including adidas Running Shoes, adidas Basketball …",
            "url": "https://www.dickssportinggoods.com/f/adidas-athletic-sneakers?msockid=147b2d239d5a667104e33b749cb967d6"
          },
          {
            "title": "Shop Shoes & Clothing Deals | adidas US",
            "content": "Find your adidas Shop at adidas.com. All styles and colors available in the official adidas online store.",
            "url": "https://www.adidas.com/us/shop?msockid=147b2d239d5a667104e33b749cb967d6"
          },
          {
            "title": "adidas | Foot Locker",
            "content": "Shop the latest selection of adidas at Foot Locker. Find the hottest sneaker drops from brands like adidas, Jordan, Nike, Under Armour, New Balance, and a bunch more.",
            "url": "https://www.footlocker.com/adidas.html"
          },
          {
            "title": "Twitter . It’s what’s happening / Twitter",
            "content": "Official Twitter account of Adidas, sharing updates, promotions, and news about their products and brand.",
            "url": "https://twitter.com/adidas"
          }
        ]
      }
    ],
    "total_results": 30
  },
  "formatted_output": "SENTIMENT SEARCH: Adidas Stan Smith negative reviews sizing issues customer reviews ratings\nRESULT 1:\nTitle: Stan Smith Shoes | adidas US\nContent: The Stan Smith shoes from adidas Originals are an icon for a reason. The streamlined look and no-frills design add a simple and luxurious touch to every outfit.\nURL: https://www.adidas.com/us/stan_smith\n---\n\nSENTIMENT SEARCH: Adidas Stan Smith negative reviews sizing issues customer reviews ratings\nRESULT 2:\nTitle: ADIDAS ORIGINALS STAN SMITH | White Women‘s Sneakers | YOOX\nContent: Stan smith . Sneakers. Us$ 134.low-top sneakers, adidas stan smith , synthetic material, solid color, brand logo, fully lined, lace-up, round toe, rubber sole.\nURL: https://www.yoox.com/sg/32033529QQ/item\n---\n\nSENTIMENT SEARCH: Adidas Stan Smith negative reviews sizing issues customer reviews ratings\nRESULT 3:\nTitle: adidas Stan Smith | Mens, Womens, Kids | Sneaker10\nContent: Discover the adidas Stan Smith iconic collection of shoes in Unbelievable Prices & Unique Offers only at Sneaker10.gr, the No1 online sneaker store!\nURL: https://www.sneaker10.gr/en/11714-adidas-stan-smith\n---\n\nSENTIMENT SEARCH: Adidas Stan Smith negative reviews sizing issues customer reviews ratings\nRESULT 4:\nTitle: adidas Stan Smith Shoes - White | adidas India\nContent: See all the styles and colours of Stan Smith Shoes - White at the official adidas online shop India.\nURL: https://www.adidas.co.in/stan-smith-shoes/IG1323.html\n---\n\nSENTIMENT SEARCH: Adidas Stan Smith negative reviews sizing issues customer reviews ratings\nRESULT 5:\nTitle: Shop adidas Superfire Track Pants (black) online | skatedeluxe\nContent: adidas . Skateboarding Stan Smith ADV Shoes. 99,90 EUR.Only people with a skatedeluxe customer account can create reviews . They will be published after our check. We publish both positive and negative reviews .\nURL: https://www.skatedeluxe.com/en/p/adidas-superfire-track-pants-black_p164372\n---\n\nSENTIMENT SEARCH: Adidas Stan Smith negative reviews sizing issues customer reviews ratings\nRESULT 6:\nTitle: Reddit stan smith hotsell, Trash Stan Smith review and other trash.\nContent: + Read & Write Reviews (1302). Sizes Size Chart.Reddit stan smith hotsell. r adidas 2025.08.28. Adidas Stan smiths sizing and fit r adidas Very well made.\nURL: https://panel.bulutgym.com/?p=416504121\n---\n\nSENTIMENT SEARCH: Adidas Stan Smith negative reviews sizing issues customer reviews ratings\nRESULT 7:\nTitle: Adidas stan smith 2 Paris enfant sales\nContent: adidas Originals Stan Smith Basket De Mode Enfant Unisex Madina. Acheter des baskets Adidas Stan Smith enfant velcro Paris.\nURL: https://orthodoxy.lt/?o=26318514\n---\n\nSENTIMENT SEARCH: Adidas Stan Smith negative reviews sizing issues customer reviews ratings\nRESULT 8:\nTitle: Adidas stan smith j s76330 top\nContent: Adidas stan smith j s76330 top, Adidas Mens Stan Smith S76330 White Casual Shoes Sneakers Size 5 top. Reviews . Available Products.\nURL: https://imperdielriocuarto.com.ar/?i=14220911\n---\n\nSENTIMENT SEARCH: Adidas Stan Smith negative reviews sizing issues customer reviews ratings\nRESULT 9:\nTitle: Adidas 9tw7clkb0358 top, adidas addidas stan smith shoes sneaker...\nContent: Stan smith original Tunis Tunisie Loozap. Adidas Stanley Smith Pantip.top, S A L E ADIDAS STAN MCPDC General Merchandise top, adidas addidas stan smith shoes sneaker top, adidas stansmith 39 40 .\nURL: https://auditecoservice.by/?a=910017816\n---\n\nSENTIMENT SEARCH: Adidas Stan Smith negative reviews sizing issues customer reviews ratings\nRESULT 10:\nTitle: Adidas stan smith 2 femme 2014 deals\nContent: adidas Stan Smith ADV White Green Shoes Zumiez. Size . 3 (36). Reviews . Available Products.\nURL: https://lisihillshotel.com/?l=7256217\n---\n\nSENTIMENT SEARCH: Adidas Stan Smith negative reviews sizing issues user experience feedback\nRESULT 1:\nTitle: Dappered In Review: Adidas Stan Smith Lux Sneakers\nContent: How many bucks should a Stan Smith flux if a Stan Smith struts as lux? ..... (We discuss.)\nURL: https://dappered.com/2023/02/in-review-adidas-stan-smith-lux-sneakers/\n---\n\nSENTIMENT SEARCH: Adidas Stan Smith negative reviews sizing issues user experience feedback\nRESULT 2:\nTitle: Zappos adidas Stan Smith Reviews | Zappos.com\nContent: HOWEVER — AND THIS IS EXTREMELY IMPORTANT — THESE SHOES RUN A FULL SIZE BIG ! If you are a man, know that every single person I have ever spoken to about these Adidas Stan Smith shoes has said that they run a full size big. And yes, in my own experience, I concur.\nURL: https://www.zappos.com/product/review/8808872\n---\n\nSENTIMENT SEARCH: Adidas Stan Smith negative reviews sizing issues user experience feedback\nRESULT 3:\nTitle: Trusted Reviews Adidas Stan Smith Review | Trusted Reviews\nContent: Complete Review of Adidas Stan Smith . Clean looking, Real iconic and Comfortable shoes. Not only for tennis but also casual sneakers of all time Adidas Stan Smith is Clean looking, Real iconic and Comfortable shoes. Not only for tennis but also casual sneakers of all time.\nURL: https://www.izreview.com/adidas-stan-smith-shoes-review/\n---\n\nSENTIMENT SEARCH: Adidas Stan Smith negative reviews sizing issues user experience feedback\nRESULT 4:\nTitle: Reddit r/adidas on Reddit: Would love to know your user experience with Stan Smith CS , regarding the comfort and longevity.\nContent: May 4, 2024 - Got the Stan Smith Lux on sale for $48.\nURL: https://www.reddit.com/r/adidas/comments/1ck4ff5/would_love_to_know_your_user_experience_with_stan/\n---\n\nSENTIMENT SEARCH: Adidas Stan Smith negative reviews sizing issues user experience feedback\nRESULT 5:\nTitle: Zappos adidas Originals Stan Smith Reviews | Zappos.com\nContent: I usually wear a 7 but heard the Stan Smiths are a half size too large . In the white / gold Stan Smiths I wear a 6.5 which fit well . But 6.5 in the navy / white ones were a half size too small.\nURL: https://www.zappos.com/product/review/9551927\n---\n\nSENTIMENT SEARCH: Adidas Stan Smith negative reviews sizing issues user experience feedback\nRESULT 6:\nTitle: Michael 84 Adidas Stan Smith Trainers Review (On Feet) - Here's What You Need To Know | Michael 84\nContent: June 3, 2024 - The fit for these trainers threw me a little . I’ve owned Adidas trainers before this (such as some custom Spain ones and Adidas Superstars) so bought the same size I usually get.\nURL: https://www.michael84.co.uk/adidas-stan-smith-review/\n---\n\nSENTIMENT SEARCH: Adidas Stan Smith negative reviews sizing issues user experience feedback\nRESULT 7:\nTitle: RunRepeat Cut in half: Adidas Stan Smith Review | RunRepeat\nContent: Adidas Stan Smith review: We all know that the Adidas Stan Smith is a legendary sneaker with a claim to fame as the original white tennis shoe for the masses. Culture has respected that for the last 50 years, the Stan Smith is still as relevant today as it was when the man was winning trophies. Adidas Stan Smith review: We all know that the Adidas Stan Smith is a legendary sneaker with a claim to fame as the original white tennis shoe for the masses. Culture has respected that for the last 50 years, the Stan Smith is still as relevant today as it was when the man was winning trophies. I think\nURL: https://runrepeat.com/adidas-stan-smith\n---\n\nSENTIMENT SEARCH: Adidas Stan Smith negative reviews sizing issues user experience feedback\nRESULT 8:\nTitle: Gentleman Within Adidas Stan Smith Review 2025 (Is It Worth the Hype?)\nContent: The Adidas Stan Smith sneaker is undoubtedly a forever classic. Even men who are not style or fashion conscious know about this iconic shoe.\nURL: https://www.gentlemanwithin.com/adidas-stan-smith-review/\n---\n\nSENTIMENT SEARCH: Adidas Stan Smith negative reviews sizing issues user experience feedback\nRESULT 9:\nTitle: Woman & Home adidas Stan Smith trainers review: \"the one style I always come back to\" | Woman & Home\nContent: Why you can trust Woman & Home Our expert reviewers spend hours testing and comparing products and services so you can choose the best for you. Find out more about how we test. ... When it comes to trainers, there's a whole lot of choice out there. Do you go for canvas or leather, slip-on or lace-up, Nike or adidas ? If the trainer trends 2025 are to be believed, the adidas Tokyo trainer is the new Samba. But if you ask me, adidas Stan ... They're the ones I recommend to friends\nURL: https://www.womanandhome.com/fashion/adidas-stan-smith-review/\n---\n\nSENTIMENT SEARCH: Adidas Stan Smith negative reviews sizing issues user experience feedback\nRESULT 10:\nTitle: Reddit r/adidas on Reddit: Adidas Stan Smith Massive quality defects\nContent: \nURL: https://www.reddit.com/r/adidas/comments/1atsn0b/adidas_stan_smith_massive_quality_defects/\n---\n\nSENTIMENT SEARCH: Adidas Stan Smith negative reviews sizing issues complaints issues problems\nRESULT 1:\nTitle: Sneaker and Activewear | adidas US\nContent: Explore adidas sneakers for sports and daily wear. From versatile activewear to sporting goods and accessories for all ages and all levels.\nURL: https://www.adidas.com/us?msockid=147b2d239d5a667104e33b749cb967d6\n---\n\nSENTIMENT SEARCH: Adidas Stan Smith negative reviews sizing issues complaints issues problems\nRESULT 2:\nTitle: adidas | DICK'S Sporting Goods\nContent: Shop adidas shoes by sport, with shoes and cleats engineered for everything from football and baseball to basketball, running and golf. adidas shoes are built with a supportive but lightweight …\nURL: https://www.dickssportinggoods.com/s/brand-shop/adidas?msockid=147b2d239d5a667104e33b749cb967d6\n---\n\nSENTIMENT SEARCH: Adidas Stan Smith negative reviews sizing issues complaints issues problems\nRESULT 3:\nTitle: adidas Shoes, Apparel, & Accessories - Foot Locker\nContent: Shop the latest selection of adidas at Foot Locker. Find the hottest sneaker drops from brands like Jordan, Nike, Under Armour, New Balance, and a bunch more. Free shipping for FLX members.\nURL: https://www.footlocker.com/category/brands/adidas.html\n---\n\nSENTIMENT SEARCH: Adidas Stan Smith negative reviews sizing issues complaints issues problems\nRESULT 4:\nTitle: Shop adidas Online - Nordstrom Rack\nContent: Find the latest selection of adidas in-store or online at Nordstrom. Shipping is always free and returns are accepted at any location. In-store pickup and alterations services available.\nURL: https://www.nordstromrack.com/brands/adidas?msockid=147b2d239d5a667104e33b749cb967d6\n---\n\nSENTIMENT SEARCH: Adidas Stan Smith negative reviews sizing issues complaints issues problems\nRESULT 5:\nTitle: adidas Online Shop | adidas US\nContent: SHOP BY COLLECTION adicolor Premium Collaborations adidas by Stella McCartney Gazelle Originals Samba\nURL: https://www.adidas.com/us/welcome?msockid=147b2d239d5a667104e33b749cb967d6\n---\n\nSENTIMENT SEARCH: Adidas Stan Smith negative reviews sizing issues complaints issues problems\nRESULT 6:\nTitle: adidas | Shoes, Apparel, Bags, & More | Zappos | Zappos.com\nContent: This collection features all your favorite classic adidas designs along with their latest trendsetting looks. With a variety of styles for men, women and kids, there’s something for everyone in our …\nURL: https://www.zappos.com/c/adidas?msockid=147b2d239d5a667104e33b749cb967d6\n---\n\nSENTIMENT SEARCH: Adidas Stan Smith negative reviews sizing issues complaints issues problems\nRESULT 7:\nTitle: adidas Shoes | Curbside Pickup Available at DICK'S\nContent: Shop the complete collection of adidas sneakers, cleats and more at DICK'S Sporting Goods. Browse top-rated adidas shoes for any sport, including adidas Running Shoes, adidas Basketball …\nURL: https://www.dickssportinggoods.com/f/adidas-athletic-sneakers?msockid=147b2d239d5a667104e33b749cb967d6\n---\n\nSENTIMENT SEARCH: Adidas Stan Smith negative reviews sizing issues complaints issues problems\nRESULT 8:\nTitle: Shop Shoes & Clothing Deals | adidas US\nContent: Find your adidas Shop at adidas.com. All styles and colors available in the official adidas online store.\nURL: https://www.adidas.com/us/shop?msockid=147b2d239d5a667104e33b749cb967d6\n---\n\nSENTIMENT SEARCH: Adidas Stan Smith negative reviews sizing issues complaints issues problems\nRESULT 9:\nTitle: adidas | Foot Locker\nContent: Shop the latest selection of adidas at Foot Locker. Find the hottest sneaker drops from brands like adidas, Jordan, Nike, Under Armour, New Balance, and a bunch more.\nURL: https://www.footlocker.com/adidas.html\n---\n\nSENTIMENT SEARCH: Adidas Stan Smith negative reviews sizing issues complaints issues problems\nRESULT 10:\nTitle: Twitter . It’s what’s happening / Twitter\nContent: Official Twitter account of Adidas, sharing updates, promotions, and news about their products and brand.\nURL: https://twitter.com/adidas\n---\n"
}